,Comments
0,"
##If this submission makes you go ""Hol'Up"", **UPVOTE** this comment!

##If this submission does not make you go ""Hol'Up"", **DOWNVOTE** this comment!

---

Whilst you're here, /u/NachosLunatic, why not join our [public discord server](https://discord.gg/holup) or play on our [public Minecraft server](https://discord.gg/DTqSDS8C3T)?"
1,Does the carpet match the drapes? Next question do black people shoot black cum and do Mexicans shoot tapatio? This poster brings up so many questions!
2,No because the grinch isnt a human its the Grinch and maybe his species has Green coom
3,Do Indians have curry
4,Oh yeah I know he's not human he is a Sasquatch but I didn't know the color of their Fur delineated their color of their sperm
5,"That depends on are we talking about the ones that have extensive culture, immense cuisine and Rich history that spans thousands of years or ""the thank you come again"" people lol"
6,Well it may who knows im pretty sure you havent been able to study em
7,Lol I like your confidence in that
