,Comments
0,"
##If this submission makes you go ""Hol'Up"", **UPVOTE** this comment!

##If this submission does not make you go ""Hol'Up"", **DOWNVOTE** this comment!

---

Whilst you're here, /u/saniye_man98, why not join our [public discord server](https://discord.gg/holup) or play on our [public Minecraft server](https://discord.gg/DTqSDS8C3T)?"
1,Free booze?  Sign me up!
2,"Yo I'm in key largo rn and I have to kill the joke, these fuckin people are amazing. I've tried talking to every single person within my sphincter and every single human has been happy relaxed, laid back and cool af. Wish the weed was legal down hurre tho

e. *Sphere. fuck"
3,Never have I been so offended by something I 100% agree with
4,there should be a superhero called Florida-Man whose superpower is random bullshit
5,There are stupid people everywhere but Florida has public court records. So it’s in the open
6,Seattle could make the list.
7,Little racist?
8,You think Flo Rida favours Florida as well as Floridians?
9,"Pick a state, any state."
10,Ever been to a Phish concert?
11,It’s pronounced Floriduhhh
12,I was thinking the same thing but it’s called Washington D.C…..
13,"There are plenty of those here in Australia. Mostly pub, clubs and any event involving large groups of people."
14,Damn. He got a point tho
15,"Ngl, I would def pay to see this place. Not Florida of course."
16,I see your Florida and raise you Kentucky
17,"It's where the parties at? Don't like lockdowns and Mask mandates? We are open and booze is flowing. P.s. it's hot, saw a man in a red robe burst into flames."
18,It's called stop letting weirdos move to Florida
19,The dumb ass ppl yall talking about are always crackheads which are everywhere and out of towners
20,Not wrong...
21,"
Weed was legal hurray tho"
22,"Curious, how many people fit in your sphincter?"
23,Lol😅🤣
24,Super heroes
25,You can’t be racist against Floridians
26,Found the Floridian
27,"One of the smoler racists was, in fact, adolph Hintler who stood a robust 5 foot 9 (not shaming short kings)"
28,No. Are they good? I'd love to be in a stadium with 20k other people chilling to bounce around the room. That song is fresh af and it's like 30 years old
29,Thats the national circus bruh
30,"Interestingly enough the regular person can fit a racoon in there, this guy can fit at least 12, and that's tight for him..."
31,"And why are they all still there? Sounds like a hostage situation, I’m calling for backup-"
32,Especially not just a little bit
33,Not from Florida but it does say white people
34,"5' 9 ain't that short tho, isn't that the average"
35,"Yes, you should go next summer. Learn more songs, you'll have a much better time."
36,"Man, fetishes are getting weird. I've heard of the gerbil thing but a raccoon? HFS"
37,"SWAT team raids u/buckzer0 sphincter, it's a total dis-ass-ter"
38,"While assumptions and stereotypes about white people do exist, this is considered racial prejudice, not racism. Racial prejudice refers to a set of discriminatory or derogatory attitudes based on assumptions derived from perceptions about race and/or skin colour. Thus, racial prejudice can indeed be directed at white people (e.g., “White people can’t dance”) but is not considered racism because of the systemic relationship to power. When backed with power, prejudice results in acts of discrimination and oppression against groups or individuals."
39,Lololol I'm familiar with the band lol
40,Oh you should see the things people do with horses...
41,"Why'd we come up with the term ""systematic racism"" if racism is already systematic by definition? Oh that's right, it's because you're changing the definition of racism."
42,Thanks! Now I don't have to Google synonyms for racism
