,Comments
0,"
##If this submission makes you go ""Hol'Up"", **UPVOTE** this comment!

##If this submission does not make you go ""Hol'Up"", **DOWNVOTE** this comment!

---

Whilst you're here, /u/Kingkunta87, why not join our [public discord server](https://discord.gg/holup) or play on our [public Minecraft server](https://discord.gg/DTqSDS8C3T)?"
1,He's holding the camera backwards
2,No wonder he used to always wear gloves with that monster hand.
3,"I was like “so, what’s the big dea… ah!”"
4,Blind man with camera… makes me Wonder
5,Michael looks like he could palm a toddlers head and hold them over a balcony with ease…
6,This one is frameable for a bar!
7,Well good thing he’s blind cuz the reflection from the flash would’ve seared his retinas like bacon.
8,Holy hell that is a huge hand
9,"Although it’s mainly just his hand being viewed in a weird angle, he did have hella big hands"
