,Comments
0,"
##If this submission makes you go ""Hol'Up"", **UPVOTE** this comment!

##If this submission does not make you go ""Hol'Up"", **DOWNVOTE** this comment!

---

Whilst you're here, /u/overaveragenumberten, why not join our [public discord server](https://discord.gg/holup) or play on our [public Minecraft server](https://discord.gg/DTqSDS8C3T)?"
1,Florida man arrested after calling 911 for booze and ice cream
2,"Florida Man Accused Of Decapitating Roommate, Tells Cops ""Things Got A Little Carried Away"""
3,Florida man with no arms arrested for stabbing Chicago tourist.
4,"Florida man jumps into crocodile pit, gets bit. Claims he was held captive."
5,"Mine is

Florida man steals alligator from golf course, tries ‘teaching it a lesson’ by throwing it on roof of bar"
6,Florida Man uses alligator to shotgun a beer while cranking Skynyrd
7,"Florida man stole truck, attempted to break into military base to warn of fight between aliens and dragons"
8,Florida Man charged with accidentally shooting bear that was trying to steal his trash.
9,"""Florida man who carried alligator into liquor store doesn't remember the incident"".

Fairly Floriday enough."
10,"**Florida Man Dubbed the 'Diaper Bandit' Arrested After Repeatedly Trying to Steal Diapers From Local Stores**

June 8"
11,"Florida man steals Walt Disney security clothes, then steals R2D2"
12,"I'm sorry but I ran into this and have to post it. ""Florida man claims bags of cocaine, meth found wrapped around penis aren't his""

![gif](giphy|10JhviFuU2gWD6)"
13,"A Florida man is facing charges as police say he stole an alligator and attempted to throw it on a roof.
His name was Bubba!!"
14,"Urine trouble: Florida man takes leak in store’s ‘beer cave,’ police say
$113.36 worth of beer damaged, police say"
15,He was just trying to show her what the texture should have been
16,Mine was Florida man pulls gun at Starbucks over cream cheese
17,Florida man drops stolen TV from getaway scooter…. Oops
18,[http://www.thesmokinggun.com/buster/florida/strange-dance-at-mcdonalds-739506](http://www.thesmokinggun.com/buster/florida/strange-dance-at-mcdonalds-739506)
19,">Brave Florida man serves up hot dog lunch for alligators straight from his mouth.
 
Yep"
20,"[bruh](https://www.winknews.com › ...
Police: Naked Florida man drove with wires on penis - WINK News)"
21,"Even more of a reason to hate my birthday, something about miniature horses."
22,Florida Man Allegedly Stole Pool Floats From Homes to ‘Stop Himself From Raping Women'
23,"DECEMBER 3, 2018 Florida Man Arrested After Offering Undercover Cop A Hamburger In Exchange For Sex Act"
24,Florida man punches ATM for giving too much cash.
25,Florida Man charged with battery after slapping girlfriend with cheeseburger
26,"
Naked Florida man chases couple around Chick-fil-A parking lot"
27,Florida man accused of bizarre crime spree that included trying to kiss an elderly woman
28,Florida man arrested after mistaking a corpse for a April fools prank and throwing it in the dumpster
29,[https://www.miaminewtimes.com/news/another-drugged-out-florida-man-gets-naked-and-bites-off-a-chunk-of-human-flesh-6525615](https://www.miaminewtimes.com/news/another-drugged-out-florida-man-gets-naked-and-bites-off-a-chunk-of-human-flesh-6525615)
30,Florida man arrested for throwing sausages at his mom
31,"Florida Man Confesses To Killing Grandfather, Pulls Human Ears From Pocket During Questioning"
32,Florida man sprays girlfriend with roach spray.
33,Most of them are made up.
34,"BRADENTON, Fla. — Police in Florida are looking for a suspect accused of breaking into a home and sucking on a sleeping man's toes"
35,Florida Man Arrested By Police After Demanding Cash and Donuts From Krispy Kreme
36,"""Florida man suspected of smelling woman's feet at library leads police on scooter chase"""
37,"Florida man ran naked through airport screaming about a bomb.

Also 
Florida man wearing plastic bag as t-shirt accused of running from deputies."
38,"Yells at weather man ""DICS OUT FOR HARAMBE"""
39,Florida man caught with a pecker in his hand and a pickle in his…
40,Florida man sentenced to jail and moral therapy for attacking a Minion
41,"
Florida Man Displayed Gun After Learning Delray Beach McDonald's Had Broken Ice Cream Machine: Cops"
42,Mine is stupid: “Florida man sees alligators mating” or something similar.
43,Florida man arrested after spraying people with fire extinguisher at Walmart
44,Florida man tried to enter Patrick Space Force Base to warn of aliens vs. dragons
45,"""Florida mab believed he was half-man, half-dog during attack"" - March 29"
46,"Mine is:

Florida man charged with pouring ketchup on girlfriend"
47,"Florida man, 70, slams child because playground was too noisy"
48,"Florida Man Dressed As Cop Pulls Over Real Deputy

(July 5)"
49,"""Florida man punches Jimmy John's employee because his sandwich took too long""."
50,Florida Man Arrested for Pleasuring Himself With Ice Pack in Front of First Responders: Police
51,Florida man accused of stealing crossbow by stuffing it down his pants
52,Florida man arrested after dining on spaghetti with his bare hands.
53,Florida man displayed gun after learning Delray Beach McDonald’s ice cream machine was broken
54,Florida man throws pizza at dad after finding out he helped deliver him at birth.
55,Florida man invites police to smoke pot while showing off his marijuana plant
56,A Florida man has been arrested for pleasuring himself with an ice pack while first responders were on-call to assist him
57,Florida man known as ‘The Monkey Whisperer’ arrested for illegally selling primates
58,"Florida Man Steals Elderly Woman's Purse, Runs Her Over in McDonald's Parking Lot"
59,Florida man throws baby at deputies after high-speed chase
60,Florida Man Mistakenly Shoots and Kills Son-in-Law in Birthday Surprise Gone Wrong
61,Florida man claiming to be Alice in Wonderland says ‘hookah-smoking caterpillar’ told him to destroy liquor store with forklift:
62,"Florida man arrested after allegedly attacking victim with ski pole, knocking out teeth"
63,Florida man commits murder over imaginary girlfriend
64,Drunk Florida Man Tries to Use Taco as ID After His Car Catches Fire at Taco Bell
65,"""Urine trouble: Florida man takes leak in store’s ‘beer cave, police say"""
66,"Naked Florida man breaks into someone's house, and was found in the bathtub by the homeowner."
67,https://www.google.com/amp/s/www.cbsnews.com/amp/miami/news/busted-in-the-buff-naked-florida-man-found-in-bathtub-after-break-in/
68,Florida man arrested after witnesses said he practiced karate on swans
69,This is great
70,Florida man throws baby at deputy following wild high speed chase
71,Florida man handing out marijuana to passersby because it was Christmas.
72,"Florida man with “half a head” arrested on attempted murder, arson charges"
73,"Florida man allegedly stole pool floats from homes 'to stop himself raping women'

https://www.google.com/amp/s/www.nbcmiami.com/news/local/florida-man-allegedly-stole-pool-floats-from-homes-to-stop-himself-from-raping-women-police/128798/%3famp=1"
74,"Florida man found with live grenade, clown mannequin inside truck."
75,Florida man accused of pouring beer in gator's mouth after enticing reptile to bite his arm
76,"Florida man found with live grenade, clown mannequin inside truck."
77,Man found pats out in CVS parking lot after long day of cooking meth in his truck.
78,Florida man got slapped by big mouth billy bass
79,Florida man caught on camera licking doorbell
80,Florida man arrested after dumping heaps of dirt on girlfriend’s car
81,Florida man accused of handing out marijuana to passersby ‘because it was Christmas’
82,"Florida man arrested for stealing an alligator and attempted to throw it on the roof

Florida man arrested for going on a sledge hammer hit spree which caused thousands dollar worth of damagebecause ""demons"" tormented him 

Homeless Florida man caught wandering around Jacksonwille beach carrying a large rattle snake claiming to be a ""agent of God""

Florida man faces charges after knocking on a woman's door 3am and punch her in the face and then runs away

Florida man charged with DUI manslaughter in high speed

And at last but not on my birthday but it was something else

Florida man who allegedly harassed his family using cold play lyrics and threatens them by saying his ""Nazi prisons associates"" would beat them up was convinced to end his standoff peacefully with the police for a slice of Pizza

You can't literally come up with the last one"
83,Tried to buy McDonalds with a bag of weed.
84,"Florida man attacks roommate who woke him up for breakfast, deputies say"
85,"Florida man high on flakka attacked officer, said he was God, had sex with tree, police say"
86,"I’ve got a couple different ones, but the most recent one is

Florida man arrested in broomstick, machete and biting attack"
87,Florida Man Displayed Gun After Learning Delray Beach McDonald's Had Broken Ice Cream Machine: Cops
88,"Florida Man With No Arms Arrested For Stabbing Tourist  
The Miami Herald reports the incident happened early Tuesday (July 10)"
89,Romaine calm: Florida man accused of lashing out at fast food workers over lack of lettuce
90,I still believe that the right term for being stabbed with a fork is forked
91,A Florida man stole the reporter’s car and crashed into a North Caroline police cruiser...
92,"Florida Man Shoots Cat for Looking at Him “Like He Owned the Place”

![gif](giphy|5OWLUbuMq4YXEl2ECg)

Florida Man Arrested For Trying to Circumcise Nephew With Kitchen Knife |"
93,Florida man mistakenly shoots and kills son in law in birthday suprise gone wrong
94,“Florida Man suspected of Smelling Woman’s feet at library leads police on a scooter chase”
95,"""Drunken Florida man with real gun shoots child playing with Nerf gun, police say""  


what in the fuck is wrong with florida"
96,"18 déc. 2018 — A Florida man is in jail for trying to pay for his food at a McDonald's drive-thru with a bag of marijuana, according to police."
97,"an 81 year old Florida Man was arrested after he allegedly offered a woman $200,000 to buy her young daughter at a Florida Walmart,"
98,Florida man arrested for DUI says he smokes pot to prepare for Jesus to return
99,Mine is june 17 and its a dude trying to impregnate a railing
100,"Florida man arrested after botching in-home castration surgery

https://kfor.com/news/florida-man-arrested-after-botching-in-home-castration-surgery-deputies-say/"
