,Comments
0,"
##If this submission makes you go ""Hol'Up"", **UPVOTE** this comment!

##If this submission does not make you go ""Hol'Up"", **DOWNVOTE** this comment!

---

Whilst you're here, /u/CodeNovaBtw, why not join our [public discord server](https://discord.gg/holup) or play on our [public Minecraft server](https://discord.gg/DTqSDS8C3T)?"
1,They know the game
2,Thanks for the advice.
3,"Safelight repair, Safelight replace ❤"
4,Tbh I've done this maaaaany times on my Jeep and it never cracked. Idk if it's because I did it very slowly or I got lucky.
5,Why Does it crack tho ?
6,"It's all about the game, and how you play it"
7,"Carglass repariert, Carglass tauscht aus"
8,NNNOOOOOOO. Goddamn you! That jingle haunts my dreams.
9,"The hot water in just one area makes just that bit rapidly expand. The rest of the screen, being cold, doesn't want to expand and it builds up a load of stress in the glass. I've never had one crack, though, and I use boiled water straight from the kettle!"
10,"Thx 
But u know about this and u still do it lol"
11,"It’s actually a build up of negatively charged ions in the glass lattice structure that release the energy, but yea idk I do the boiling water all the time"
