,Comments
0,"#[Link to our Official Discord Server](https://discord.gg/NTpXGZVKTc)

#[Instagram](https://www.instagram.com/indiandankmemes_official/)

To download the video you can use one of the following sites:

#[Download link #1](https://redditsave.com/info?url=https://www.reddit.com/r/IndianDankMemes/comments/x82vpk/ye_dekh_aur_jealous_hoja/)

#[Download link #2](https://saveredd.it/?url=https://www.reddit.com/r/IndianDankMemes/comments/x82vpk/ye_dekh_aur_jealous_hoja/) 

#[Download link #3](https://viddit.red/?url=https://www.reddit.com/r/IndianDankMemes/comments/x82vpk/ye_dekh_aur_jealous_hoja/) 

#[Link to Trim the Video](https://reddloader.com/download-post/?url=https://www.reddit.com/r/IndianDankMemes/comments/x82vpk/ye_dekh_aur_jealous_hoja/&id=aafd4548)

*I am a bot, and this action was performed automatically. Please [contact the moderators of this subreddit](/message/compose/?to=/r/IndianDankMemes) if you have any questions or concerns.*"
1,Mazaak kar rha hain kya. Ye to hope de raha hain ki apne ko bhi mil hi jaayegi ab to
2,Yaar hamne fir 5 month tapasya karke jo apne aapko fit kiya hai sab waste ho gya ab fir se mota huga mai
3,WO SHYD LESBIAN HOGI USKE BOOBS SE IMPRESS HO GYI HOGI
4,Alexa delete all *sarkari naukri* comments
5,Mujhe bhi ek din elizabeth olsen jaisi biwi milegi yeh dekhe confidence aagya
6,Money talks
7,Don't worry bros he has money and probably makes her breathless in bed
8,Leave it guys. It's insensitive to comment on someone's choice of marrying the partner they choose. Mia biwi raazi to situation.
9,"Yehi toh ummid hai bhai ki hume bhi mil sakti hai ...
He is an ally not an enemy"
10,He paid 2.5 crores to her familyðŸ’€.must be a fan of harem isekaiðŸ—¿
11,Shaadi k time pe ladko k liye sabse zarooro cheez hoti hao PAISA. Uske baad baaki sab aata hai.
12,Jealous toh bachpan se hi tha ab deewar mein sar bhi phod rha hu
13,#à¤ªà¤•à¥à¤•à¤¾ à¤‡à¤¸à¤•à¤¾ à¤¬à¥ˆà¤‚à¤• à¤¬à¥ˆà¤²à¥‡à¤¨à¥à¤¸ à¤­à¥€ à¤‡à¤¸à¥€à¤•à¥‡ size à¤•à¤¾ à¤¹à¥‹à¤—à¤¾
14,Paisa kamao.. Jacqueline Fernandez bhi god mein baith jayegi
15,Idk about anyone else she has more respect from me than those reel makers and movie stars ... not because she has worn less revealing clothes or is in traditional attire .... but because she actually went against the norm and did what she felt like
16,Paisa ho to kya kuch nhi hota
17,bro but what's the problem he is inspiring me
18,"""10 reasons why your life is a joke"""
19,I don't get jealous it's just another win for the bois.
20,Acha ha ke ma gay ho ðŸ˜³
21,Arre ladki ki strategy mast hai ye banda suhag rat ke vakt heart attack se tapak jayega aur phir is ka paisa uska ðŸ˜‚ðŸ˜‚ðŸ˜‚
22,Ulta hope Baad gaya. Hot chicken milne keliye 6 pack ki jarurat nahi.
23,Power of gourmint jobðŸ¥²
24,Kya matlab banda sarkari bank me clerk hai ðŸ˜¢ðŸ˜¢ðŸ˜¢
25,Baniya Aur Uski Biwi
26,IRL ugly bastard
27,Bhai wo rich bhi toh hai iss liye mill gyi usko gulabi
28,Haan bhai apne apne defense mechanism hote hai tera positivity hai
29,Tera blood group B+ve hai kya ?. Bc itna hope
30,Mere tatte bhi iss se jyada Sundar hai.
31,"Bank Account healthy hona chahiye,rest all is acceptable ðŸ˜€"
32,"Body jesi bhi hogi, agar Paisa hai to sab ladkiya pata lega tu (well achhi baat to nahi hai pr reality yahi hai ki ladkiyo ko humse nahi hamare paiso se matlab hai)"
33,Fuck!ðŸ’€
34,Hohohohohoho
35,Iske baad state police service mein bharti hone jaa raha hoon
36,">It's insensitive to comment on someone's choice of marrying the partner they choose.

bhai ye same cheez tu same sex couple ke liye bhi kahega?"
37,Approach?
38,ya she don't care if they call her gold digger or something
39,"lol where you at, this is THE norm, girls marry socially well off man and men marry good-looking girls."
40,New title :- ye dekh aur inspire hoja
41,but jokes have meaning...
42,"1000 rupay ki shart lga skta hu ki gulambi nhi hai, chehre ka rang is always an illusion"
43,Paisa toh bahut hai bhai balku khud ka kamaya hua par koi achi larki mili hi nahi ab toh arrange marriage hi honi hai
44,Gold digger ? This is a south indian wedding .. have you seen the amount of gold bride wears on the wedding day ? Wrt to that she is wearing nothing
45,"Norm ? Sure norm strengthens when society rewards it .. but wont you agree there are peeps who break them , cause they dont feel the need of incentivised by the society ?"
46,Sahi kahra hai bhankalund gulami nahi hai wo maine itna porn dekha hai ki ab pata chaljata hai chahe to chat pe pics bhejdo me bata dunga kon hai ya kon ni ðŸ—¿ðŸ’ªðŸ»
47,"ya to tu jhut bol raha hai, ya to mene galat padha"
48,[deleted]
49,aila jaadu ðŸ‘½ mere dost banoge ðŸ¤Œ
50,"I mean you can always ""assume"" things rather than going for facts ... whatever gives you peace dude ... hope you find true love and prove yourself wrong ðŸ¤—"
51,"nahi, pichli baar Rohit ne mere noods viral kar diye the, badi mushkil se delete karwaye hein >:("
