,title,score,id,subreddit,url,num_comments,body,created
338,Predicting the end times once again.,90,wqrweu,religiousfruitcake,https://i.redd.it/s4i6bw1elai91.jpg,18,,2022-08-17 20:59:34
339,The amount of mental gymnastics,57,wqv6tk,religiousfruitcake,https://i.redd.it/x5sk0vqc8bi91.jpg,3,,2022-08-17 23:12:59
340,Got this ad for a book and they really try to make it sound like they got a plan. Although look into John Hagee.,50,wqvr3k,religiousfruitcake,https://i.redd.it/o71r3u8adbi91.png,11,,2022-08-17 23:36:11
341,"keep religion out of everything, can they not?",84,wqr16v,religiousfruitcake,https://i.redd.it/1qro2ru5fai91.png,12,,2022-08-17 20:24:47
342,Nuclear MAGA and the shadow realm,52,wquagq,religiousfruitcake,https://i.redd.it/zuzhd3292bi91.jpg,6,,2022-08-17 22:34:45
343,🤣,2353,wq3ukp,religiousfruitcake,https://i.redd.it/1vg3kgnsr4i91.jpg,53,,2022-08-17 01:24:42
344,"Kerala, the most progressive state of India.",78,wqogxu,religiousfruitcake,https://i.redd.it/h0dtxs2fv9i91.jpg,10,,2022-08-17 18:33:57
345,When I see stuff like this I wonder one thing. Do they really think gay people are this obvious?,1544,wq34ml,religiousfruitcake,https://i.redd.it/931a54vhm4i91.jpg,172,,2022-08-17 00:55:08
346,And they claim atheists don’t have morals…,17724,wplvku,religiousfruitcake,https://i.redd.it/ew14blqph0i91.jpg,877,,2022-08-16 11:01:05
347,Found on some christian “meme” page on IG,900,wpuf4m,religiousfruitcake,https://i.redd.it/4pkxrogbv2i91.jpg,56,,2022-08-16 19:00:55
348,cHrIsTiAnItY sTaRtEd ScIeNcE,346,wq0asa,religiousfruitcake,https://i.redd.it/iknmz7u924i91.png,20,,2022-08-16 23:01:39
349,This abortion story inadvertently gives more evidence of reincarnation.,766,wpr84h,religiousfruitcake,https://i.redd.it/smnd81no32i91.jpg,93,,2022-08-16 16:26:38
350,You cannot go to heaven because Twitter man said so!,81,wq882f,religiousfruitcake,https://i.redd.it/6j8fighjn5i91.jpg,6,,2022-08-17 04:22:38
351,Truer than they might realize,333,wpjzzs,religiousfruitcake,https://i.redd.it/tynm8urrzzh91.jpg,19,,2022-08-16 09:20:30
352,Not sure what his point is 🤷‍♂️,966,wpc1wa,religiousfruitcake,https://i.redd.it/kxq6jo6n7yh91.jpg,60,,2022-08-16 03:21:03
353,She basically did say that.,35043,wota20,religiousfruitcake,https://i.redd.it/x9aovearxth91.jpg,658,,2022-08-15 12:58:38
354,Come Quickly,199,wpk4xs,religiousfruitcake,https://i.redd.it/kqnuufi110i91.jpg,21,,2022-08-16 09:27:37
355,Don’t you just love getting these in the mail,103,wpn6ri,religiousfruitcake,https://i.redd.it/b54q9t1hv0i91.jpg,36,,2022-08-16 12:18:14
356,"“Pedophiles in the west have to hide their abuse of children, but in glorious and noble Islamic societies, they commit them openly.”",464,wp4a84,religiousfruitcake,https://i.redd.it/rv3x8re8owh91.jpg,51,,2022-08-15 22:10:29
357,User posts a really good (albeit very long) and argument about why the Bible isn’t homophobic but he forgot that he’s arguing with a brick wall.,114,wpdh1v,religiousfruitcake,https://i.redd.it/njxmei85iyh91.jpg,86,,2022-08-16 04:19:55
358,Extra cringe worthy cult bullsh*t - Welcome to the weird worship of Marjorie Taylor Greene,474,wovs3u,religiousfruitcake,https://i.redd.it/y03hh3r52uh91.jpg,64,,2022-08-15 15:37:09
359,dominant women are Satan soldiers,110,wp2vn0,religiousfruitcake,https://i.redd.it/ofr1x7d9ewh91.jpg,11,,2022-08-15 21:14:36
360,Ah yes modesty,135,wp11gb,religiousfruitcake,https://i.redd.it/cg68q2v80wh91.jpg,13,,2022-08-15 19:56:04
361,"It's hilarious that Grandma doesn't realize it is the modern people who identify as ""christians"" that would be attacking Jesus the most.",666,wor06y,religiousfruitcake,https://i.redd.it/qitl1mqk9th91.png,52,,2022-08-15 10:43:00
362,I don’t even know where to start.,131,woygt6,religiousfruitcake,https://i.redd.it/0nvz5f9ofvh91.jpg,8,,2022-08-15 18:00:43
363,Religious Grandparent thinks batman is Satan,74,wp1g0t,religiousfruitcake,https://i.redd.it/rktn1pk63wh91.png,6,,2022-08-15 20:13:26
364,I don't understand why they always use Snoopy but yeah.,167,woup1v,religiousfruitcake,https://i.redd.it/mcdpibw1euh91.jpg,26,,2022-08-15 14:29:58
365,this is a comment section on a tiktok about the man who stabbed salman rushdie... I'm genuinely terrified,228,wosnsx,religiousfruitcake,https://i.redd.it/8t77y47uqth91.jpg,24,,2022-08-15 12:19:45
366,“Satan wants you to get that degree”,227,wosesk,religiousfruitcake,https://i.redd.it/rdogbt34oth91.jpg,35,,2022-08-15 12:04:28
367,I just found this,3683,wo8rtm,religiousfruitcake,https://i.redd.it/jbbb523k4ph91.jpg,132,,2022-08-14 20:47:44
368,my mans thinks UFOs are angel sightings lmao,62,woy26r,religiousfruitcake,https://i.redd.it/l5n1xo0ecvh91.jpg,7,,2022-08-15 17:42:20
369,Consequences,1466,woca52,religiousfruitcake,https://i.redd.it/sfs5s02yvph91.jpg,118,,2022-08-14 23:21:14
370,Friendly peaceful local.,168,wor5fa,religiousfruitcake,https://i.redd.it/krlfjwzvath91.png,10,,2022-08-15 10:50:52
371,Bowhunting Jesus,76,wouv8o,religiousfruitcake,https://i.redd.it/h9mtgfjvfuh91.png,15,,2022-08-15 14:40:14
372,Atheist criticism makes no sense.,4743,wo16vq,religiousfruitcake,https://i.redd.it/5b9wuz2m1nh91.jpg,365,,2022-08-14 13:47:42
373,upper caste hindu teacher murdered a lower caste 9 year old dalit boy. Brahmins thinks they are supreme hindu.,1015,wo5y07,religiousfruitcake,https://i.redd.it/ct1m2j8agoh91.png,65,,2022-08-14 18:34:40
374,They serious.?,636,wo68a8,religiousfruitcake,https://i.redd.it/jc2bedscjoh91.jpg,45,,2022-08-14 18:48:54
375,what does Jesus have to do with the BGP001,26,wotaxk,religiousfruitcake,https://i.redd.it/c9iyizp1yth91.jpg,6,,2022-08-15 13:00:11
376,"Here is a social media post from Biblicalgendroles. In it, he condones husbands sexually assaulting their wives as 'a form of discipline'",169,wofw6u,religiousfruitcake,https://i.redd.it/2nvdn5xvnqh91.jpg,11,,2022-08-15 01:58:49
377,What do you think? Idea from a Reddit comment.,200,woblh1,religiousfruitcake,https://i.redd.it/ggw4l2emqph91.jpg,14,,2022-08-14 22:51:26
378,Be like Joseph!,193,wob64d,religiousfruitcake,https://i.redd.it/8hblgi3anph91.jpg,6,,2022-08-14 22:32:42
379,There is a group of people worried about a movie title now.,152,wo6pqp,religiousfruitcake,https://i.redd.it/qf4v23nonoh91.png,13,,2022-08-14 19:13:11
380,Pakistani Engineer offers 20 million for the next Jihadi attack,170,wo5sof,religiousfruitcake,https://i.redd.it/hesn1akifoh91.png,35,,2022-08-14 18:27:44
381,Seen this the other day on my way to work.,63,woc9z6,religiousfruitcake,https://i.redd.it/g2iozxswvph91.jpg,9,,2022-08-14 23:21:04
382,Here’s a YouTube channel you guys might enjoy.,86,woadvf,religiousfruitcake,https://i.redd.it/jav4pz48hph91.jpg,11,,2022-08-14 21:58:44
383,Our days are numbered!,79,wo93nx,religiousfruitcake,https://i.redd.it/uyncko557ph91.jpg,14,,2022-08-14 21:02:14
384,"Christian fascist wants Addison Rae burnt alive at the stake because she wore a ""blasphemous"" bikini",4205,wnhhbu,religiousfruitcake,https://i.redd.it/89b8wbo34ih91.jpg,267,,2022-08-13 21:12:42
385,*Tries to simultaneously kneel and stand but ends up falling instead*,153,wo20sj,religiousfruitcake,https://i.redd.it/a81t6169bnh91.jpg,15,,2022-08-14 14:41:44
386,JK Rowling receives death threat tweet after support for Salman Rushdie.,3344,wnhrcl,religiousfruitcake,https://i.redd.it/qr1wzgwk5ih91.png,561,,2022-08-13 21:25:24
387,An unironic response,283,wnxiv5,religiousfruitcake,https://i.redd.it/8kk48jalxlh91.jpg,12,,2022-08-14 10:03:39
388,Honk Jesus Honk,194,wnv3i8,religiousfruitcake,https://i.redd.it/g9rc9wa2alh91.jpg,25,,2022-08-14 07:52:10
389,"Yes Islam allows for slavery, sex with slaves, commands killing apostates and adulterers and sodomites, Alhamdulillah for all these things",179,wnv5mb,religiousfruitcake,https://i.redd.it/78e2xlxi9lh91.jpg,24,,2022-08-14 07:55:16
390,She must be fun at parties…,981,wniur1,religiousfruitcake,https://i.redd.it/5a6xvhrqeih91.jpg,87,,2022-08-13 22:12:21
391,"I really want to break the news to them about Rosie O'donnell. It's a show about women playing professional baseball, you can't be shocked that there are gay people involved.",15,wo8fbo,religiousfruitcake,https://i.redd.it/y90dhm971ph91.png,1,,2022-08-14 20:32:36
392,Founding father fruitcake,245,wnopo6,religiousfruitcake,https://i.redd.it/m6keawbfqjh91.jpg,12,,2022-08-14 02:39:37
393,Why are Christians posted here by far more than any other religion?,82,wnvyg7,religiousfruitcake,https://i.redd.it/5p75co6bilh91.jpg,14,,2022-08-14 08:37:41
394,Religious mom talking points in the early 2000s,275,wniht8,religiousfruitcake,https://i.redd.it/6cwfc9kzbih91.jpg,22,,2022-08-13 21:56:54
395,Another Shit Take About the Salman Rushdie Incident,793,wn8ftj,religiousfruitcake,https://i.redd.it/q0kc6odrnfh91.jpg,115,,2022-08-13 12:57:33
396,"Support for the accused who has attacked Salman Rushdie, and further death threats against another.",78,wnkyim,religiousfruitcake,https://i.redd.it/xcmg6bvavih91.png,4,,2022-08-13 23:45:55
397,When politics is gospel,122,wnh8pc,religiousfruitcake,https://i.redd.it/wg6750l52ih91.jpg,10,,2022-08-13 21:01:47
398,His book got more famous after the attack,41,wnnv8b,religiousfruitcake,https://i.redd.it/ham6y2zdjjh91.jpg,7,,2022-08-14 02:00:10
399,“Hero”,270,wna6r5,religiousfruitcake,https://i.redd.it/nfilzdmc7gh91.jpg,28,,2022-08-13 14:47:22
400,Jesus does not like yoga,4817,wmrcis,religiousfruitcake,https://i.redd.it/ikhtzps0lbh91.jpg,260,,2022-08-12 23:15:05
401,What no head does to a motherfucker,934,wn2du9,religiousfruitcake,https://i.redd.it/zdoql2xw0eh91.jpg,115,,2022-08-13 07:27:45
402,Flawless “logic”,443,wn13fs,religiousfruitcake,https://i.redd.it/8tmx0pitpdh91.jpg,57,,2022-08-13 06:25:32
403,Dumb Fruitcake Sex Education,952,wmu63c,religiousfruitcake,https://i.redd.it/d6qa331z6ch91.jpg,113,,2022-08-13 01:18:07
404,No words.,118,wn6sxc,religiousfruitcake,https://i.redd.it/lyx0ayy36fh91.jpg,10,,2022-08-13 11:18:37
405,woah,694,wmtxyw,religiousfruitcake,https://i.redd.it/0m8jkd185ch91.jpg,64,,2022-08-13 01:08:18
406,"Well for starters, Atheism isn’t a religion",178,wn17kb,religiousfruitcake,https://i.redd.it/0cant9grqdh91.jpg,14,,2022-08-13 06:30:49
407,“Go back to your own country”( racist reddit post)( screenshot shared on another subreddit),225,wmzh7z,religiousfruitcake,https://i.redd.it/7kkfsir7cdh91.jpg,10,,2022-08-13 05:09:17
408,“Writing a novel is totally the same as mass murder”,365,wmvmf7,religiousfruitcake,https://i.redd.it/a5hoz7f5ich91.jpg,15,,2022-08-13 02:20:45
409,When a Muslim used a very offensive slur,33,wna1z5,religiousfruitcake,https://i.redd.it/waurxwfw5gh91.jpg,2,,2022-08-13 14:39:16
410,Supporting a terrorist act.,702,wmozfk,religiousfruitcake,https://i.redd.it/jt85nm823bh91.jpg,75,,2022-08-12 21:34:27
411,Salman Rushdie stabbed on stage!!!,500,wmo75g,religiousfruitcake,https://i.redd.it/fov74tefxah91.jpg,55,,2022-08-12 21:02:57
412,Can anyone with any scientific background clarify if this is correct or just rubbish?,2306,wme3mv,religiousfruitcake,https://i.redd.it/zce09rgt88h91.jpg,365,,2022-08-12 12:01:21
413,“A evil”,70,wn1hzn,religiousfruitcake,https://i.redd.it/fltk6a97tdh91.jpg,14,,2022-08-13 06:44:29
414,In defense of pedophilia,191,wmt56c,religiousfruitcake,https://i.redd.it/4ke4cmgtybh91.jpg,58,,2022-08-13 00:32:24
415,"I don’t know if this belongs here, but I figured I would try anyway bc what is this?",37,wn4foa,religiousfruitcake,https://i.redd.it/hzp36g14jeh91.jpg,7,,2022-08-13 09:09:46
416,An add on a mobile game,56,wn148r,religiousfruitcake,https://i.redd.it/6t2zhat0qdh91.jpg,7,,2022-08-13 06:26:40
417,I am tired of diversity of fruitcakes around me.,16,wn6ner,religiousfruitcake,https://i.redd.it/eo98m0994fh91.png,1,,2022-08-13 11:09:43
418,Wow,38415,wlx5gd,religiousfruitcake,https://i.redd.it/09sr7vtld4h91.jpg,844,,2022-08-11 23:01:03
419,"If hell doesn’t exist, where does lava come from!?",667,wmfmv9,religiousfruitcake,https://i.redd.it/kazuo1ltp8h91.jpg,46,,2022-08-12 13:36:38
420,so love is what god says it is.,1175,wmc24x,religiousfruitcake,https://i.redd.it/chqtqo28o7h91.jpg,177,,2022-08-12 10:05:54
421,Trump is christ reborn!,64,wmuhe2,religiousfruitcake,https://i.redd.it/2cp06j679ch91.gif,21,,2022-08-13 01:31:07
422,Submissive women are clearly the equivalent of teaching your daughters self defense 😐,135,wmn39c,religiousfruitcake,https://i.redd.it/61spq0kbpah91.jpg,4,,2022-08-12 20:17:23
423,TW // S*icide | Some religious fruitcake from Catholic private school,121,wmnrgz,religiousfruitcake,https://i.redd.it/10as87h8uah91.jpg,18,,2022-08-12 20:45:00
424,Response of “you know who” to the attack on Salman Rushdie,47,wmtjfk,religiousfruitcake,https://i.redd.it/pf4kslx02ch91.jpg,13,,2022-08-13 00:50:25
425,Gods of the atheists,42,wmt46r,religiousfruitcake,https://i.redd.it/85npxh3mybh91.jpg,7,,2022-08-13 00:31:16
426,Clearly MTG doesn't know what a pronoun is,3859,wlonmz,religiousfruitcake,https://i.redd.it/k7ozhxezf2h91.png,267,,2022-08-11 16:33:04
427,what a great argument,303,wm4d6n,religiousfruitcake,https://i.redd.it/ac9q1l9pv5h91.jpg,48,,2022-08-12 04:04:15
428,Amazon Fruitcake Question Book,141,wm6jt5,religiousfruitcake,https://i.redd.it/l2z946g2d6h91.jpg,134,,2022-08-12 05:41:35
429,So he criticizes capitalism but somehow finds that the the solution is misogyny?😭,115,wm7dz3,religiousfruitcake,https://i.redd.it/3fizmqg2k6h91.jpg,17,,2022-08-12 06:20:49
430,I hope all you sinners are prepared,221,wm0fl1,religiousfruitcake,https://i.redd.it/xoq9p4q625h91.jpg,86,,2022-08-12 01:18:49
431,Sounds about right…,334,wlwro1,religiousfruitcake,https://i.redd.it/fr3j2b9ra4h91.jpg,24,,2022-08-11 22:45:04
432,Hopefully It Was A Satire About Earth In General,112,wm2uwq,religiousfruitcake,https://i.redd.it/3vm7y7xbk5h91.jpg,9,,2022-08-12 03:00:30
433,So your pet can apparently be Christian.,47,wm709z,religiousfruitcake,https://i.redd.it/fpdxspeug6h91.png,13,,2022-08-12 06:02:50
434,"Some guy's reaction to childfree marriages. Forget about your finances, you must make babies!!!1!",209,wlsx10,religiousfruitcake,https://i.redd.it/n9y8zy4ab3h91.png,19,,2022-08-11 20:05:04
435,"Dear gays, thanks for making us stronger ~ women",47,wm43f3,religiousfruitcake,https://i.redd.it/6w5aodpkt5h91.jpg,9,,2022-08-12 03:52:19
436,"With God, all things are possible…",2554,wlc5df,religiousfruitcake,https://i.redd.it/bcioqozg0zg91.jpg,165,,2022-08-11 04:58:31
437,My partner's dad just shared this on fb,757,wlhkoj,religiousfruitcake,https://i.redd.it/yypnb8v2b0h91.jpg,111,,2022-08-11 09:20:03
438,"Pray (prey?) and obey - inside an FLDS compound in Colorado City, AZ. Zoom in.",29,wm2kx0,religiousfruitcake,https://i.redd.it/vrxhe2m8i5h91.jpg,8,,2022-08-12 02:48:50
439,"Translates to:” DNA test confirm, god is our father “",58,wlw9hl,religiousfruitcake,https://i.redd.it/gkr6e4hx64h91.jpg,10,,2022-08-11 22:23:38
440,"""Christianity is not a religion""",62,wlvbrm,religiousfruitcake,https://i.redd.it/k1gzuvz004h91.jpg,18,,2022-08-11 21:44:57
441,I recently commented on a Ben Shapiro share and now Facebook has all the wrong ideas about me.,57,wlv1se,religiousfruitcake,https://i.redd.it/s8haq2hvx3h91.png,2,,2022-08-11 21:33:30
442,Creationist logic,3009,wl50yx,religiousfruitcake,https://i.redd.it/dkemjg15kxg91.jpg,241,,2022-08-11 00:05:12
443,Photo of Pastor Gene Kim preaching. Take a close look at the whiteboard.( photo originally shared by Hermant Mehta on twitter),66,wlslbh,religiousfruitcake,https://i.redd.it/kdsivi9pf3h91.jpg,11,,2022-08-11 19:51:00
444,Found this in a wild YouTube comment,44,wlu3bk,religiousfruitcake,https://i.redd.it/tleibnayq3h91.jpg,4,,2022-08-11 20:54:04
445,Here is some end time fruitcake,22,wlz2pl,religiousfruitcake,https://i.redd.it/e49kv742s4h91.jpg,9,,2022-08-12 00:22:03
446,"Ladies and gentlemen, the omnipotent, wise and douchy god",81,wlo7vq,religiousfruitcake,https://i.redd.it/wl7zeoctb2h91.jpg,11,,2022-08-11 16:07:26
447,why would you ever say this to someone!!,452,wl68lw,religiousfruitcake,https://i.redd.it/x1b1d3dlsxg91.jpg,22,i don't know if this belongs but it just really blew my mind,2022-08-11 00:52:35
448,That's how it's done.,4712,wkowum,religiousfruitcake,https://i.redd.it/x1dnidf5ltg91.png,89,,2022-08-10 10:43:47
449,Religious and of course Republican spouting dangerous nonsense on Facebook misconstruing same sex marriage with pedophilia legalization,46,wlj8ho,religiousfruitcake,https://i.redd.it/ocji7wcbr0h91.jpg,6,,2022-08-11 10:51:00
450,The audacity they have!,2590,wknmdg,religiousfruitcake,https://i.redd.it/gl7e7soj8tg91.png,188,,2022-08-10 09:33:53
451,Overeating is a sin,126,wl3dmj,religiousfruitcake,https://i.redd.it/m9hty49f8xg91.jpg,26,,2022-08-10 22:59:32
452,Man upset he cannot abuse his wife anymore and has to actually love her,2658,wk7v0p,religiousfruitcake,https://i.redd.it/gdfiq7w9tpg91.png,120,,2022-08-09 22:02:59
453,Reddit ads are getting ridiculous,87,wksvi7,religiousfruitcake,https://i.redd.it/p34qsyimtug91.jpg,10,,2022-08-10 14:53:01
454,Evolution is the cause of fascism,1553,wk9m0u,religiousfruitcake,https://i.redd.it/1gwq8gaw5qg91.jpg,74,,2022-08-09 23:12:54
455,Schism alert!,83,wkr7yc,religiousfruitcake,https://i.redd.it/gl1pmdcgaug91.jpg,9,,2022-08-10 13:05:35
456,"Yaser Said found GUILTY of the 2008 murders of his daughters, Sarah and Amina.",289,wkjjfy,religiousfruitcake,https://i.redd.it/qapal5oh8sg91.jpg,18,"As someone who has been following this case from the beginning, I’m really overwhelmed at finally hearing a guilty verdict on this. It’s been such a long time coming. Rest In Peace, girls 💛",2022-08-10 06:10:59
457,Mohammad Waited Till She Was 9! Déjà Vu,244,wki4lr,religiousfruitcake,https://i.redd.it/e9d1e0qowrg91.jpg,46,,2022-08-10 05:04:58
458,Anti LGBT propaganda found in a Malaysian school textbook. Translations in comments,75,wkoqr6,religiousfruitcake,https://i.redd.it/uvayd1y4jtg91.jpg,17,,2022-08-10 10:34:07
459,"New Post Flair: Poe’s Law. It’s for when people want to submit something, but aren’t sure if it’s a parody or a real thing.",282,wkcatq,religiousfruitcake,https://i.redd.it/4wi03ldkoqg91.jpg,12,,2022-08-10 00:57:33
460,when the bible says don't be gay but also to love christ,86,wki3um,religiousfruitcake,https://i.redd.it/eadew5ziwrg91.jpg,9,,2022-08-10 05:03:59
461,Thanks Reddit Ad Algorithm 🙄,45,wkjc6j,religiousfruitcake,https://i.redd.it/futjs1tr6sg91.jpg,5,,2022-08-10 06:01:21
462,From Trans 🏳️‍⚧️ bathroom conversation on FB,317,wk1x90,religiousfruitcake,https://i.redd.it/cgfp3tlokog91.jpg,14,,2022-08-09 17:52:14
463,The Irony is Palpable,4521,wjl42d,religiousfruitcake,https://i.redd.it/6x9pw84z7kg91.jpg,81,,2022-08-09 03:13:51
464,How it ends,1183,wjssxr,religiousfruitcake,https://i.redd.it/cwvpe9irxlg91.jpg,182,,2022-08-09 09:00:10
465,This screenshot was sent to the twitter account of this subreddit.,136,wk3zqj,religiousfruitcake,https://i.redd.it/y2932xvn1pg91.jpg,19,,2022-08-09 19:27:22
466,Promo on twitter for an event called The Patriarch convention.,118,wk4w1i,religiousfruitcake,https://i.redd.it/v455wlg78pg91.jpg,23,,2022-08-09 20:04:03
467,Fruitcakery in the oddest places.,76,wk71cw,religiousfruitcake,https://i.redd.it/8ugvk9qdnpg91.png,4,,2022-08-09 21:30:45
468,"""miracle"" virgin birth... again...",1002,wjnqob,religiousfruitcake,https://i.redd.it/netj77torkg91.jpg,220,,2022-08-09 05:04:22
469,"“Women’s health improved by abortion ban,” an opinion piece actually printed by my local newspaper. You can tell this is definitely, totally, completely NOT written by a pastor’s wife.",486,wjrg8i,religiousfruitcake,https://i.redd.it/uuw941d4mlg91.jpg,71,,2022-08-09 07:54:55
470,"I’m sure most cities have a version of this. Here is Seattles megaphone clowns. Any event all year long, they are there yelling at everyone that they are going to hell for enjoying themselves at a ball game.",233,wjvf16,religiousfruitcake,https://i.redd.it/3p12sra4nmg91.jpg,38,,2022-08-09 11:22:24
471,and Jesus said: Let them starve.,7223,wj3pva,religiousfruitcake,https://i.redd.it/x4j3v4ebcgg91.jpg,218,,2022-08-08 14:11:05
472,Was told to post this here,1393,wjac8u,religiousfruitcake,https://i.redd.it/fskcrrpx2ig91.png,94,,2022-08-08 20:02:04
473,The hell kind of persecution fetish do these guys have?,143,wjos6j,religiousfruitcake,https://i.redd.it/1rjz2tw30lg91.jpg,7,,2022-08-09 05:51:32
474,Be not afraid,739,wj8jq1,religiousfruitcake,https://i.redd.it/01zhkezqohg91.png,62,,2022-08-08 18:42:43
475,“Immediately I felt a cold demonic being”,11604,wirhkj,religiousfruitcake,https://i.redd.it/gg6xxf9y6dg91.jpg,472,,2022-08-08 03:35:38
476,Enjoy this slice of end time fruitcake,223,wjekeb,religiousfruitcake,https://i.redd.it/adrgxl98xig91.jpg,24,,2022-08-08 22:51:50
477,"Well, shit...I guess I'm not going to heaven",169,wjeq8g,religiousfruitcake,https://i.redd.it/9c2onv7dyig91.jpg,24,,2022-08-08 22:58:15
478,I thought only Catholics worshipped Mary as a side God? this person is an evangelical,29,wjoy5a,religiousfruitcake,https://i.redd.it/1rlbdvgh1lg91.png,7,,2022-08-09 05:59:16
479,The spirit of god is going to cause me respiratory system failure,75,wjfpi0,religiousfruitcake,https://i.redd.it/jjts5am45jg91.jpg,6,,2022-08-08 23:36:06
480,"When you've been brainwashed into a cult, but don't know it... This, this is what happens! 👇",212,wj55kv,religiousfruitcake,https://i.redd.it/ns6t01jw1gg91.png,26,,2022-08-08 15:41:13
481,this person also had a life-sized cardboard cut out of trump in their front seat...,492,wj0bzl,religiousfruitcake,https://i.redd.it/ixfvxsmsbfg91.jpg,49,,2022-08-08 10:46:21
482,Just A Meme.,116,wj8d07,religiousfruitcake,https://i.redd.it/8wfb1ry6nhg91.jpg,48,,2022-08-08 18:33:49
483,Comment after someone shared a video of a bike thief on the Neighborhood app,68,wj9ot4,religiousfruitcake,https://i.redd.it/9gfqny22yhg91.jpg,5,,2022-08-08 19:34:41
484,Now the right wing media is becoming cuckoo,329,wixmck,religiousfruitcake,https://i.redd.it/k9zpqneemeg91.jpg,48,,2022-08-08 08:24:11
485,can't argue that logic,2211,wif3ff,religiousfruitcake,https://i.redd.it/zsjnmfhngag91.jpg,273,,2022-08-07 18:24:41
486,"I saw a demon! No, the LSD had nothing to do with it!",141,wivnyf,religiousfruitcake,https://i.redd.it/ey1c059d5eg91.jpg,14,,2022-08-08 06:48:33
487,This man’s response to a woman’s post about her being harassed by men on Reddit…,789,wiiube,religiousfruitcake,https://i.redd.it/6q798vp1cbg91.jpg,25,"Couldn’t tell if it was satire or not, the way it’s worded is unbelievable",2022-08-07 21:20:38
488,"My popcorn came with ""Good News""",121,wiw55w,religiousfruitcake,https://i.redd.it/bho4b68k9eg91.jpg,14,,2022-08-08 07:12:06
489,Somewhere in Washington state.,47,wj1yka,religiousfruitcake,https://i.redd.it/hrbp1l8ssfg91.jpg,4,,2022-08-08 12:21:36
490,"Gematria notes from -48, the JFK Jr is alive QAnon sect( originally Shared on another subreddit)",69,wixvuj,religiousfruitcake,https://i.redd.it/bfby4x5soeg91.jpg,10,,2022-08-08 08:37:22
491,This the last time I debate on Reddit 😫,274,wim7xu,religiousfruitcake,https://i.redd.it/6ea4ijaa2cg91.jpg,36,,2022-08-07 23:47:42
492,Independent Women are Servicing the Devil,250,wikxls,religiousfruitcake,https://i.redd.it/t8dsetd7t9g91.png,23,,2022-08-07 22:51:33
493,Fundamentalist Muslims are concerned with the rise of Liberal Muslims. Young girls need to be taught how to be good wives and mothers to resist the feminist agenda,136,winp5o,religiousfruitcake,https://i.redd.it/xyc0cb0xbcg91.png,12,,2022-08-08 00:51:56
494,man killed 2 daughters dating non-muslims,4363,wi1ldh,religiousfruitcake,https://i.redd.it/o8ofon0jj6g91.jpg,216,,2022-08-07 05:13:41
495,People literally have no idea what F1 is apparently. And before you say this isn't religious the person I am pointing to has a US flag and a cross in the middle of their profile picture.,41,wiugsv,religiousfruitcake,https://i.redd.it/dca4cycwudg91.png,5,,2022-08-08 05:51:11
496,Halal ice cream,1048,wi8j7d,religiousfruitcake,https://i.redd.it/e952r37ve8g91.jpg,46,,2022-08-07 11:31:07
497,The Devil,125,wikxs0,religiousfruitcake,https://i.redd.it/26wfymwasbg91.jpg,19,,2022-08-07 22:51:45
498,"""Bro you don't get it, my prophet didn't make a mistake marrying a six year old coz he TOLD US he cannot make any mistakes like we all do!""",277,wiecpo,religiousfruitcake,https://i.redd.it/dhc5pieh9ag91.png,17,,2022-08-07 17:44:36
499,I don't have words!,124,wiixob,religiousfruitcake,https://i.redd.it/zkuz8l2dxyf71.jpg,17,,2022-08-07 21:24:39
500,I very rarely hear these arguments. Maybe from kindergarten level atheists.,2764,whz4d1,religiousfruitcake,https://i.redd.it/qbd7y70gy5g91.jpg,281,,2022-08-07 03:15:29
501,crazy explanation of LGBT subplots,55,wij7s8,religiousfruitcake,https://i.redd.it/dcyui9awebg91.jpg,19,,2022-08-07 21:36:37
502,sigth,81,wie5hv,religiousfruitcake,https://i.redd.it/dmhukdlf7ag91.jpg,20,,2022-08-07 17:33:09
503,They’re really out here blurring the hijabis face and they blurred the hair of the woman in the painting. Why didn’t she just draw a hijabi? Also isn’t drawing living things haram?,1200,whvben,religiousfruitcake,https://i.redd.it/cec3bhxr25g91.jpg,126,,2022-08-07 00:17:59
504,Passive aggressive religious fruitcake leaves a trap at Aldis. The smiley side was face up of course.,307,wi3jrl,religiousfruitcake,https://i.redd.it/cv6osut917g91.jpg,29,,2022-08-07 06:54:28
505,"Because gravity definitely can't be demonstrated, right?",1294,whoa7s,religiousfruitcake,https://i.redd.it/qgl7phv6h3g91.jpg,57,,2022-08-06 18:55:13
506,They got a point…,402,whppu6,religiousfruitcake,https://i.redd.it/ub68h0t8t3g91.jpg,24,,2022-08-06 20:02:47
507,Don’t worry about anything,1184,whj735,religiousfruitcake,https://i.redd.it/1h06pg0ey1g91.jpg,121,,2022-08-06 13:48:03
508,So what about the other religions that claim that there is irrefutable proof in their writings?,333,whp6s3,religiousfruitcake,https://i.redd.it/9xbxz8cyo3g91.jpg,40,,2022-08-06 19:38:44
