,title,score,id,subreddit,url,num_comments,body,created
0,"Being an enemy of God, I have to admit it feels pretty powerful.",789,x9bxxd,religiousfruitcake,https://i.redd.it/1aketcekapm91.jpg,99,,2022-09-09 02:42:05
1,Jesus Loves You,1815,x94ie9,religiousfruitcake,https://i.redd.it/h7sfh9zeapm91.jpg,95,,2022-09-08 21:41:14
2,“Sadly this is where we are headed if we don’t fight the evil is this world” - fruitloop in the comments under this,87,x9mt4f,religiousfruitcake,https://i.redd.it/hsvupcv8qrm91.jpg,9,,2022-09-09 10:53:31
3,"The dad is absorbing the gay energy to protect his children, what a hero...",212,x9ffdh,religiousfruitcake,https://i.redd.it/o7n05bswzpm91.png,26,,2022-09-09 05:05:49
4,Pretty sure god's got babies to kill and diagnose people with cancer,3912,x8qmo8,religiousfruitcake,https://i.redd.it/btzgi8h7dkm91.png,149,,2022-09-08 10:08:00
5,Christian Nationalist network asked me to help brigade their` book on amazon,375,x91mwa,religiousfruitcake,https://i.redd.it/y4h7pdq88nm91.png,41,,2022-09-08 19:45:30
6,Man wants a child bearing woman.,308,x93afj,religiousfruitcake,https://i.redd.it/we94mk4aknm91.jpg,31,,2022-09-08 20:53:04
7,"TBF, he came back to life in three days just like Jesus did.",423,x8zsyf,religiousfruitcake,https://i.redd.it/79fdo52vtmm91.jpg,27,,2022-09-08 18:24:55
8,Umm. Okay.,17,x9ktt8,religiousfruitcake,https://i.redd.it/ilsb57198rm91.jpg,4,,2022-09-09 09:12:57
9,“Childhood ends at puberty”,6166,x8frbs,religiousfruitcake,https://i.redd.it/08w5xus4zhm91.jpg,346,,2022-09-08 02:05:34
10,It was a post about feeder fish…,6,x9ohf2,religiousfruitcake,https://i.redd.it/yamrewuf7sm91.jpg,4,,2022-09-09 12:29:56
11,what,357,x8v00z,religiousfruitcake,https://i.redd.it/ws5rrdltklm91.jpg,24,,2022-09-08 14:12:28
12,I never thought religion would be so flexible as to invert itself like that,18,x9g7t4,religiousfruitcake,https://i.redd.it/dssf1gve6qm91.jpg,11,,2022-09-09 05:40:35
13,"Alberta's (Former?) Premiere, Taking Any Opportunity to Pander",4,x9mfmb,religiousfruitcake,https://i.redd.it/sqgmj4b6mrm91.jpg,3,,2022-09-09 10:33:16
14,Christians are next level,49,x92ejj,religiousfruitcake,https://i.redd.it/jere8heudnm91.png,13,,2022-09-08 20:17:22
15,Funny framed picture I saw at a restaurant recently.,755,x8kaxs,religiousfruitcake,https://i.imgur.com/aFHgEiJ.jpg,59,,2022-09-08 05:12:36
16,christian fruitcake,1694,x8b43y,religiousfruitcake,https://i.redd.it/xv1euaq12hm91.jpg,91,,2022-09-07 23:00:05
17,GCC countries having a meltdown oveŕ 2 women kissing each other,5070,x83azu,religiousfruitcake,https://i.redd.it/gsoho6lswgm91.jpg,326,,2022-09-07 17:30:59
18,Pray away the spider venom,27,x92d9q,religiousfruitcake,https://i.redd.it/jmv78y4odnm91.jpg,6,,2022-09-08 20:15:55
19,heven according to religious people,1,x9p53x,religiousfruitcake,https://i.redd.it/lq9fc8ffesm91.jpg,3,,2022-09-09 13:09:06
20,"it's all about stopping the churches, clearly!",669,x8ehgb,religiousfruitcake,https://i.redd.it/7hxss6mzphm91.jpg,93,,2022-09-08 01:14:49
21,Don't know who this is but they need to stop writing about gay sex I guess.,1130,x88wyz,religiousfruitcake,https://i.redd.it/xoxurz8emgm91.jpg,62,,2022-09-07 21:32:26
22,….,286,x8ftr1,religiousfruitcake,https://i.redd.it/16zb8x2nzhm91.jpg,41,,2022-09-08 02:08:22
23,Pope man,1075,x83k8q,religiousfruitcake,https://i.redd.it/k4uwmblnhfm91.jpg,50,,2022-09-07 17:44:02
24,Apparently “CE” is a “hateful anti-Christian term” now,129,x8gqn1,religiousfruitcake,https://i.redd.it/41tobsc46im91.jpg,10,,2022-09-08 02:44:43
25,"Sometimes religions indoctrination are too attractive that even after you leaving it, your heart are still all for it.",452,x80hzx,religiousfruitcake,https://i.redd.it/ns23ku38nem91.jpg,24,,2022-09-07 14:53:31
26,any day now,1076,x7vesd,religiousfruitcake,https://i.redd.it/hwkh91wfmem91.jpg,40,,2022-09-07 09:49:09
27,Christians are really getting angered by this show.,4577,x7kn70,religiousfruitcake,https://i.redd.it/6om57gkzqam91.png,306,,2022-09-07 01:47:47
28,deeply disturbing,130,x85ur3,religiousfruitcake,https://i.redd.it/a3a0r1ef0gm91.jpg,19,,2022-09-07 19:29:13
29,This lady is truly delusional,480,x7wtpb,religiousfruitcake,https://i.redd.it/960hk0qbidm91.jpg,46,,2022-09-07 11:05:42
30,I hope Jesus is directing him to hell…..,51,x88wfa,religiousfruitcake,https://i.redd.it/krucvxgbmgm91.jpg,13,,2022-09-07 21:31:55
31,"ope, science said so",1301,x7nsjp,religiousfruitcake,https://i.redd.it/vbjsptcvdbm91.jpg,96,,2022-09-07 03:55:40
32,Louisiana congressman goes on religious rant after being offended by the trailer for the new TV series Little Demon,34,x856xk,religiousfruitcake,https://i.redd.it/iopzfb8sufm91.png,9,,2022-09-07 18:59:55
33,"Louisiana Congressman has a problem with the cartoon ""Little Demon""",1873,x78cnp,religiousfruitcake,https://i.redd.it/jesuzpe268m91.png,256,,2022-09-06 17:10:23
34,Pastor/blogger thinks that husbands shouldn’t respect their wives,407,x7jxfb,religiousfruitcake,https://i.redd.it/j5qnr44ylam91.jpg,33,,2022-09-07 01:19:09
35,I’m coming lord I’m coming !,386,x7js0z,religiousfruitcake,https://i.redd.it/xlnhspkvkam91.jpg,16,,2022-09-07 01:13:09
36,If Jesus was beheaded,6315,x6zvbt,religiousfruitcake,https://i.redd.it/8mxfxdqfr5m91.png,118,,2022-09-06 09:01:52
37,"Lord, give me a sign…",113,x7luoy,religiousfruitcake,https://i.redd.it/evubyx7pzam91.jpg,24,I don’t know. Just thought it might go here,2022-09-07 02:36:17
38,“That made sense thousands of years ago” 💀💀,68,x7po4f,religiousfruitcake,https://i.redd.it/djsidrlgsbm91.jpg,12,,2022-09-07 05:17:29
39,Just found this taped to the wall at my work in the bathroom,683,x779j2,religiousfruitcake,https://i.redd.it/ukxg0qk3w7m91.jpg,45,,2022-09-06 16:10:45
40,This counts right?,48,x7pn9u,religiousfruitcake,https://i.redd.it/iqlpgxc9sbm91.jpg,2,,2022-09-07 05:16:22
41,more screenshots,43,x7owle,religiousfruitcake,https://i.redd.it/235ktrggmbm91.png,8,,2022-09-07 04:43:47
42,"A North Carolina school baptized more than 100 kids without parental permission or attendance: 'Mama, can you bring me some dry clothes?'",4905,x6iyns,religiousfruitcake,https://i.redd.it/qtlfd84m62m91.jpg,200,,2022-09-05 20:59:20
43,Where will you go?,705,x6wz5x,religiousfruitcake,https://i.redd.it/4ucvnug235m91.jpg,38,,2022-09-06 06:44:25
44,thiests☕,229,x70dtb,religiousfruitcake,https://i.redd.it/f3nsku6nd7m91.jpg,29,,2022-09-06 09:27:19
45,it’s 2022 and people still believe this,204,x70q3q,religiousfruitcake,https://i.redd.it/erk5f8j3z5m91.jpg,21,,2022-09-06 09:43:57
46,HELP i think im blocked!,1083,x6lblf,religiousfruitcake,https://i.redd.it/fuwwpzecn2m91.jpg,74,,2022-09-05 22:32:45
47,I don't even know what's going on-,234,x6wle1,religiousfruitcake,https://i.redd.it/mcytaphmz4m91.png,22,,2022-09-06 06:26:50
48,religious fruitcake has no figs,1703,x6flu5,religiousfruitcake,https://i.redd.it/5pqiruyvf1m91.png,156,So does this mean that you can still eat the fig from the tree if someone else does the harvest??,2022-09-05 18:29:11
49,Eternal punishment,4080,x6adkl,religiousfruitcake,https://i.redd.it/vln5p89twzl91.png,219,,2022-09-05 13:20:30
50,Catholic moral teaching: 7 kids losing their mother is better than birth control,1541,x6e9gr,religiousfruitcake,https://i.redd.it/5txpb9cj31m91.png,121,,2022-09-05 17:20:22
51,Is this shit real?,822,x6icq9,religiousfruitcake,https://i.redd.it/r9nrj7fy12m91.jpg,45,,2022-09-05 20:33:36
52,Imma put a TW,304,x6ot9l,religiousfruitcake,https://i.redd.it/guudn4qnc3m91.jpg,20,,2022-09-06 00:54:43
53,Need I explain?,119,x6sptp,religiousfruitcake,https://i.redd.it/mc0enu9154m91.jpg,23,,2022-09-06 03:33:40
54,When Labor Day triggers you...,6,x7ba43,religiousfruitcake,https://i.imgur.com/4xBpVyH.jpg,2,,2022-09-06 19:26:29
55,Fruitcakes among us,5,x7c5y4,religiousfruitcake,https://i.imgur.com/NQnimXe.jpg,1,,2022-09-06 20:04:06
56,100% Good Results With In 3 Days,69,x6tj6q,religiousfruitcake,https://i.redd.it/ibh4e4w4b4m91.jpg,3,,2022-09-06 04:07:52
57,"In conclusion, it says if Black Lives Matter then Black women shouldn’t get abortions",157,x6m0p9,religiousfruitcake,https://i.redd.it/ackbs0q8s2m91.jpg,7,Someone stuck this booklet on my car. It says Black women get abortions at high rates then cites biblical scriptures on why abortion is wrong. It uses the premise that ProLife > BLM and ProLife = BLM.,2022-09-05 23:00:35
58,The Satanic Panic and it's consequences.,152,x6kovq,religiousfruitcake,https://i.redd.it/jlfa37kwi2m91.png,15,,2022-09-05 22:07:58
59,Pray the Chemtrails Away!!!,115,x6ikyo,religiousfruitcake,https://i.redd.it/5h7antnp32m91.png,15,,2022-09-05 20:43:18
60,"don't worry guess, apparently it's just his opinion",61,x6lakx,religiousfruitcake,https://i.redd.it/qt4ptmq5n2m91.png,9,,2022-09-05 22:31:42
61,This question posted on reddit,4302,x5rtlr,religiousfruitcake,https://i.redd.it/1i7g7v0jhvl91.jpg,189,,2022-09-04 22:27:49
62,Karen hates energy,276,x67kj8,religiousfruitcake,https://i.redd.it/2777iakc3zl91.jpg,35,,2022-09-05 10:35:20
63,Flat Earthers indoctrinating children from birth...,6243,x5jooj,religiousfruitcake,https://i.redd.it/4herp4mhftl91.jpg,547,,2022-09-04 15:55:55
64,Ah Yes 'Magically' Transforms Into a 'Snake'🐍🙃,221,x65ghs,religiousfruitcake,https://i.redd.it/zoby21ckjyl91.jpg,12,Video Link On The Comment Section,2022-09-05 08:44:26
65,What Pastor Greg Locke sees when he looks at a person.,222,x63fdp,religiousfruitcake,https://i.redd.it/7otnli5y0yl91.png,28,,2022-09-05 07:00:10
66,A Muslim Woman comment section filled with hate,66,x6afze,religiousfruitcake,https://i.redd.it/sdt99cvlxzl91.jpg,13,,2022-09-05 13:24:56
67,that Satan doesn't sound like a bad fella,313,x5zxyi,religiousfruitcake,https://i.redd.it/12811i5v6xl91.jpg,62,,2022-09-05 04:11:27
68,Offended by a cartoon,670,x5sxqi,religiousfruitcake,https://i.redd.it/sdzyqzdypvl91.jpg,48,,2022-09-04 23:14:53
69,Religious parents selling son's toy,1961,x5kf0j,religiousfruitcake,https://i.redd.it/uruen84jrtl91.png,159,,2022-09-04 16:40:34
70,put some clothes on woman,247,x5ujxp,religiousfruitcake,https://i.redd.it/444q99av1wl91.jpg,16,,2022-09-05 00:21:41
71,My church has this on their corkboard,264,x5rfuz,religiousfruitcake,https://i.redd.it/bzuo9n7oevl91.jpg,29,,2022-09-04 22:11:41
72,The person literally thought that Disney+ had Little Demon and accused Disney of making this when the only association they really have is they own FX on its Hulu.,45,x63qbs,religiousfruitcake,https://i.redd.it/bntre47p3yl91.png,9,,2022-09-05 07:15:32
73,"Man-made objects saved Ark Encounter but Ken Ham thanks, God.",175,x5t9vn,religiousfruitcake,https://i.redd.it/rdpbh14hsvl91.png,20,,2022-09-04 23:29:06
74,Maranatha: he’s here 😂,996,x5hzy8,religiousfruitcake,https://i.redd.it/0evcqjbo0tl91.jpg,126,,2022-09-04 14:09:38
75,Follower of the Lamb of God takes issue with the Cult of the Lamb,310,x5opz2,religiousfruitcake,https://i.redd.it/vsc0wn22g2h91.png,12,,2022-09-04 20:16:51
76,These people I swear,96,x5xrpg,religiousfruitcake,https://i.redd.it/6gue1mevpwl91.jpg,8,,2022-09-05 02:36:13
77,Christian TikTok in a nutshell…🤣,570,x5k2ri,religiousfruitcake,https://i.redd.it/3std1l8zntl91.jpg,24,,2022-09-04 16:20:15
78,I initially thought it was satire,1187,x5cgc0,religiousfruitcake,https://i.redd.it/i862yxyberl91.jpg,75,,2022-09-04 08:42:46
79,I guess every thoughtful thing I’ve ever done for my wife was just me trying to “pay her” for sex? And here I was thinking I actually enjoyed her company and cleaned the house as an equal partner in our relationship.,65,x5v3ml,religiousfruitcake,https://i.redd.it/nipp817t5wl91.jpg,10,,2022-09-05 00:43:51
80,There's the camera,752,x5ehxv,religiousfruitcake,https://i.redd.it/xjf8t2byxrl91.jpg,10,,2022-09-04 10:32:36
81,This is so heartbreaking. “There no hate like Christian love”,253,x5fu0r,religiousfruitcake,https://i.redd.it/4k89zdp8csl91.jpg,17,,2022-09-04 11:52:41
82,Schools are “indoctrination camps”,6009,x4uyzj,religiousfruitcake,https://i.redd.it/j5ii5brpfnl91.jpg,263,,2022-09-03 19:23:23
83,If this won’t reach the lost idk what will,93,x5jazr,religiousfruitcake,https://i.redd.it/ykqlnivfftl91.jpg,16,,2022-09-04 15:32:28
84,More encouraging people to send their children to a private Christian school.,219,x5dp9y,religiousfruitcake,https://i.redd.it/kwfcyw04qrl91.jpg,36,,2022-09-04 09:48:40
85,TrueChristian: 'Why can't the gays just understand that they need to spend their lives alone?',270,x58czl,religiousfruitcake,https://i.redd.it/i3romk89dql91.png,33,,2022-09-04 05:17:49
86,"My muslim ""friend"" called me a pig and blocked me when i came out XD",603,x52lim,religiousfruitcake,https://i.redd.it/t73cxl623pl91.jpg,65,,2022-09-04 00:55:53
87,The previous administration supported the death penalty your eminence,176,x5a700,religiousfruitcake,https://i.redd.it/o52k2zfwtql91.jpg,11,,2022-09-04 06:48:06
88,Clearly this guy hasn't seen gas prices lately.,4231,x4osr3,religiousfruitcake,https://i.redd.it/amfn66jymll91.png,388,,2022-09-03 13:20:19
89,"""This is a punishment from Allah""",727,x4ybbt,religiousfruitcake,https://i.redd.it/0xfxcmzs5ol91.jpg,77,,2022-09-03 21:49:34
90,Because having sex = serving god,99,x5a02y,religiousfruitcake,https://i.redd.it/55x6vwt6sql91.jpg,11,,2022-09-04 06:38:31
91,Lemme guess… cherry-picked data?,116,x58dqq,religiousfruitcake,https://i.redd.it/6781ijuydql91.jpg,21,,2022-09-04 05:18:47
92,Guy spamming this in exchristian subs,117,x568k6,religiousfruitcake,https://i.redd.it/cygzxl98wpl91.png,24,,2022-09-04 03:39:23
93,Cursed Roblox profile (stolen from GoCommitDie),57,x585fx,religiousfruitcake,https://i.redd.it/4b3vtqa1cql91.jpg,6,,2022-09-04 05:07:58
94,"So, the entire purpose of life is to die.. And bonus, we all come from incest.",58,x55kk3,religiousfruitcake,https://i.redd.it/17l49fy1qpl91.png,12,,2022-09-04 03:08:57
95,"Tell me you don't know anything about science without telling me you don't know anything about science, oh wait-",2692,x4cd98,religiousfruitcake,https://i.redd.it/1pos1t16fil91.png,105,,2022-09-03 02:31:59
96,Stay away from ‘Doctor Strange’ if you “struggle with witchcraft”,119,x4u0so,religiousfruitcake,https://i.redd.it/l86i9uji7nl91.jpg,32,,2022-09-03 18:37:17
97,incel with extra steps,372,x4mr1t,religiousfruitcake,https://i.redd.it/ps4va3dvzkl91.png,35,,2022-09-03 11:10:55
98,Causally scrolling in the YouTube comments I find this,1846,x4b9i7,religiousfruitcake,https://i.redd.it/1fnzwwmq6il91.jpg,154,,2022-09-03 01:44:13
99,"love it how they go from ""i have the facts"" to denying general science. (reupload to censor username)",31,x4xiff,religiousfruitcake,https://i.redd.it/n6t2wozqznl91.png,3,,2022-09-03 21:16:04
100,checkmate atheists,7518,x3wqoo,religiousfruitcake,https://i.redd.it/2kxmdwbewel91.jpg,322,,2022-09-02 14:40:47
101,🤓🤓🤓,96,x4liva,religiousfruitcake,https://i.redd.it/mnhxfxo9nkl91.png,8,,2022-09-03 10:00:33
102,Red lighting makes a demon,19,x4u0m8,religiousfruitcake,https://i.imgur.com/JJUyXMg.jpg,3,,2022-09-03 18:37:00
103,They ain't wrong.,997,x42xal,religiousfruitcake,https://i.redd.it/9oxads42hgl91.jpg,26,,2022-09-02 19:58:18
104,No!!! You're not supposed to say the silent part out loud!!!,270,x4cmb4,religiousfruitcake,https://i.redd.it/ag27zic3hil91.png,5,,2022-09-03 02:42:36
105,An Biblical Fruitcake List of The Things Are Considered As 'Evil',452,x428vd,religiousfruitcake,https://i.redd.it/k2ynizdzbgl91.jpg,90,Link On The Comment Section,2022-09-02 19:29:51
106,Locke's acting wild again. Lord help me with these people.,56,x4fc1z,religiousfruitcake,https://i.imgur.com/8WJwwTJ.jpg,7,,2022-09-03 04:42:09
107,I am starting to think he has a fetish disguised as 'biblical masculinity',125,x465ii,religiousfruitcake,https://i.redd.it/03fufw2c4hl91.png,14,,2022-09-02 22:09:11
108,Got a taste of his own medicine🙃,1338,x3p45z,religiousfruitcake,https://i.redd.it/yqm9hivwqcl91.jpg,58,,2022-09-02 07:26:24
109,"OP is tired of sin, so wants entire planet to face the wrath of their god",127,x41mdq,religiousfruitcake,https://i.redd.it/sbyycpcm6gl91.jpg,21,,2022-09-02 19:01:51
110,"Ali Dawah claiming he can’t gym in the day because he’d be around girls, causing him “fitna” (temptation)… isn’t that kinda creepy?",5753,x34cqm,religiousfruitcake,https://i.redd.it/786vacsb88l91.jpg,501,,2022-09-01 16:15:07
111,100% makes sense,169,x3s9vx,religiousfruitcake,https://i.redd.it/ocaoamfqidl91.png,23,,2022-09-02 10:02:48
112,😡,2440,x34edc,religiousfruitcake,https://i.redd.it/6qmyk5gbq9l91.jpg,183,,2022-09-01 16:17:43
113,Comment decrying a YouTube short about Black Panther 2,62,x3u054,religiousfruitcake,https://i.redd.it/2zn7ge9f0el91.jpg,6,,2022-09-02 11:41:31
114,He must have felt so smart when posting this,1141,x37q00,religiousfruitcake,https://i.redd.it/cfuaa2bi19l91.png,150,,2022-09-01 18:59:20
115,Brainwashed Child Of Fruitcake Parent Flipped Out The Dinosaurs Oof,7283,x2vp8v,religiousfruitcake,https://i.redd.it/i1982teiq5l91.jpg,536,,2022-09-01 07:51:43
116,WTF?,637,x37zdu,religiousfruitcake,https://i.redd.it/6jrqmihp39l91.jpg,56,,2022-09-01 19:11:01
117,Taking back the rainbow in Jesus’ name!,479,x38yna,religiousfruitcake,https://i.redd.it/qsusfaf7b9l91.jpg,40,,2022-09-01 19:53:03
118,"A man I work with has told me (on multiple occasions), ""Marco Polo described dinosaurs perfectly in his travel books"". And that I should ""check out the information,"" i.e. YouTube videos, because the evidence is ""shocking""",63,x3ml9o,religiousfruitcake,https://i.redd.it/43umh63u5cl91.jpg,8,,2022-09-02 05:28:16
119,Muslim men protect women.,141,x3c2fb,religiousfruitcake,https://i.redd.it/zgq7eotzx9l91.jpg,9,,2022-09-01 22:00:47
120,The same Jesusmobile on a different day.,42,x3jcgr,religiousfruitcake,https://i.redd.it/d5e86i2lgbl91.jpg,1,,2022-09-02 03:06:46
121,i was hoping to learn more about the flood,72,x3dg2j,religiousfruitcake,https://i.redd.it/stzrordf8al91.png,13,"But I forgot that I'd shared a link from The Satanic Temple, so they saw it and blocked me in less than 30 seconds of requesting to join. Sad, I just wanted to learn what they've discovered about the flood!",2022-09-01 22:59:15
122,Biblical names ONLY!!!,1156,x2tcbp,religiousfruitcake,https://i.redd.it/1ou7tj0d65l91.jpg,61,,2022-09-01 05:59:50
123,"NASA: Shit, the Christians are on to us again...",4317,x2b5xt,religiousfruitcake,https://i.redd.it/bpee5zm9b1l91.jpg,151,,2022-08-31 16:59:08
124,awesome does the holy spirt make my food taste aweful too?,223,x2waj8,religiousfruitcake,https://i.redd.it/9ii28krlv5l91.jpg,24,,2022-09-01 08:20:14
125,Found these on a video showing a machine that cleans ginger,62,x32dz2,religiousfruitcake,https://i.redd.it/llnrmy2xm7l91.jpg,15,,2022-09-01 14:15:07
126,so progressive! Prophet Muhammad Gave rights to women before everyone,1513,x2gbj3,religiousfruitcake,https://i.redd.it/f2mxu7xmg2l91.jpg,64,,2022-08-31 20:51:00
127,"Never thought I’d ever see one of these in person, I always assumed they were satire. This person showed up to the club signup day at my university.",699,x2ljuq,religiousfruitcake,https://i.redd.it/bkp0w0l3j3l91.jpg,122,I’m pissed lesbians get to be on there twice for the same thing while I only get one sin for my sexuality.,2022-09-01 00:26:35
128,“Incest was okay then.”,606,x2l3c2,religiousfruitcake,https://i.redd.it/1pq9gvlof3l91.jpg,65,,2022-09-01 00:07:42
129,Uhhh… OK,500,x2gywo,religiousfruitcake,https://i.redd.it/xuyypldhl2l91.jpg,41,,2022-08-31 21:18:13
130,Religious fruitcake invades the TV review community,107,x2ji23,religiousfruitcake,https://i.redd.it/itcwiyq443l91.jpg,26,,2022-08-31 23:02:42
131,the parents are insinuating that the child might be possessed because he’s scared of the cross,7258,x1odnq,religiousfruitcake,https://i.redd.it/vm5t7bcptvk91.jpg,434,,2022-08-30 22:31:47
132,"""Holy War""",123,x2e4mp,religiousfruitcake,https://i.redd.it/ct2d1bva02l91.jpg,6,,2022-08-31 19:19:26
133,Please tell me this shit is illegal. Job application questions someone put on indeed,1254,x1yjfo,religiousfruitcake,https://i.redd.it/nvvljvylvxk91.jpg,145,,2022-08-31 05:26:01
134,But a Christian After school club is fine,204,x20wd6,religiousfruitcake,https://i.redd.it/fvprsiw8fyk91.jpg,21,,2022-08-31 07:16:05
135,"Oh my lord, these people...",194,x1zdes,religiousfruitcake,https://i.redd.it/bitu6gkh2yk91.jpg,26,,2022-08-31 06:04:36
136,Ninja academy in Kerala,2072,x1fmnm,religiousfruitcake,https://i.redd.it/pwlbbrrxwtk91.jpg,134,,2022-08-30 16:06:22
137,Only religion could cause so much turmoil in someone's life when it comes to something so natural,217,x1sxe9,religiousfruitcake,https://i.redd.it/ihgx2inzpwk91.jpg,34,,2022-08-31 01:33:34
138,what,2669,x1btm6,religiousfruitcake,https://i.redd.it/gjgcpvpwpsk91.jpg,200,,2022-08-30 12:05:13
139,Fruitcake,217,x1sexq,religiousfruitcake,https://i.redd.it/oacmceagmwk91.jpg,33,,2022-08-31 01:12:58
140,I don't know what it means but I feel offended.,121,x1u9br,religiousfruitcake,https://i.redd.it/mcrq50skzwk91.jpg,13,,2022-08-31 02:26:28
141,I’m done,80,x1xb35,religiousfruitcake,https://i.redd.it/hej99ybwlxk91.jpg,14,,2022-08-31 04:31:35
142,We out here being dumb af,689,x1fayn,religiousfruitcake,https://i.redd.it/j3cac30jttk91.png,54,,2022-08-30 15:47:25
143,a state head of the Ruling party in india,211,x1feps,religiousfruitcake,https://i.redd.it/tsjhas7jutk91.jpg,42,,2022-08-30 15:53:40
144,Student Loan Forgiveness is NOT Christlike,54,x1nleg,religiousfruitcake,https://i.redd.it/6jiicyt5ovk91.png,10,,2022-08-30 22:00:44
145,True,1535,x11x6t,religiousfruitcake,https://i.redd.it/8uic3y7ebqk91.jpg,59,,2022-08-30 04:00:15
146,How theists view atheists... always the same,4272,x0oesy,religiousfruitcake,https://i.redd.it/b8s94ljljnk91.png,225,,2022-08-29 18:41:11
147,Cheesus is Lord,225,x1492r,religiousfruitcake,https://i.redd.it/fzbacxoktqk91.jpg,13,,2022-08-30 05:42:08
148,An imam in my country just said the reason of pedophilia is kids wearing revealing clothes and thats why we shoud'nt criminalize pedophilia.,383,x0zmip,religiousfruitcake,https://i.redd.it/suguqn4hupk91.jpg,73,,2022-08-30 02:25:27
149,I laughed reacted a post about praying that a band stayed together and that it was a sign from God they’d made 11 albums,53,x1c5xy,religiousfruitcake,https://i.redd.it/mgomz5irtsk91.jpg,11,,2022-08-30 12:26:46
150,MAGA Fruitcake Conspiracy Theory,5562,x0e6ng,religiousfruitcake,https://i.redd.it/v694heqdmkk91.jpg,447,,2022-08-29 08:51:09
151,Who Knew Virgin Birth was SO Common!?,117,x12ap6,religiousfruitcake,https://i.redd.it/8i9e74f7eqk91.png,20,,2022-08-30 04:16:05
152,"Apparently Atheists are violent and gay while Catholics are cultured, healthy, and straight.",281,x0va0b,religiousfruitcake,https://i.redd.it/ki2qlafnyok91.jpg,46,,2022-08-29 23:28:50
153,"""YHWH/Yahweh Is Superior Deity And One Only TRUE God!""",45,x18gci,religiousfruitcake,https://i.redd.it/ylgnapmjsrk91.jpg,18,,2022-08-30 08:58:09
154,What is this I don't even…,1574,x0gvk5,religiousfruitcake,https://i.redd.it/ezvjm28fclk91.jpg,186,,2022-08-29 11:17:06
155,Could be a satire based on their post history,140,x0tr53,religiousfruitcake,https://i.redd.it/bghu2eexnok91.jpg,20,,2022-08-29 22:26:57
156,morons,203,x0pnwk,religiousfruitcake,https://i.redd.it/tt23ektitnk91.jpg,32,,2022-08-29 19:36:35
157,I mean I kind of agree with PragerU on this one just not so much the owe it part.,610,x0im3z,religiousfruitcake,https://i.redd.it/sz11rjkivlk91.png,112,,2022-08-29 13:04:10
158,Ahh God Almighty is worried that some human is using the fridge light.,77,x0sxl8,religiousfruitcake,https://i.redd.it/cch3c9zqhok91.jpg,42,,2022-08-29 21:52:19
159,Do you …?,31,x0yxhz,religiousfruitcake,https://i.redd.it/bioh1sajppk91.jpg,5,,2022-08-30 01:57:44
160,I have no words...,6157,wzx0kn,religiousfruitcake,https://i.redd.it/7rlaffj4ugk91.jpg,434,,2022-08-28 20:07:26
161,I don't understand but we apparently appreciate tribal traditions but not Christian.,1417,x03rsb,religiousfruitcake,https://i.redd.it/efbmzihs9ik91.jpg,107,,2022-08-29 00:57:56
162,They just had to make Mao talk like that didn't they? (also GOMMUNISM KILLED 100 BILLION TRILLION),4277,wzvggu,religiousfruitcake,https://i.redd.it/5df3ior2hgk91.jpg,396,,2022-08-28 18:55:28
163,Every single time it’s this same damn false equivalence and whataboutism.,419,x0buie,religiousfruitcake,https://i.redd.it/4vv37bl52kk91.jpg,34,,2022-08-29 06:57:46
164,If I punch you in the fact you shouldn’t be angry because free will,78,x0inkx,religiousfruitcake,https://i.redd.it/bcedp8vzvlk91.jpg,16,"I love the ending of ‘his ways are not our ways’ 


Context: this was under a video explaining how the “choice” god gives is really extortion.",2022-08-29 13:06:48
165,How dare you not Taylor to a small percentage of a single city’s Catholic population!,322,x05d7d,religiousfruitcake,https://i.redd.it/hnp2aztwlik91.jpg,22,,2022-08-29 02:04:57
166,"Jesus's DNA, available now at the flea market, $20 a vial",421,x02khr,religiousfruitcake,https://i.redd.it/d13iiy011ik91.jpg,72,,2022-08-29 00:08:13
167,Transforme wife strikes again,2976,wznitk,religiousfruitcake,https://i.redd.it/1zhomgc74ek91.jpg,154,,2022-08-28 10:58:33
168,Such a complicated science was known in 6000B.C 🤡,210,x01lan,religiousfruitcake,https://i.redd.it/rwpz9zzqthk91.jpg,39,,2022-08-28 23:27:08
169,"Mario Schwartzmann, Brazilian Flat Earther, Anti-Vax, NWO, etc. influencer died January 13th, 2022 due to refusing diabetes treatment. More context and translations in the comments.",54,x0bnvv,religiousfruitcake,https://i.redd.it/jl7r59b10kk91.png,4,,2022-08-29 06:48:46
