,title,score,id,subreddit,url,num_comments,body,created
170,Fruitcake throws away a lifetime pension just six months short of being able to collect,83,x04f0e,religiousfruitcake,https://i.redd.it/0vl5dzbseik91.jpg,14,"An American Airman just six months away from being able to retire is now being kicked out of the military due to choosing to risk his career over applying for religious exemption for the mandatory COVID vaccination. His major complaint is that the chaplains who decided his convictions weren't sincere enough were being ""subjective"" in their decisions. I guess that means all he needs to do is prove god is objectively real and objectively opposed to that vaccine and he can claim his pension. Easy enough, right?",2022-08-29 01:25:00
171,I’ve been given bibles now just working at a gas station I’m invited to a cult!,139,wzytah,religiousfruitcake,https://i.redd.it/c4tuajn98hk91.jpg,16,,2022-08-28 21:26:43
172,Orthobros are a joke,557,wzoazn,religiousfruitcake,https://i.redd.it/0138q7ldcek91.jpg,42,,2022-08-28 11:44:23
173,You may be hearing a lot about Padre Pio lately because of Shia's new movie. Pio protected Nazis and their weapons. Garbage human being played by another garbage person with their garbage acting.,31,x06d7v,religiousfruitcake,https://i.redd.it/2755jp17tik91.png,14,,2022-08-29 02:47:46
174,Dystopian church-ruled state coming soon to a society near you!,4487,wz5klx,religiousfruitcake,https://i.redd.it/jn2edn3wx9k91.jpg,239,,2022-08-27 20:56:03
175,The Bible was written in Greek and Hebrew but sure this one English translation is the only true English translation.,339,wzjdef,religiousfruitcake,https://i.redd.it/2o6etigd0dk91.jpg,28,,2022-08-28 07:15:18
176,Insanity,329,wzj24b,religiousfruitcake,https://i.redd.it/m0k9myohxck91.jpg,48,,2022-08-28 06:59:09
177,"It’s a bit old, but still relevant",571,wzdymt,religiousfruitcake,https://i.redd.it/o9i1czi7qbk91.jpg,30,,2022-08-28 02:56:35
178,Religious Karen​ think Pokemon cards and energy is demonic.,3378,wyz4zk,religiousfruitcake,https://i.redd.it/o52yccqoc8k91.jpg,235,,2022-08-27 15:35:30
179,Betta get right wit Jeebz,89,wzj4il,religiousfruitcake,https://i.redd.it/odgqp9e2yck91.jpg,15,,2022-08-28 07:02:23
180,"Advise me on ""planting seeds of conversion"" into the minds of my family - redditor",138,wzeqxr,religiousfruitcake,https://i.redd.it/4v8l4rsgvbk91.jpg,13,,2022-08-28 03:32:35
181,Holy shit these people are delusional,4375,wylitb,religiousfruitcake,https://i.redd.it/fq2p0gxcr4k91.jpg,269,,2022-08-27 03:30:32
182,Did you know you can’t wish Mercy on non-believers? Allah will get mad! This discourse happens every time a non-Muslim celebrity dies.,301,wz0w7t,religiousfruitcake,https://i.redd.it/vjvswoptu8k91.jpg,14,,2022-08-27 17:17:06
183,"Faith without works is useless but, it doesn’t matter how much I work because it’s gods decision anyway?",307,wyyho5,religiousfruitcake,https://i.redd.it/dm40l3ri58k91.jpg,26,,2022-08-27 14:55:17
184,Catholic Propaganda,114,wz268m,religiousfruitcake,https://i.redd.it/zc8wwe9t69k91.jpg,33,,2022-08-27 18:24:22
185,Why even bother having elections anymore? Supreme executive power derives from a mandate from the eagles,69,wz4ef6,religiousfruitcake,https://i.redd.it/rbbfkjano9k91.png,12,,2022-08-27 20:05:59
186,Crosspost not allowed,5258,wy8jkq,religiousfruitcake,https://i.redd.it/75phlkhj22k91.jpg,218,,2022-08-26 18:28:11
187,Is this a threat?,306,wyrtco,religiousfruitcake,https://i.redd.it/btw81mbu86k91.jpg,25,,2022-08-27 08:30:18
188,💀💀💀,1313,wyfgbc,religiousfruitcake,https://i.redd.it/oolrfotjh3k91.jpg,115,,2022-08-26 23:13:48
189,They really gotta stop with that persecution complex,296,wynu0l,religiousfruitcake,https://i.redd.it/zdkunhrw95k91.jpg,46,,2022-08-27 05:14:30
190,Not only does ya spouse owns ya body but it is also a sin to deny Sex?,153,wypgnc,religiousfruitcake,https://i.redd.it/6wqwla4un5k91.jpg,20,,2022-08-27 06:32:33
191,"Basically, this god is useless and so are prayers. Right??",5773,wy07bv,religiousfruitcake,https://i.redd.it/76x6aakoqzj91.jpg,185,,2022-08-26 10:37:55
192,So far yet so close,1581,wy4aoo,religiousfruitcake,https://i.redd.it/ivizwxv1y0k91.jpg,19,,2022-08-26 14:40:56
193,"""Christianity is one and only TRUTHFUL religion, the rest are trash~!""",64,wyq31z,religiousfruitcake,https://i.redd.it/fn3qdtm9t5k91.jpg,12,,2022-08-27 07:03:00
194,An insult to left-wing seculars.,370,wych3z,religiousfruitcake,https://i.redd.it/qc6m93vyv2k91.jpg,62,,2022-08-26 21:12:49
195,Jesus is a creeper,448,wy8xcb,religiousfruitcake,https://i.redd.it/23lal2ig52k91.jpg,27,,2022-08-26 18:44:15
196,"Ah yes, massive doors are proof of giants.",43,wyo84r,religiousfruitcake,https://i.redd.it/74tmhui4d5k91.jpg,4,,2022-08-27 05:32:50
197,"Good people don’t go to heaven, Forgiven people do.",51,wykbq6,religiousfruitcake,https://i.redd.it/cnl87cy5i4k91.jpg,7,So heaven is full of horrible people that did horrible things but ask for forgiveness? They think this is a flex?,2022-08-27 02:39:00
198,"Ah yes, obviously a sin",261,wy4plc,religiousfruitcake,https://i.redd.it/droh9oaj21k91.jpg,36,,2022-08-26 15:06:08
199,"""Your tears of subservience taste delicious!""",92,wy93m0,religiousfruitcake,https://i.redd.it/g32jyedb62k91.png,7,,2022-08-26 18:51:53
200,This dunking booth was part of the 'free entertainment' at my children's open house for their public school this evening. That's the gym teacher...,1418,wxqk8c,religiousfruitcake,https://i.redd.it/bl6wle89kxj91.jpg,109,,2022-08-26 03:18:33
201,How is this not seen as a mental illness?,313,wxyf3t,religiousfruitcake,https://i.redd.it/6ipn2gxnazj91.png,63,,2022-08-26 09:08:06
202,Protest against corruption? No. Protest against concerts? YES,85,wy54un,religiousfruitcake,https://i.redd.it/r6ixuaoz61k91.png,8,,2022-08-26 15:31:04
203,women stay home,226,wxyyr5,religiousfruitcake,https://i.redd.it/p85aqsdffzj91.jpg,18,,2022-08-26 09:34:45
204,Apparently women should just stay at homes and not receive education,585,wxlwym,religiousfruitcake,https://i.redd.it/ywqj5q3amwj91.png,58,,2022-08-26 00:09:03
205,The Gospel of the Undamned,27,wy3i31,religiousfruitcake,https://i.redd.it/6xbmmkhdp0k91.png,5,,2022-08-26 13:52:36
206,"Hey, look what my 6 year old son got handed! Yes, it does have Ezekiel 23:20. Why'd you ask?",76,wxvnru,religiousfruitcake,https://i.redd.it/3nnft88jnyj91.jpg,12,,2022-08-26 06:58:51
207,I have so many issues with this it's hard to pick just one to point out.,43,wxzcl8,religiousfruitcake,https://i.redd.it/x0e1j44rizj91.jpg,15,,2022-08-26 09:53:26
208,Forgiving student loans = End of times,51,wxvith,religiousfruitcake,https://i.redd.it/snpyfjzhmyj91.jpg,8,,2022-08-26 06:52:36
209,They have a van painted like this too,50,wxtqe1,religiousfruitcake,https://i.redd.it/qjbf7cj78yj91.jpg,11,,2022-08-26 05:32:39
210,Found this on the Elon Musk subreddit.,202,wxekuz,religiousfruitcake,https://i.redd.it/a8eqpwx35vj91.png,22,,2022-08-25 19:10:42
211,Interesting title,117,wxi88t,religiousfruitcake,https://i.redd.it/q0y3wmqvvvj91.jpg,14,,2022-08-25 21:39:55
212,This was back in 2020,137,wxey88,religiousfruitcake,https://i.redd.it/zlsaaxd68vj91.png,7,,2022-08-25 19:27:00
213,"Faith, gullibility, delusion. All the same really",113,wxbfgu,religiousfruitcake,https://i.redd.it/e4skuc8cfuj91.jpg,18,,2022-08-25 16:45:48
214,Found in the wild,429,wx04dr,religiousfruitcake,https://i.redd.it/yiey095pcrj91.jpg,69,,2022-08-25 06:25:13
215,"I think this guy hit his head, I'm literally just speechless. I don't even know what tag I should post this under",45,wxbhy7,religiousfruitcake,https://i.redd.it/u5xhnia2guj91.png,19,,2022-08-25 16:49:25
216,More of Jesus the Fetus,148,wx3vto,religiousfruitcake,https://i.redd.it/0sxuxt7r8sj91.jpg,13,"Took this photo about a month ago to send to my wife, but had to post it here after seeing user dukedyduke’s post of the exact same car.",2022-08-25 09:24:54
217,American pastor celebrates mothers dying of pregnancy complications in light of new Tennessee abortion policies,10264,ww957m,religiousfruitcake,https://i.redd.it/x2cq56yh3lj91.jpg,561,,2022-08-24 09:22:57
218,Actress mentions the movie she's in has comedic nudity. Some person with a weird username tries to preach in the comments.,72,wx3rqf,religiousfruitcake,https://i.redd.it/cdm3urap7sj91.jpg,9,,2022-08-25 09:19:03
219,Public school is bad because it's not Christian enough.,738,wwij0b,religiousfruitcake,https://i.redd.it/am48vtcmpnj91.jpg,49,,2022-08-24 18:10:32
220,"Apparently, having the means & freedom to travel is overated & anything but a blessing.",380,wwmxuz,religiousfruitcake,https://i.redd.it/rhdx6w5ymoj91.jpg,21,,2022-08-24 21:17:40
221,'Murica,2972,ww5r4c,religiousfruitcake,https://i.redd.it/3qf1jruhakj91.jpg,83,,2022-08-24 06:40:22
222,Shield them from the rainbow but give the toddler the Bible that probably can't read or even have an understanding of what's going on.,388,wwhp1s,religiousfruitcake,https://i.redd.it/yb6lgw7iinj91.jpg,49,,2022-08-24 17:30:39
223,When someone says,469,ww5ibq,religiousfruitcake,https://i.redd.it/cv8ppctk8kj91.jpg,71,,2022-08-24 06:29:37
224,Fruitcakes respond to news with irrational rationalizations,192,wwadlt,religiousfruitcake,https://i.redd.it/yj1mywroelj91.jpg,29,,2022-08-24 10:27:42
225,Big if…,705,wvz00a,religiousfruitcake,https://i.redd.it/qd82z460vij91.jpg,93,,2022-08-24 01:51:55
226,"""jeEbUs wiLL sET 🌎 oN🔥 vErY sOOn, PrEpArE yOuRseLvEs!!""",85,ww81cr,religiousfruitcake,https://i.redd.it/ttuqiryvtkj91.jpg,5,,2022-08-24 08:29:04
227,Well... I guess that settles it then.,775,wvpxtp,religiousfruitcake,https://i.redd.it/699wd69g1hj91.jpg,62,,2022-08-23 19:44:22
228,so then fearing god doesn't count as fearing.,123,ww4fpx,religiousfruitcake,https://i.redd.it/wm80gzbwzjj91.jpg,13,,2022-08-24 05:40:58
229,"Yeah, that's solid logic and these are 100% FACTS that cannot possibly be refuted...",319,wvv4ui,religiousfruitcake,https://i.redd.it/5n5wee1y1ij91.png,82,,2022-08-23 23:15:05
230,But its decreasing drastically. 🤦‍♂️,295,wvqntn,religiousfruitcake,https://i.redd.it/o88px7ir6hj91.jpg,52,,2022-08-23 20:14:09
231,I attained puberty at the age of 9. This isn't marriage but grooming,181,wvug8y,religiousfruitcake,https://i.redd.it/22mbrig2yhj91.jpg,23,,2022-08-23 22:47:15
232,"Prohibited colours, don't be caught with them.",224,wvrj4u,religiousfruitcake,https://i.redd.it/uk3wc9t0dhj91.jpg,9,,2022-08-23 20:49:13
233,Degeneracy as in anyone who doesn't have the same beliefs as christians,814,wvhzpd,religiousfruitcake,https://i.redd.it/y0x5ch30yej91.jpg,39,,2022-08-23 12:41:27
234,Got this hilarious message from somebody that didn't like my takes on Islam. Figured y'all might enjoy.,108,wvu8gf,religiousfruitcake,https://i.redd.it/q71dt97yvhj91.png,13,,2022-08-23 22:38:26
235,Who is getting angry over adults praying I wonder?,1929,wv9kx4,religiousfruitcake,https://i.redd.it/zwfepw7kucj91.jpg,226,,2022-08-23 05:38:38
236,Ig the religion does allow child marriage 🙄🙄,75,wvtg2b,religiousfruitcake,https://i.redd.it/soto1ehtqhj91.jpg,7,,2022-08-23 22:06:37
237,Person on twitter believes that non-Catholics should be burnt to death,117,wvos4j,religiousfruitcake,https://i.redd.it/5zlpew3qsgj91.jpg,14,,2022-08-23 18:55:26
238,Amen !!!,1543,wv6y7o,religiousfruitcake,https://i.redd.it/tg4fznphacj91.jpg,82,,2022-08-23 03:46:06
239,Pro christian nationalism tweet from a Christian blogger,66,wvoqss,religiousfruitcake,https://i.redd.it/hic25akfsgj91.jpg,7,,2022-08-23 18:53:47
240,Military Fruitcake,68,wvn9l3,religiousfruitcake,https://i.redd.it/6jyfmdaaggj91.png,12,,2022-08-23 17:46:02
241,Promo for a pro-theonomy conference,35,wvor99,religiousfruitcake,https://i.redd.it/pvygds5jsgj91.jpg,11,,2022-08-23 18:54:23
242,Damn,1046,wuvtpr,religiousfruitcake,https://i.redd.it/ixm6re4x3aj91.jpg,143,,2022-08-22 20:25:58
243,These people vote.,1234,wusoxz,religiousfruitcake,https://i.redd.it/ve81lgzog9j91.jpg,75,,2022-08-22 18:15:31
244,this guy that looks like women wouldn't touch him with a stick.,195,wv65ow,religiousfruitcake,https://i.redd.it/px06c0kw4cj91.jpg,33,,2022-08-23 03:14:47
245,YOu'Re fiREd,153,wv3b0u,religiousfruitcake,https://i.redd.it/179c0fymkbj91.jpg,10,,2022-08-23 01:21:11
246,No Fake Christians Allowed!,111,wv2dld,religiousfruitcake,https://i.redd.it/qze0ysaydbj91.jpg,17,,2022-08-23 00:43:43
247,Some of the points are correct though...,178,wuxd6x,religiousfruitcake,https://i.redd.it/o5z8xagveaj91.png,22,,2022-08-22 21:27:09
248,"oh no, we could all be the next China.",107,wuz93q,religiousfruitcake,https://i.redd.it/lwiz49hxraj91.png,36,,2022-08-22 22:40:17
249,Can someone please point me in the direction of the Devil's school? This curriculum sounds great!,713,wuke8i,religiousfruitcake,https://i.redd.it/06jovec857j91.png,46,,2022-08-22 10:27:53
250,That's just sad!,64,wuzkhe,religiousfruitcake,https://i.redd.it/7s06fgiytaj91.jpg,9,,2022-08-22 22:52:46
251,You would think they're a vampire cult at this point...(found on etsy for $50),259,wun3jg,religiousfruitcake,https://i.redd.it/a7lsz36hx7j91.png,48,,2022-08-22 13:06:58
252,I wonder if his butt sweat resembles the face of Christ???,233,wugb0l,religiousfruitcake,https://i.redd.it/irlwl68r46j91.jpg,32,,2022-08-22 07:03:16
253,Somehow; this does not show up ads for Dubai....,41,wuq5fz,religiousfruitcake,https://i.redd.it/w6dpkqt2u8j91.png,4,,2022-08-22 16:09:27
254,Christian who harassed women for wearing bikinis on the beach is fired,1715,wu0vzo,religiousfruitcake,https://i.redd.it/3hpnc3jvt2j91.jpg,97,,2022-08-21 19:56:56
255,"Two days ago a 12 year old christian girl was kidnapped and forced to convert, now this. Pathetic.",131,wuj648,religiousfruitcake,https://i.redd.it/qmlb3oaat6j91.png,6,,2022-08-22 09:23:16
256,They have been saying that but it never happens.,233,wuczds,religiousfruitcake,https://i.redd.it/z9odjvdjd5j91.jpg,44,,2022-08-22 04:30:48
257,Mmmm Devil's Corn C0ck🌽,350,wu9rs6,religiousfruitcake,https://i.redd.it/uvzuax65p4j91.jpg,17,,2022-08-22 02:14:01
258,?????,419,wu5q9o,religiousfruitcake,https://i.redd.it/5ezhe6juu3j91.jpg,32,,2022-08-21 23:24:12
259,Jeans aren’t “decent” enough for tourists visiting this monastery,343,wu7497,religiousfruitcake,https://i.redd.it/0348lrd954j91.jpg,45,,2022-08-22 00:22:38
260,ick,43,wuksih,religiousfruitcake,https://i.redd.it/g7jbggb597j91.jpg,4,,2022-08-22 10:49:49
261,The everything happens for a reason rhetoric is too much,631,wu0axh,religiousfruitcake,https://i.redd.it/zl3o3n45p2j91.jpg,41,,2022-08-21 19:30:24
262,Not letting kids watch Trolls because of Jesus.,137,wu8ez1,religiousfruitcake,https://i.redd.it/s2rdz1q1f4j91.jpg,12,,2022-08-22 01:17:27
263,"Said a person from a country whose entire minority communities got wiped out because of Islam. Jews, Eizidis, and Christians",112,wu8kmc,religiousfruitcake,https://i.redd.it/iyx0abn2g4j91.png,7,,2022-08-22 01:24:08
264,Disgusting,152,wu65dr,religiousfruitcake,https://i.redd.it/r3h73k6xx3j91.jpg,15,,2022-08-21 23:41:25
265,Q confirmed aliens. And also God.,53,wudw7z,religiousfruitcake,https://i.redd.it/2h8e7uoxk5j91.jpg,7,,2022-08-22 05:12:10
266,Imam said concerts attract wrath of Allah,130,wu65zu,religiousfruitcake,https://i.redd.it/yne2aah1y3j91.jpg,22,,2022-08-21 23:42:07
267,“Just let god decide…” 💀💀💀,2832,wtk6s7,religiousfruitcake,https://i.redd.it/xr3q7lz3ayi91.jpg,95,,2022-08-21 04:39:01
268,Physically Abusive spouse is still not a reason to divorce according to this dude.,38,wu8eo3,religiousfruitcake,https://i.redd.it/r6lmfebze4j91.jpg,6,,2022-08-22 01:17:07
269,Christian realizes the “holy spirit” does bad things,27,wu9z3o,religiousfruitcake,https://i.redd.it/ybb53m2pq4j91.jpg,6,,2022-08-22 02:22:44
270,Brian Sauve claims that only Christian kids are holy,982,wthyuo,religiousfruitcake,https://i.redd.it/u0emg4qyrxi91.jpg,80,,2022-08-21 02:57:19
271,"he really believes this. he's a devout Catholic, if that helps.",63,wtxeb0,religiousfruitcake,https://i.redd.it/9s6s92m7y1j91.jpg,4,,2022-08-21 17:00:42
272,These types of arguments are always the most mind numbingly irritating,113,wtu8nz,religiousfruitcake,https://i.redd.it/24foxksqy0j91.jpg,23,,2022-08-21 13:41:12
273,"The mental hurdles these people have to navigate, it saddens me...",658,wthxyy,religiousfruitcake,https://i.redd.it/vf267w2jrxi91.jpg,59,,2022-08-21 02:56:11
274,Heaven-sanctioned religious discrimination,5854,wt3qhi,religiousfruitcake,https://i.redd.it/nlti295sgui91.jpg,240,,2022-08-20 15:50:09
275,"I don't know what's more staggering here - the ""christian love"" or the irony",27,wtyrh1,religiousfruitcake,https://i.redd.it/9ohz1588b2j91.jpg,5,,2022-08-21 18:15:14
276,"I’ll take “strawman arguments” for $600, Alex",25,wtz0rm,religiousfruitcake,https://i.imgur.com/59BPk1q.jpg,4,,2022-08-21 18:28:42
277,I’m not sure what’s stranger: the note or how it was hung up on the tree?,107,wtp15v,religiousfruitcake,https://i.redd.it/poe9s6eugzi91.jpg,18,,2022-08-21 08:38:33
278,"""I don't think genocide is inherently evil.""",69,wtqrzr,religiousfruitcake,https://i.redd.it/wf01zi1nxzi91.jpg,18,,2022-08-21 10:12:48
279,This person wants Christian blasphemy laws.,747,wta6uf,religiousfruitcake,https://i.redd.it/1aluujfv2wi91.jpg,99,,2022-08-20 21:14:54
280,So Rich Penkoski hates Manly Bands,136,wtla23,religiousfruitcake,https://i.redd.it/ghtmf66djyi91.png,11,,2022-08-21 05:30:58
281,President of Loor claims that theonomy is inevitable,155,wta1a8,religiousfruitcake,https://i.redd.it/d9ogzyfn1wi91.jpg,16,,2022-08-20 21:08:02
282,Christian author wants to get rid of the Civil Rights Act of 1964( posted here as they want the law repealed for religious reasons),74,wtes90,religiousfruitcake,https://i.redd.it/pgbjcj2c2xi91.jpg,8,,2022-08-21 00:33:40
283,Truly worse.,43,wthpvd,religiousfruitcake,https://i.redd.it/25va7cdzpxi91.jpg,7,,2022-08-21 02:46:13
284,“The Devil and Pope are in changing day to trouble with the holy Sunday God for Sabbath.”,102,wtab5n,religiousfruitcake,https://i.redd.it/1pfwnses3wi91.jpg,14,,2022-08-20 21:20:02
285,“Christiandom 2.0”,41,wta3c0,religiousfruitcake,https://i.redd.it/623hytr32wi91.jpg,14,,2022-08-20 21:10:35
286,How they really think. How can anyone actually think like this!?,3995,wsgthp,religiousfruitcake,https://i.redd.it/lmmier4suoi91.jpg,323,,2022-08-19 20:57:08
287,Trust in God to fix a broken bone.,1645,wsmom7,religiousfruitcake,https://i.redd.it/6ief9pd72qi91.jpg,157,,2022-08-20 01:00:33
288,This is so so so very ironic😭😭😭,326,wsvepz,religiousfruitcake,https://i.redd.it/q8lo8gq90si91.jpg,46,,2022-08-20 07:33:15
289,Whaaa??,750,wskaq6,religiousfruitcake,https://i.redd.it/1yj1dhogkpi91.jpg,66,,2022-08-19 23:21:02
290,I know most of these have been disproven so I post it here. But hey a Spongebob meme either way.,383,wso93y,religiousfruitcake,https://i.redd.it/pqptcpl1eqi91.jpg,40,,2022-08-20 02:06:55
291,I sense wine in a coffee cup and an ability to repair drywall on the right.,932,wsf7u2,religiousfruitcake,https://i.redd.it/a57aee0rioi91.jpg,139,,2022-08-19 19:49:38
292,"Every time the sun comes out after it rains, I am offended 🌦🌈",224,wspc5l,religiousfruitcake,https://i.redd.it/l1ujoql3mqi91.jpg,21,,2022-08-20 02:51:58
293,Pretty tired of hearing about public schools are this and that.,190,wsog39,religiousfruitcake,https://i.redd.it/yq5h707hfqi91.png,24,,2022-08-20 02:14:58
294,Incest too!?,411,wsi9ka,religiousfruitcake,https://i.redd.it/i6ehviee5pi91.jpg,83,,2022-08-19 21:56:39
295,Came across this during an argument where a guy blocked someone who said she was an atheist.,74,wsuica,religiousfruitcake,https://i.redd.it/ydd6hjv8sri91.jpg,20,,2022-08-20 06:48:12
296,Totally normal thing for parents to do. Gotta love Utah 😍,3875,ws3l30,religiousfruitcake,https://i.redd.it/5ooilet1dli91.jpg,246,,2022-08-19 09:12:32
297,I think it is lost on them that they are warning us that THEY will evaporate.,114,wsix48,religiousfruitcake,https://i.redd.it/1npu4nb9api91.jpg,25,,2022-08-19 22:23:49
298,34 years of prison sentence for using Twitter.,659,ws7l6t,religiousfruitcake,https://i.redd.it/qt476mjsgmi91.jpg,58,,2022-08-19 12:55:09
299,Blatant greed,261,wscldg,religiousfruitcake,https://i.redd.it/bb86kp6exni91.jpg,24,,2022-08-19 17:49:55
300,faith supersedes logic apparently,54,wsogt8,religiousfruitcake,https://i.redd.it/wu7vrb4nfqi91.jpg,13,,2022-08-20 02:15:46
301,This fruitcake was walking around with a bullhorn yelling bible verses at people sitting outside at a brewery,68,wsljhd,religiousfruitcake,https://i.redd.it/77bivfbntpi91.jpg,15,,2022-08-20 00:12:31
302,"It's absolutely alright cause.. ""religion""",172,wsefan,religiousfruitcake,https://i.redd.it/uc3t4k3ncoi91.jpg,9,,2022-08-19 19:15:28
303,Found on the back of a local school bus.,2992,wrvor8,religiousfruitcake,https://i.redd.it/06b4ggwikji91.jpg,192,,2022-08-19 03:10:41
304,Atheists are as reasonable as a flat earther,2810,wrsjoa,religiousfruitcake,https://i.redd.it/j5ri71fyxii91.jpg,158,,2022-08-19 01:04:11
305,crazy christian,66,wshcof,religiousfruitcake,https://i.redd.it/ohzofpkqyoi91.jpg,14,,2022-08-19 21:19:16
306,This is stretching way too much.,573,ws2mtu,religiousfruitcake,https://i.redd.it/zbfe2csm4li91.jpg,54,,2022-08-19 08:25:51
307,Krishna was born at 12:00 a.m. 🤡,28,wsm529,religiousfruitcake,https://i.redd.it/8oel1894ypi91.jpg,17,,2022-08-20 00:37:36
308,Why is this ad following me everywhere?,86,wsbhpw,religiousfruitcake,https://i.redd.it/y3ds9jk9nni91.png,15,,2022-08-19 16:53:14
309,Jesus Is Biggest Stalker,352,ws0mhl,religiousfruitcake,https://i.redd.it/4npzn32znki91.jpg,43,,2022-08-19 06:51:55
310,They talk about some wild things in the muslimlounge subreddit,4719,wrghij,religiousfruitcake,https://i.redd.it/wpjfq5qkdgi91.jpg,320,,2022-08-18 16:26:22
311,I am sure this is a woman telling women to be quiet.,271,ws1094,religiousfruitcake,https://i.redd.it/ogfox181rki91.jpg,47,,2022-08-19 07:09:31
312,On meet Arnold channel's video about evolution,46,wsb0u5,religiousfruitcake,https://i.redd.it/354mp7rvini91.jpg,6,,2022-08-19 16:28:38
313,When you’re so radicalized that you start despising your own loving progressive family.,206,ws2g3u,religiousfruitcake,https://i.redd.it/3org4rl63li91.jpg,14,,2022-08-19 08:17:03
314,God wouldn't make a plant in shape of penis. This is fake!,2435,wrikj4,religiousfruitcake,https://i.redd.it/cux527w8wgi91.jpg,177,,2022-08-18 18:11:05
315,God & The Flying Spaghetti Monster's Existence Humor,19561,wr5uel,religiousfruitcake,https://i.redd.it/9qbbtmdghdi91.jpg,350,,2022-08-18 06:42:46
316,Nudity is bad even though Adam and Eve being naked and realizing it was what got them caught for it.,104,ws1fbi,religiousfruitcake,https://i.redd.it/067mgssouki91.jpg,18,,2022-08-19 07:29:29
317,Unification church protesting at seoul after widespread media coverage and criticism in japan.,42,ws6i49,religiousfruitcake,https://i.redd.it/93amsps05mi91.png,6,,2022-08-19 11:49:56
318,"Wow…just, wow.",203,wruxdd,religiousfruitcake,https://i.redd.it/kw0ikd92fji91.jpg,40,,2022-08-19 02:40:04
319,Happy Krishna Janmashtami to all,8,wshw8n,religiousfruitcake,https://i.redd.it/nayd3mwp2pi91.jpg,10,,2022-08-19 21:41:35
320,"Religion is poison, it absolutely ROTS the mind",222,wrtuld,religiousfruitcake,https://i.redd.it/9n7e0iay6ji91.jpg,12,,2022-08-19 01:56:44
321,Jesus potato,436,wraqls,religiousfruitcake,https://i.redd.it/2qq1pynunei91.jpg,49,,2022-08-18 10:40:25
322,Hardcore blogpost screenshot sent to this subreddit’s twitter account,88,wrkbth,religiousfruitcake,https://i.redd.it/hqjiiqwcahi91.jpg,9,,2022-08-18 19:30:08
323,"Honey, shall we go introduce ourselves to the new neighbors?",2043,wqv8eb,religiousfruitcake,https://i.redd.it/sh7ccz7k9bi91.jpg,141,,2022-08-17 23:14:58
324,‘Where would you be?’,3105,wqmm7o,religiousfruitcake,https://i.redd.it/kpuef486f9i91.jpg,241,,2022-08-17 17:02:52
325,The fact this got 100k likes worries me.,253,wr4vbl,religiousfruitcake,https://i.redd.it/m1fq6qcn9di91.jpg,32,,2022-08-18 05:59:01
326,"Found this today, translates to: Instinct is natural, homosexuality isn't",1008,wqqupv,religiousfruitcake,https://i.redd.it/gls3fhrsdai91.jpg,84,,2022-08-17 20:16:58
327,Throwback from almost 2 years ago.,613,wquav2,religiousfruitcake,https://i.redd.it/rvxf4d4h2bi91.jpg,47,,2022-08-17 22:35:15
328,An argument that if a religion has many followers then it should be convincing shouldn’t be used.,466,wqt8hw,religiousfruitcake,https://i.redd.it/xjdbixiruai91.jpg,34,,2022-08-17 21:52:03
329,A Dark Demonic Force,433,wqpgoo,religiousfruitcake,https://i.redd.it/ekvpjl9f3ai91.jpg,56,,2022-08-17 19:18:48
330,Well this religious decal certainly caught me off guard,60,wr2zex,religiousfruitcake,https://i.redd.it/tlkhrn1auci91.jpg,5,,2022-08-18 04:32:55
331,"Fruitcake can’t comprehend genetics, surely my height is a blessing from the hand of god?",211,wqpsrp,religiousfruitcake,https://i.redd.it/2t9uz1gw5ai91.jpg,24,,2022-08-17 19:32:41
332,Victim mentality of religious people never fails to amaze me.,1507,wqdu8r,religiousfruitcake,https://i.redd.it/de678l90x6i91.jpg,143,,2022-08-17 08:37:46
333,What I find disappointing yet funny is how wrong they are and how it shows they don't understand anything about other religions when they post stuff like this.,633,wqihid,religiousfruitcake,https://i.redd.it/mo8jweog68i91.jpg,65,,2022-08-17 12:53:37
334,I am pretty sure Christians have a God whose gender is ambiguous but okay.,756,wqhdqq,religiousfruitcake,https://i.redd.it/p1t8s6xiu7i91.jpg,159,,2022-08-17 11:46:26
335,Hindu fruitcakes,70,wqx6j1,religiousfruitcake,https://i.redd.it/1mihcmjsnbi91.jpg,8,,2022-08-18 00:34:44
336,"Oh, so that's what GMC stands for",55,wqyixc,religiousfruitcake,https://i.redd.it/ttr2dufnxbi91.jpg,8,,2022-08-18 01:30:01
337,Ah yes LGBTQ is a choice that's tempted by God,119,wqr8sx,religiousfruitcake,https://i.redd.it/dv19fanogai91.jpg,13,,2022-08-17 20:33:08
