,title,score,id,subreddit,url,num_comments,body,created
509,Bible featured in Prom photos,87,why5f1,religiousfruitcake,https://i.redd.it/mb5amtuiq5g91.jpg,8,,2022-08-07 02:31:05
510,A street preacher in Birmingham preaching about the sins of partying,71,whvfmc,religiousfruitcake,https://i.redd.it/vcz7m1cn35g91.jpg,8,,2022-08-07 00:23:24
511,"We don’t need doctors, God will heal!",100,whqo8g,religiousfruitcake,https://i.redd.it/1vx9sg4114g91.jpg,14,,2022-08-06 20:46:26
512,from a parody twitter account,60,whrcqj,religiousfruitcake,https://i.redd.it/vy24jptm64g91.jpg,1,,2022-08-06 21:17:49
513,Ignoring the history of Birmingham in the Commonwealth Games 2022,37,whrk1s,religiousfruitcake,https://i.redd.it/ro8oox2a84g91.png,2,,2022-08-06 21:27:06
514,Do not watch The Sandman if you haven't accepted Jesus into your heart,49,whpja4,religiousfruitcake,https://i.redd.it/464z06ycr3g91.png,3,,2022-08-06 19:54:24
515,"""Women are supposed to stay at homes!""",169,wheb4p,religiousfruitcake,https://i.redd.it/lstgb6hli0g91.jpg,28,,2022-08-06 08:57:45
516,Risking the lives of tribesmen in the name of Jesus,1429,wgwpf5,religiousfruitcake,https://i.redd.it/4gsxbsq0mwf91.jpg,138,,2022-08-05 19:49:49
517,Sexually Transmitted Demons,147,whd2ki,religiousfruitcake,https://i.redd.it/elbdf9fv60g91.jpg,18,,2022-08-06 07:52:02
518,Another insane facebook mom...,400,wh5l3k,religiousfruitcake,https://i.redd.it/bikh8aicgyf91.jpg,49,,2022-08-06 02:02:29
519,calm down calm down,711,wgyiox,religiousfruitcake,https://i.redd.it/bl1t79rbzwf91.jpg,38,,2022-08-05 21:04:29
520,"With the billions churches have they could solve all the poverty, hunger, and homelessness, but they choose to protect themselves.",96,whchih,religiousfruitcake,https://i.redd.it/8xydlhwg10g91.jpg,4,,2022-08-06 07:21:45
521,the ignorance is showing,60,whe8fb,religiousfruitcake,https://i.redd.it/6aryivewh0g91.jpg,3,,2022-08-06 08:53:52
522,The Power of Prayer,72,whd44y,religiousfruitcake,https://i.redd.it/vtz1qu8a70g91.jpg,19,,2022-08-06 07:54:20
523,Pointing out how Islamic teachings are abusive and traumatizing is a feminist conspiracy theory,107,wha0yd,religiousfruitcake,https://i.redd.it/gw7amfvrfzf91.jpg,3,,2022-08-06 05:20:09
524,HELL IS HAWT,3883,wgm9w5,religiousfruitcake,https://i.redd.it/q4sp1sidstf91.jpg,307,,2022-08-05 10:20:06
525,"Another one, then another one, then another one 🤣",163,wh5p71,religiousfruitcake,https://i.redd.it/or6f3eydhyf91.jpg,5,,2022-08-06 02:07:25
526,Help!,384,wgyslq,religiousfruitcake,https://i.redd.it/klnpk8xe1xf91.jpg,9,,2022-08-05 21:16:05
527,I’m sorry but what the hell does even mean?,193,wh0kh6,religiousfruitcake,https://i.redd.it/lvpx4mwnexf91.jpg,58,,2022-08-05 22:30:22
528,Christian on twitter claims to have seen an angel in person,79,wgyoi6,religiousfruitcake,https://i.redd.it/7gjzuwij0xf91.jpg,22,,2022-08-05 21:11:13
529,God should pay child support then,8792,wfvhaz,religiousfruitcake,https://i.redd.it/8hscy2a0nnf91.jpg,450,,2022-08-04 13:39:19
530,So apparently Jesus should be allowed in schools. But it's drag in our schools.,119,wgn1o4,religiousfruitcake,https://i.redd.it/0kzdzampztf91.jpg,36,,2022-08-05 11:01:51
531,"Bad things happening everywhere, meanwhile, evangelical sermons:",608,wgbhhv,religiousfruitcake,https://i.redd.it/3mdb1vk2crf91.jpg,62,,2022-08-05 02:05:08
532,Because Christians are known for being original,1281,wg5aef,religiousfruitcake,https://i.redd.it/aum4f3dw1qf91.jpg,105,,2022-08-04 21:46:22
533,Name a more Iconic duo than a religious person and oppressive beliefs.,117,wgl5p3,religiousfruitcake,https://i.redd.it/7q1ih842itf91.jpg,15,,2022-08-05 09:22:16
534,cRapture is imminent,77,wgmbm1,religiousfruitcake,https://i.redd.it/q2f4sr3ustf91.jpg,33,,2022-08-05 10:22:40
535,Of all the times I see this picture just have to post it here with the most recent page I got this from.,1297,wg0nso,religiousfruitcake,https://i.redd.it/i7cdzgru2pf91.png,84,,2022-08-04 18:30:04
536,"Canon Press, a Christian focused publishing company, uses its twitter account to demean & insult Aimee Byrd, who is a female preacher.",56,wgkd0z,religiousfruitcake,https://i.redd.it/iciq6me0btf91.jpg,3,,2022-08-05 08:42:45
537,“Full vaccinated” with Jesus Blood…,153,wgcqe8,religiousfruitcake,https://i.redd.it/bor7w142lrf91.jpg,14,,2022-08-05 02:55:31
538,"These people are experts in making things up and writing clearly fictitious books. Also, scientific theories and hypotheses aren't just wild guesses and lies, they are very much based on facts and evidence.",90,wgbyvy,religiousfruitcake,https://i.redd.it/ti3e5u0serf91.png,7,,2022-08-05 02:25:01
539,Photo/screenshot of Pastor Gene Kim giving a sermon about monkeypox( photo originally posted by Hermant Mehta on twitter),232,wg2dkd,religiousfruitcake,https://i.redd.it/jrachtlegpf91.jpg,33,,2022-08-04 19:45:52
540,Hardcore pro-patriarchy tweet,91,wg95dc,religiousfruitcake,https://i.redd.it/90egj25auqf91.jpg,4,,2022-08-05 00:25:26
541,"Is this theofascism supposed to be satire? Trolling? Either was, it's disgusting.",195,wg1ldq,religiousfruitcake,https://i.redd.it/t5yasstrjkf91.png,12,,2022-08-04 19:12:05
542,Comparing things that can be demonstrated to God that can't be demonstrated.,1358,wfp980,religiousfruitcake,https://i.redd.it/fynji4xwwlf91.jpg,74,,2022-08-04 07:52:41
543,No words,159,wg14tg,religiousfruitcake,https://i.redd.it/8csxc70m6pf91.jpg,9,,2022-08-04 18:50:59
544,Facts? What are those?,877,wfr1n8,religiousfruitcake,https://i.redd.it/66sp4vwkdmf91.jpg,34,,2022-08-04 09:24:41
545,How do we “hate god” if he doesn’t exist?,4478,wfegtm,religiousfruitcake,https://i.redd.it/kkkjpbjxmjf91.jpg,218,,2022-08-04 00:11:46
546,Provider suddenly cites Catholic faith to no longer prescribe birth control,425,wfsyd8,religiousfruitcake,https://i.redd.it/w5jj0xrivmf91.jpg,21,,2022-08-04 11:05:15
547,Tweeting in all caps doesn’t change the fact the seedenomics is pure codswallop,39,wg6dx3,religiousfruitcake,https://i.redd.it/734cfh7u9qf91.jpg,4,,2022-08-04 22:30:50
548,No one told me. I would've deconverted sooner,426,wfqn0m,religiousfruitcake,https://i.redd.it/eblrzcpr9mf91.jpg,31,,2022-08-04 09:03:21
549,"Looks like they finally found a cure to the Gay! , The comment was a on a post meme about gay Muslims in heaven .... all the comments say the exact same shit",207,wfnf69,religiousfruitcake,https://i.redd.it/mnl08bn4hlf91.png,20,,2022-08-04 06:26:33
550,Holy shit,165,wfmq3b,religiousfruitcake,https://i.redd.it/ptrzf6ayblf91.jpg,22,,2022-08-04 05:54:30
551,"Misogynist, bigoted Christian Nationalist carries on",623,wfbdfw,religiousfruitcake,https://i.redd.it/ok9070hd1jf91.jpg,35,,2022-08-03 22:10:56
552,An opinion on how Kansans voted to keep abortion rights,73,wfqw35,religiousfruitcake,https://i.redd.it/x2qklno4cmf91.png,9,,2022-08-04 09:16:35
553,You can’t be a K-Pop stan and a Christian at the same time,3046,wextf8,religiousfruitcake,https://i.redd.it/yuy1xc8lnff91.jpg,153,,2022-08-03 10:48:20
554,"Posted by anti lgbt, pro gay genocide pastor, Steven Anderson",89,wfm6n3,religiousfruitcake,https://i.redd.it/l1lten9l7lf91.jpg,7,,2022-08-04 05:29:21
555,Doug Wilson thinks being single is an “affliction”.,66,wfljgc,religiousfruitcake,https://i.redd.it/l6el9laj2lf91.jpg,8,,2022-08-04 05:01:00
556,Another kind of evolution,132,wffkiq,religiousfruitcake,https://i.redd.it/whz33d1sujf91.jpg,17,,2022-08-04 00:55:45
557,Beyonce is an agent of Satan,192,wfas9d,religiousfruitcake,https://i.redd.it/6d6bwsmaxif91.jpg,12,,2022-08-03 21:48:05
558,Stuck In The '50's I See. Fathers exist.,88,wfcb0n,religiousfruitcake,https://i.redd.it/heflrjjt7jf91.jpg,13,,2022-08-03 22:47:08
559,Mike Murdock sprouts codswallop about tithing.,61,wfe8ki,religiousfruitcake,https://i.redd.it/kf6iuv4cljf91.jpg,19,,2022-08-04 00:02:49
560,Lakota Enforce Eviction of Hateful Missionaries,16036,wec2dg,religiousfruitcake,https://i.redd.it/bpqd5vww0bf91.jpg,464,,2022-08-02 19:14:06
561,Brainwashed Boy To Became An Fruitcake Preacher,611,wetely,religiousfruitcake,https://i.redd.it/rvz0hfyikef91.jpg,54,,2022-08-03 07:09:22
562,The CEO of LOOR TV claims that God suppresses scientific advancement & only allows devout Christian Scientists to make the big discoveries,131,wev8hi,religiousfruitcake,https://i.redd.it/wtvega030ff91.jpg,13,,2022-08-03 08:36:34
563,H0m0phobia Is 'Love',143,weqcbc,religiousfruitcake,https://i.redd.it/2rptbfdlvdf91.jpg,21,,2022-08-03 04:49:38
564,I put translation on the screenshot. don't know what to say more,120,wepoh8,religiousfruitcake,https://i.redd.it/gmh3ha8fqdf91.jpg,8,,2022-08-03 04:20:39
565,welp,103,wepff9,religiousfruitcake,https://i.redd.it/5acxoeaxndf91.jpg,17,,2022-08-03 04:10:03
566,Sometimes I really hope Hell they pretend to believe in exists,169,wek54q,religiousfruitcake,https://i.redd.it/7yt2hhhxlcf91.png,24,,2022-08-03 00:36:53
567,Saw this one on Facebook.,98,wenybs,religiousfruitcake,https://i.redd.it/hbgen2nnddf91.jpg,13,,2022-08-03 03:09:06
568,Not a real church,3020,wdzrr9,religiousfruitcake,https://i.redd.it/vknltrjjo7f91.jpg,121,,2022-08-02 07:59:25
569,know jesus today,47,wer6p4,religiousfruitcake,https://i.redd.it/ss48alqa2ef91.jpg,4,,2022-08-03 05:27:12
570,Christian Nationalist wants something forceful to be done with those who don’t follow his beliefs about sex.,60,weogh0,religiousfruitcake,https://i.redd.it/x0fkd5fchdf91.jpg,7,,2022-08-03 03:29:45
571,Christian social media personality make false equivelencies,248,webg7f,religiousfruitcake,https://i.redd.it/umniy511waf91.jpg,27,,2022-08-02 18:46:43
572,Pro flat earth tweet,77,wejqtq,religiousfruitcake,https://i.redd.it/3h4itlbkjcf91.jpg,21,,2022-08-03 00:20:25
573,Tweet from Dominion Dating( screenshot shared on twitter),85,wehvbl,religiousfruitcake,https://i.redd.it/gp367kg76cf91.jpg,20,,2022-08-02 23:05:33
574,"Why must these folks treat women like irrational, dumb, child-like beings?",62,wejnpg,religiousfruitcake,https://i.redd.it/b94hlu5xicf91.jpg,7,,2022-08-03 00:16:48
575,Tubal ligation?Satanic.,122,webc8a,religiousfruitcake,https://i.redd.it/0qv28hm4vaf91.jpg,20,,2022-08-02 18:41:41
576,Mohammad Waited Till She Was 9!,1119,wdx4yy,religiousfruitcake,https://i.redd.it/wcpfz2oh17f91.jpg,148,,2022-08-02 05:57:16
577,Why are the Russian cults burying themselves? (Details in comments ?,29,wegzmi,religiousfruitcake,https://i.redd.it/ty18wwi28ze71.jpg,3,,2022-08-02 22:30:28
578,Oh no!women's and queer rights are being stood up for!!! How awful!,107,we7ntp,religiousfruitcake,https://i.redd.it/vym6yk92x9f91.jpg,17,,2022-08-02 15:30:45
579,Being Supporter of BLM Leads 'Hell',203,we0fxu,religiousfruitcake,https://i.redd.it/cap00358u7f91.jpg,29,,2022-08-02 08:31:16
580,TIL gender equality is demonic,985,wdku3d,religiousfruitcake,https://i.redd.it/7oe42x72j4f91.jpg,105,,2022-08-01 21:23:21
581,Next year isn’t guaranteed,83,wdzpb5,religiousfruitcake,https://i.redd.it/9volekkxn7f91.jpg,16,,2022-08-02 07:56:00
582,The best answer.,143,wdltur,religiousfruitcake,https://i.redd.it/rg7jtnopp4f91.jpg,16,,2022-08-01 22:03:08
583,Jesus is a Toyota?,181,wdilub,religiousfruitcake,https://i.redd.it/ixrqj18y14f91.jpg,30,,2022-08-01 19:47:27
584,"""You're right! All religions are man made... Except for mine. Follow the LOGIC and you'll see.""",177,wdik3d,religiousfruitcake,https://i.redd.it/q9gnz8zk14f91.jpg,29,,2022-08-01 19:45:23
585,You can’t make this stuff up,3756,wcwoar,religiousfruitcake,https://i.redd.it/mq4uzgdyfye91.jpg,86,,2022-08-01 00:55:14
586,Big Brother is ALWAYS Watching,7181,wcso7q,religiousfruitcake,https://i.redd.it/mn8tnpibkxe91.jpg,431,,2022-07-31 21:57:55
587,On a thread about suicide,391,wdatdk,religiousfruitcake,https://i.redd.it/8zmxo3cgw1f91.jpg,62,,2022-08-01 12:33:06
588,It’s funny how that works…,1213,wcxr73,religiousfruitcake,https://i.redd.it/aryxucbdoye91.jpg,61,,2022-08-01 01:42:24
589,People once again poorly dealing with atheism,178,wd8p1i,religiousfruitcake,https://i.redd.it/nzollrs1a1f91.png,12,,2022-08-01 10:27:36
590,I didn’t know the New Testament takes place in the 90s,276,wd5njl,religiousfruitcake,https://i.redd.it/9nui7zqah0f91.jpg,21,,2022-08-01 07:46:20
591,"watch out hardcore gamers, you're going to hell!!",4078,wcmhuf,religiousfruitcake,https://i.redd.it/92wtaki82we91.jpg,416,,2022-07-31 16:54:49
592,You can't even say 'Women belong in the kitchen' anymore. 1984 has arrived.,961,wcvsct,religiousfruitcake,https://i.redd.it/rlb2af1u8ye91.png,96,,2022-08-01 00:16:11
593,Everyone I don't like is satan,757,wcplxz,religiousfruitcake,https://i.redd.it/05cb40mkvwe91.jpg,58,,2022-07-31 19:39:13
594,no amount of context makes this ok,612,wcoktq,religiousfruitcake,https://i.redd.it/tg12gw5smwe91.jpg,53,,2022-07-31 18:49:58
595,Hank Kunneman had a dream about raising 2.4 million USD ( tweet from Herman Mehta w/a video),248,wcuv33,religiousfruitcake,https://i.redd.it/ia0jepok1ye91.jpg,19,,2022-07-31 23:34:39
596,I know why the heathens rage,76,wczniz,religiousfruitcake,https://i.redd.it/7uss89e93ze91.jpg,27,,2022-08-01 03:05:53
597,Christian blogger has twitter disagreement w/ a female Christianclergy member. He wishes death upon her.,93,wcwx9n,religiousfruitcake,https://i.redd.it/7okdx64xhye91.jpg,7,,2022-08-01 01:06:15
598,Social media post from Gab CEO,79,wcsrqk,religiousfruitcake,https://i.redd.it/np44p393lxe91.jpg,16,,2022-07-31 22:02:15
599,You guys getting paid,4473,wc41tz,religiousfruitcake,https://i.redd.it/7z4g44yv0re91.jpg,330,,2022-07-30 23:59:58
600,“the voice of satan”( misogynist tweet from a blogger),986,wcbu2h,religiousfruitcake,https://i.redd.it/1ui6kw3quse91.jpg,56,,2022-07-31 06:07:20
601,Ah yes. I am slave to borgar.,7737,wbyz1m,religiousfruitcake,https://i.redd.it/1stt1korvpe91.jpg,360,,2022-07-30 20:07:51
602,"He hit the iamverysmart, confidentiallyincorrect, and religiousfruitcake trifecta",1015,wc31it,religiousfruitcake,https://i.redd.it/tjxbf8xtsqe91.jpg,50,,2022-07-30 23:13:10
603,"Pack it in, we have been worn the whole time.",133,wcelvn,religiousfruitcake,https://i.redd.it/oyu9fxl1lte91.jpg,8,,2022-07-31 08:34:53
604,Climate change denier.,73,wcfpmq,religiousfruitcake,https://i.redd.it/elvek0vrvte91.jpg,5,,2022-07-31 09:35:03
605,"Forcing Christianity on everyone, but somehow the left is evil...",92,wc8g81,religiousfruitcake,https://i.redd.it/ptaurfho1se91.jpg,7,,2022-07-31 03:24:33
