,Comments
0,"[Today we have been met with the unfortunate and sad news of the passing of Queen Elizabeth II](https://www.bbc.co.uk/news/uk-61585886). Whilst her contribution to the world was enormous, she also had an enormous impact on meme culture as she was a well loved meme icon who was used in many popular meme templates.

A reminder that r/memes will allow memes that honour the death of the Queen, provided that posts are respectful, not ill-natured and do not break any other of the sub's rules. These include no reaction memes, no meta-reddit references, and no reposts."
1,Wikipedia editors are so fkn fast
2,Does anybody remember this post some years ago when some redditor predicted that the queen is going to die on a certain day? And then her horse died and the dude was visited by the secret service.
3,Reddit is about to be lit.
4,"96 Billion years is still an impressiv age, rest in peace"
5,Rip the queen (r/agedlikemilk is going to be full of the queen is immortal memes)
6,The fact that her first prime minister was Winston Churchill makes me feel so goddamn young
7,"You only really die when you're forgotten, Queen Elizabeth II will never die."
8,"Betty White won

but at what cost?"
9,My personal opinion? Down with all monarchy
10,Truly the end of an era.
11,[removed]
12,"> A reminder that r/memes will allow memes that honour the death of the Queen, provided that posts are respectful, not ill-natured and do not break any other of the sub's rules.

But talking shit about anyone else is fair game? Way to be logically consistent."
13,"At least she had the decency to do it during the school year, maybe some kids will get a day off."
14,Where can I go for disrespectful memes then??
15,So what sub has all the funny dead queen memes? Idk you're all getting soft.
16,"That's a really shit rule. 

Either allow disrespecting every dead person or don't allow disrespecting any dead person. Don't give her special treatment just because she was royalty.

At the very least, put it to a poll."
17,Rip queen
18,I'm always amazed how people worship her
19,Beautiful presence? I know a few dozen struggling nations that might disagree with that statement
20,What kind of one sided censorship is that
21,"There is no Easter Bunny, there is no Tooth Fairy..."
22,F
23,Rip. The eternal Queen has passed - THE JUDGEMENT DAY IS UPON US
24,Everybody is really sucking the royal ass today huh
25,She didn't die. It's just her nap time. She be back in a few centuries.
26,Princess Diana: (drowning child meme)
27,[removed]
28,Rip Queen. My favourite Queen to say the least.
29,Memes questioning the royalty will be removed?
30,Rip to the lady we thought could Live until GTA 6
31,Are we allowed to allude to the pedo prince?
32,[removed]
33,Thank the UK tax payer fur supporting her so lavishly.
34,Time for apocalypse
35,She was also a monarch who sat on a golden throne while the homeless starved
36,You know we're in the worst timeline when even the ancient one leaves
37,Why disrespectful memes not allowed? She is very much a person who should be criticized by the entire British colonized worlds. Makes no sense just because she died
38,[removed]
39,"The Queen is Dead, Long live the King"
40,"Let her be remembered with censorship, thats the spirit lol."
41,How did she die? Was it from a illness or from natural causes/old age
42,[removed]
43,[removed]
44,Oh no... Anyway...
45,Imagine simping for a monarch who protected pedophiles and married her cousin…rest in piss bozo 🦀🦀🦀🦀🦀
46,Yeah lick that monarchist boot.
47,Why should we make memes honouring her?
48,What kind of propaganda is this
49,Why Aren't we allowed to disrespect her?
50,Simping for the queen lol
51,🦀🦀🦀🦀🦀🦀🦀🦀 imagine simping for the british monarchy 🤮 y’all love colonialism and imperialism I guess
52,"Now only Jimmy Carter survives.

RIP QE2"
53,Looks like she wasnt immortal guys....
54,"When will disrespectful memes be re-allowed?  After all the ceremonies are done, or will there be some sort of meme mourning period?"
55,Such a very sad day. May her memory be a blessing to her Majesty's family and everyone who admired and loved her.
56,The family stuffed her two disabled sisters into an asylum  and said they died.  Never lifted a finger to help them.
57,are you serious? the queen isn't gonna fuck you guys
58,What about all those enslaved people she ruled over?
59,"Aww, are disrespectful memes gonna hurt the poor wittle feewings of the *fucking english royal family of garbage human beings, who have had a direct role in the decline of our entire fucking species?* boo the fucking hoo"
60,Womp womp.
61,![gif](giphy|2dK0W3oUksQk0Xz8OK|downsized)
62,Looks like this sub is modded by the royal simps
63,[removed]
64,"2022 has taken to many legends, the blade and the queen"
65,[removed]
66,Lol bootlicker
67,RIP BOZO
68,On the 3rd day she will respawn
69,"""I grew up seeing Queen""

My father also said those same words"
70,"Nah, she just hid away to her rejuvenation chamber until the next Elizabeth"
71,[removed]
72,Fuck the rich
73,Good God this subreddit is beyond boring
74,The only human who saw the meteor kill the dinosaurs has passed rip.
75,"Rip in piss, loser"
76,"r/memes be like ""I can tolerate racism but I draw the line at disrespecting monarchy"""
77,Beautiful presence my ass the royals are a bunch of disdainful racists.
78,Cringe posting?
79,"Warning: Spoilers for ""The Crown"" season 5 ahead."
80,Can we at least talk smack in the comments?
81,Imagine living for 96 years and not doing a single goddamn thing of value
82,"![gif](giphy|EOJ9WHhynM4Ygp9wGW|downsized)

Lemmy is waiting to greet the queen to the party in the sky"
83,May she rot in hell.
84,Where can we go for the disrespectful ones?
85,DING DONG THE WITCH IS DEAD
86,Fuck this shit. She was a powerful unelected MONARCH she is deserving of no respect whatsoever. She embodied an oppressive hereditary hierarchy. Nobody deserves disrespect more.
87,"fuck her, and fuck you"
88,"First technoblade, now The Queen. 2022, what have you done?"
89,"The song said it best, Who wants to live forever?"
90,The African Pallbearers will be at the funeral.
91,L queen
92,Say what you want about her.  But i have seen a photo where she looked mean or jealous or unregal.   Unlike some other family members.    But you shouldn't really be blaming her for their actions.   Show some respect.
93,"She was given unimaginable power, for absolutely no merit whatsoever, and she at absolute, *absolute* best; completely wasted and squandered it to live a life of impotent luxury. 

And at worst; she actively made the world a worse place, where in her place any decent, feeling human being would’ve made positive change. 

She was somewhere between a lazy layabout and a monster. Glad she’s dead, hope it hurt. Won’t be one one millionth of the hurt her country caused while she was head of state."
94,"Why would she complain? She was given her position, not earned. 

And she did nothing but rule over colonies and reap the benefits."
95,it’s crazy folk talkin in yo quotes like we won’t jus dump they tea in the sea again.
96,"Condolences to the Royal Family, for their lost. 

Prayers to you all on this time of difficulties! May the Lord guide and protect you guys."
97,"Thoughts and prayers for her family, (all of kids, grandchildren, and great grandchildren). 

King Charles is gonna have some big shoes to fill."
98,"I will always remember her fabulous lime green combo, how full of grace and strength.  

Everyone wishes she was their Gram."
99,"No she just go to other people land and steal theirs.  

hundreds of thousands of people in the Congo has died under her reign and many other places around Africa."
100,"This is sad, but was thankful for all she has done. She is loved and her life's work will live on. Condolences toward the family and all those whom this effects most.

 Always look for beauty within dark times. Thanks Queen Elizabeth II for you life's work & the love you given"
