,Comments
0,"Seriously she looks like Palpatine in that gif, she will return"
1,If you strike me down i shall become more powerful than you can imagine god
2,Is funny bit at the same time true
3,So she replaced her body with a sex doll ?
4,"It's  like she was thinking:


Tonight I'm gonna have myself a real good time

I feel alive

And the world I'll turn it inside out, yeah

I'm floating around in ecstasy

So, (don't stop me now)

(Don't stop me)

'Cause I'm having a good time, having a good time"
5,![gif](giphy|AzFPW4gpKw2C4)
