,Comments
0,"Technically you did, otherwise you wouldn’t have made that post."
1,Who asked
2,"You did care about it enough to make a post to let us know you don't care about it

Or you're a ghoul trying to milk it for Karma.

So a liar or horrible."
3,That photo really describes you well🤓🤓
4,r/downvotedtooblivion
5,Most people didnt care when roe v wade happened but there were still many posts about it
6,Tbh some ppl are just milking as much karma as they can at this point
7,I threw some teabags down the toilet
8,I'm British and I'm glad. Fuck those bunch of royal nonces.
9,"I'm not a brit, so I don't care either tbh. Idk what all the fuss is about."
10,How about the cat screaming meme he died today I think I'm pretty sad.
11,![gif](giphy|l0ExbnGIX9sMFS7PG)
12,"Hard to tell who's more autistic, me or you."
13,![gif](giphy|106eZ3NhR8hAqc)
14,"haha making fun of autism

So funny 💀"
