,Comments
0,"Dank[.](https://i.imgur.com/3bQtuMO.png)

---

[we have a minecraft server](https://discord.gg/fNyb7G5)"
1,"They are very reliable. You can rely on it, that they are late."
2,No more 9€ ticket. Get FOMOED
3,I heard your mom knows a lot about german trains.
4,Y'all clearly have never seen the absolute *pinnacle* of railways that is the Romanian railways. You'll grow a beard before getting to the destination.
5,„Informationen zu RE7 nach Berlin Hauptbahnhof über Berlin Ostkreuz Abfahrt 12:30 heute etwa 72 Minuten Später. Wir bitten um Entschuldigung” Wir lieben es.
6,"Bruh, y'all have no right to complain. Just a couple countries east, you'll find the MÁV and the CFR. Worst railway systems in the entirety of Europe BY FAR."
7,"I agree,

It was a lot better 90 years ago"
8,Dieser Pfosten ist nun Eingentum der BRD
9,Can't be a late train if it's always cancelled
10,Stimmt
11,That wasn't always the case from what I understand. At one time those trains ran on a precision schedule. 💀
12,Only the germans to think their train system is shit
13,"Facts.

Now let’s talk about Germany’s gas situation…"
14,Still better than anything in America
15,Senk ju for traveling wiß Deutsche Bahn
16,You haven't driven polish one's yet
17,9€ Ticket RIP
18,9000 bill month = Good economy?
19,We don't say *trains* in Germany. We call it *VERKACKTE DRECKSBAHN ICH KOMME SCHON WIEDER ZUSPÄT WILLST DU MICH VERARSCHEN HALBE STUNDE ICH KAUFE MIR EIN VERFICKTES AUTO WAS SCHAUST DU SO BLÖD BRAUCHST DU EINE AUF DIE FRESSE ODER WAS*. And I think it's beautiful.
20,"hey don't just talk about trains, all other public transport sucks equally"
21,Cancer > Deutsche Bahn
22,Basiert und fick-die-DB-pilliert
23,Bro all of Germany has train systems. Other countries only have train systems in their biggest cities if they even have one. Wir müssen dankbarer sein.
24,Yeah the German economy is probably gonna tank big time within the next few years. Got to love that Deutsche is giving out sub prime loans like it's candy on Halloween.
25,Db is relatively pleasent when you can't get internet connection 3km out of the city
26,I’m British. Should I move to Germany?
27,I've been to many countries in Europe. When I arrived in Stuttgart and reached the train station and saw the cardboard paper with the codes and shit... I thought I was back in the stone ages.
28,"it'S bad, but the us train system is even worse"
29,Why shiba inu?
30,Lol you wish the economy was like that :D
31,You have better train systems than most developed country so stop whining
32,for russia its the opposite lmao
33,Son dreck
34,sänk you for traweling wiz Deutsche Bahn
35,Wenn man sich auf andere verlässt ist man verlassen.
36,Their train systems tend to be more developed on the polish border to be fair.
37,What? A stand?
38,"the other day the train i was in, didn’t recognise it had a motor so i had to wait an hour for another one"
39,Anyone have this but as a blank template? Would love it if ya got it
40,Refined during the turbulent times of the 30's-50's
41,Last uns die deutsche Bahn stürzen!
42,"The train station I stopped at was so cool honestly, there were people just hanging out and having fun together. In my country its stricly for travel"
43,Economy not for much longer i fear. gas👍
44,Is germanys rail system bad? I lived there the last couple years and it generally worked for for me. There were a couple upsets but I did use the train a bunch
45,Now do one for the US. If it gets any worse we’re going to have a desperate need for Chinese and Irish.
46,German Bundeswehr: Sad doge
47,"The roads are very nice to use, compared to neighbouring countries"
48,*Laughs in Trenitalia*
49,"Same here in Czechia, the economy is not that strong tho : /"
50,Turn it in to ww2 ver Germany then it's the opposite
51,Still 100 times better than the US train system though lol
52,"somotherfuckinggoddamntrue, amenakoi"
53,OP clearly hasn't been to Boston.
54,Britain is both small dogs
55,Germany's military: *God has entered the room*
56,"You should try the UK trains.
Just as shit. But 10x more expensive"
57,Inch verstehe nur Bahnhof
58,Thank you for traveling with Deutsche Bahn
59,Same for America honestly
60,"German fact part 2: „umfahren“ is the opposite of „umfahren“. it depends on where you put the emphasis. *um*fahren means running over, um*fahr*en means driving around. also you can tell them apart in a sentence; while „I drive around smth“ means „ich umfahre etwas“, „I run over smth“ means „ich fahre etwas um“"
61,Yo image sauce pls
62,"They said theyll be Finished with their Part of the North South Axis Railway before we Finish the Gotthard Tunnel.

We are done with our Tunnel.
Not one piece of rail for that was completed in Germany."
63,Kein 9€ Ticket mehr :(
64,I’ll go in a couple weeks and everyone was telling me how awesome their trains were. Was that some kind of German humor that I didn’t get?
65,Is this how you summon the Germans?
66,"Just be glad you aren't here in Canada. Our government is like ""you people all have cars right?"""
67,"No economy anymore, after their energy costs 20x because they shut down all their nukes and made themselves dependent on Russian gas that they can't get."
68,Germanys economy is decreasing. So soon the train system and economy will be even.
69,That's so that when I'm on vacation I may enjoy driving through the autobahn.
70,"Yeah DB is pretty bad, but at least Germany isn't that desperately designed for everyone using their cars"
71,Fools we all know that both economy and train system are carried by German science being the world's finest
72,You have a train system? Laughs in American
73,Nani Stando?!
74,I like this format
75,You're mom seemed really pleased with the train system.
76,"One word:

Fax."
77,"You have amazing public transport system

Especially now with 9€ monthly ticket for everything"
78,"Ah yes, Stuttgart Bahnhof"
79,"Dieser Kommentarbereich ist nun Eigentum der Bundesrepublik Deutschland. 

Also: SPRECHT"
80,Good thing they’re piping in that Russian oil!
81,Beide werden bald sehr ähnlich sein.
82,"Germany's health system be like:
I'm JuSt ReGuLaR eUrO hEaLtHcArE sYsTeM"
83,You misspelled cheap Russian gas mmmm
84,Schweize Bahn 😎
85,Germany’s dependence on Russian gas
86,SPRICH
87,I can't think what happened to them. They just got progressively worse after World Wa.....oh right.
88,Swiss people smiling😔
89,In Romania it is better. Our trains don't work at all
90,">	dieser zug hat zeh... fünfzeh... vierzig minuten verspätung

In meine meinung es gibt überhaupt nichts schnell über den schnellbahn. 

(bin Kanadier mit große lieb für Deutschland, und werden nochmals besuchen)


…Entschuldigung für meine schlechte Deutsch"
91,"At least you get trains, *cries in Irish*"
92,"Last time when they were on time bad things happened, just saying...."
93,"Jokes on you I bought and used one.
And My experience with the German trains was great."
94,Because she never cums?
95,"We have a saying in Greece, ""from the front a virgin, and from the back trains come and go"""
96,"oh, is his mom jewish or something?"
97,"I know this is really REALLY old, but, “I like trains”"
98,"Last year I was waiting for hours on some backwater village in sub zero temperatures at night: ICE broke down, regionals just stopped for the day. By the time a train arrived I was frozen solid and going home with the early commuters of the next day.

On that station, I started researching about car ownership, cars and all."
99,Why are the train systems in Romania and Hungary so bad?
100,"Would you like to talk about ~~our Lord and Savior Jesus Christ~~ Albanian Railways?

Like seriously, you can't beat that. I've been to Durres a year ago and on the station I saw some pretty beat-up, ex-German suburban coaches. ""Probably scrap or part donors"", I thought. A day or a week later 2 of them dissapeared. ""Maybe they finally cut them up"". What a surprise, both of the missing cars came back with the first morning train.

Not to mention that the cars were often missing glass in the windows and locomotives sometimes didn't have headlights. And signals on the station were most definitely non-operational, hard for them to be when they were missing basically everything that could be sold for scrap."
