,Comments
0,"downvote this comment if the meme sucks. upvote it and I'll go away.

---

[Join us on discord for Saturday Movie Nights!](https://discord.gg/jsd6Ja9pvJ)"
1,the joke didn't land well.
2,That smile is priceless :')
3,"""No, but seriously, I have AIDS. You should get checked, honey. You too, son."""
4,"Gotta love these wholesome memes I've been seeing recently, keep it up guys"
5,Must've flew over your head.
6,Flipped the script
7,Wooshed over your head
8,Joke was so bad I might have to jet outta here
