,Comments
0,"downvote this comment if the meme sucks. upvote it and I'll go away.

---

[Join us on discord for Saturday Movie Nights!](https://discord.gg/jsd6Ja9pvJ)"
1,Someone please explain to me what soaking means
2,They can also have someone else jump on the bed to help mimic the thrusting while penetration is occurring.
3,Not a real thing
4,"Penetrating, but not thrusting"
5,Wanted to show the bed you get to work
6,Oh. Weird. Thank you.
7,What?
8,"it’s so fucking dumb dude, like the mental gymnastics they do is nearing that of olympic athletes"
