,Comments
0,"downvote this comment if the meme sucks. upvote it and I'll go away.

---

[Join us on discord for Saturday Movie Nights!](https://discord.gg/jsd6Ja9pvJ)"
1,Why earn the karma if you can’t enjoy spending it ?
2,"""Owning the libs"" is about you feeling like you're the owner. Because the libs probably won't actually give a shit."
3,"Ok, wtf is karma, like what does it do, what benefit do you get from having a lot of it?"
4,sir as a result of my little bit of trolling I have sent 15 libs to mental asylums and another 23 libs now require constant assistance to merely fulfill life's most basic tasks. they will probably never fully recover
5,time to pay for your sins
6,"I don't think thats something to be proud off. If they unalive themselves that will be on your conscious. You won't agree with me now, but when you're older you'll wish you spent more time sharing love.

Troll, but troll responsibly."
