,Comments
0,"downvote this comment if the meme sucks. upvote it and I'll go away.

---

[Join us on discord for Saturday Movie Nights!](https://discord.gg/jsd6Ja9pvJ)"
1,honestly the only british food i truly love is fish n chips
2,No one said you couldn't put spices on beans on toast.
3,"British empire motto -""let's spice up things"""
4,B E A N S
5,"Bruh, a full English breakfast is great and you know it."
6,It still has spices in it.
7,What if I told you that fish n chips were introduced to the UK by Spain and Portugal immigrants?
8,big deal everything in the uk is taken from somewhere else. even the language technically
