,Comments
0,"Gotta do this just to have the courage to press the answer call button, double this for making the call"
1,This is more social anxiety than being an introvert.
2,Same for receiving the call
3,I have to psych myself up and I pace around when I’m on a call
4,🗿
5,When u rehearse what u gonna says multiple time
6,My solution don’t call anyone only text and proofread your text 100 times to make sure you didn’t screw up.
7,Triple it for remembering the speech.
8,"Quadriple that for not just saying ""uhhhhhhh"" then hanging up"
