,Comments
0,Literally nobody is saying that. This meme sucks.
1,That being said. I’m not sad at all.
2,"Liz you was from Alabama and fucking her cousin, the Prince Phillip of Greece. She married and had kids with him."
3,I’m something of a German myself.
4,Damn guys we can’t feel bad for other people now since OP dropped this meme. Time to take back our sympathy and prayers to those suffering.
5,Irish aren't even British...lol
6,Not all Americans obviously but there’s the ones who say that they are Irish when they have a great great grandparent who was Irish…no you’re American.
7,That's the joke
8,Ahh.. gatekeeping heritage such a Reddit thing to do
