,Comments
0,"Thank you for posting. Please review the rules. Here are a couple of gentle reminders:

1. Posts should be about people taking religion to absurd, crazy, stupid, and terrible extremes.

2.  Please don't submit   incendiary  posts or comments that could incite harassment and brigading.

 

*I am a bot, and this action was performed automatically. Please [contact the moderators of this subreddit](/message/compose/?to=/r/religiousfruitcake) if you have any questions or concerns.*"
1,"""Comment deleted for derailing...""

 \- Amazon Mod"
2,"Just glancing through some Amazon reviews. You have to give them credit though, the most disingenuous fruitcakes always seem to be the ones who think quantity over quality matters, and they certainly make sure to blast their beliefs. 

So close, I almost converted after reading this /s"
3,Religion invades your brain and thoughts
