,Comments
0,"Thank you for posting. Please review the rules. Here are a couple of gentle reminders:

1. Posts should be about people taking religion to absurd, crazy, stupid, and terrible extremes.

2.  Please don't submit   incendiary  posts or comments that could incite harassment and brigading.

 

*I am a bot, and this action was performed automatically. Please [contact the moderators of this subreddit](/message/compose/?to=/r/religiousfruitcake) if you have any questions or concerns.*"
1,There’s a lot of ‘looks like’ and ‘seems’. Looks like a lot of straw clutching to me.
2,"The earth looks flat, but it isn't.

The sun looks like it moves across the sky during the day, but it doesn't.

Time seems universal, but it isn't.

Plagues seem to be caused by an angry God, but they aren't.

Lots of phenomena seemed like it was ""God did it"", but it wasn't."
3,"""life looks designed""   this person has never seen a giraffe.  Those fuckers look random has hell"
4,"""christianity started science""  So F\* you Aristotle and other ancient Greeks (and Ancient Scientists from China, India, Egypt etc) - you're all irrelevant."
5,"""Everything that begins to exist has a cause, except fot the universe"" isn't rational.

But ""everything that begins to exist has a cause, except for God"" is rational?"
6,"""christianity started science""? 

Yeah coz the one thing christianity loves is - SCIENCE."
7,">Life looks designed, but it's not.

Yep. Appearances can be deceptive and humans look for patterns and narratives in everything.

>DNA looks like it contains information, but it's not information.

Nope, it does. Atheism doesn't say this at all.

>Objective morality looks like it exists, but it doesn't.

Again, not something atheism claims. It's not *divine* morality, but atheists can still debate about morality beyond that.

>The earth looks finely tuned for life, but it isn't.

See #1. Also, why are the other planets in our solar system all ""finely tuned"" not to support life?

>Everything that begins to exist has a cause, except for the universe.

Or except for god, right?

>It seems we have ultimate purpose, but we don't.

You can have purpose wherever you find it. There's no clear ""ultimate purpose"".

>It seems like we have free will, but we really don't.

Again, this isn't part of atheism. But religions that claim god is omniscient on the other hand, have a real problem with this.

>Christianity started science, but Christianity is dumb.

Various pre-Christian civilisations would like a word, thanks. Followed swiftly by scientists past and present being actively suppressed, opposed or outright attacked by theists.

As for Christianity being dumb, well, when you make trash assertions like those above..."
8,"I have a weird tummy feeling, therefore atheism is stupid and wrong.

Also, not enough faith to be an atheist? Does that mean that I have too much faith to be a Christian? So, having your worldview revolve around faith is a *bad* thing? It's almost like deep down they realize how stupid everything they say sounds but keep projecting anyway."
9,Science was not started by Christians.....🤣
10,"“Christianity started science” Christianity quite literally tried to kill anyone who didn’t believe the methods of Galen and Hypocrites.
Why is he bleeding? Don’t know but let’s take more blood out, just to be safe"
11,"\- Life does not look designed when you actually look at it.

\- DNA does not contain information, information is the product of a mind only. Technically a disc doesn't even contain any information, it contains elements aligned in a way which we can use to store information then read as information. Information is not a natural phenomenon.

\- Objective morality certainly does not appear to exist anywhere.

\- The Earth was ""finely tuned"" by life. Our entire atmosphere is caused by the life on here, it would not exist had no life been able to be established in the oceans. The Earth is also not that rare, thanks in part to the massive number of stars and planets out there, there are a lot of Earthlike planets.

\- There is no evidence of any ""ultimate purpose"".

\- The appearance of free will has been explained by people much smarter than I am.

\- No, it just labeled the method developed over centuries as ""science""."
12,"Christianity started science? LMFAO!!!!

https://www.thoughtco.com/ancient-greek-scientists-inventions-and-discoveries-120966"
13,Every counter argument I’ve ever heard to atheism has been argued on bad faith.
14,"""Everything that begins to exist has a cause, except for the universe.""

Ok but from Christian logic, Everything that exists has a cause except for God."
15,This is the way stupid people make arguments.
16,None of this has anything to do with atheism. But I understand why christiand have to indulge in such gross strawmanning and dishonesty. They are bound to be christlike like this.
17,"1. life doesn't ""look designed"", and if it is, then whoever designed it did a pretty terrible job and is probably also a horrible person.

2. no serious person has ever said that dna doesn't contain information.

3. objective morality doesn't exist because god said so, it exists because i said so.

4. bold to suggest that ""the earth is finely tuned for life"" in the middle of summer

5. the universe might have a cause. i'm honest with myself when i say i don't know what it is, while you attribute it to a genocidal maniac from the worst book ever written.

6. we make our own purpose.

7. we do have free will.

8. science has been around much longer than christianity.

it's not that you don't have enough faith to be an atheist, it's that you don't have enough insight to question the narratives you've been given by an authority figure."
18,The word “seems” is doing a lot of work.
19,"""God did it"" - The battlecry of the uninquisitive drone who is told what to believe by a magic book that was written, in some parts, thousands of years after the alleged events happened, and has been interpreted so many times through so many versions, rehashes and languages that it has lost all meaning entirely. But of course, it's the *only* reliable source of information in the world.

The extraordinary amount of mental gymnastics you need to engage in to believe this nonsense is both hilarious and fascinating."
20,"“Life looks designed but it isn’t”

Bro, I was 15 when my scoliosis started to affect my day to day life, and 14 when my undiagnosed anxiety made me want to hurl myself off a bridge. Now, you are telling me that a perfect being created all of us in his image. How is a perfect being capable of creating something that is imperfect and barely suited to the environment that it exists in. I know, small example, but a good representation of a “perfect being” creating something “imperfect” is a logical fallacy, if something is perfect, by its vey nature it cannot create something imperfect."
21,"Literally not one thing on there is true, at all. And some go directly against the reality, like saying Christianity started science. That is the exact reverse of the truth. We would have had modern science 100's of years earlier if it wasn't for Christianity holding it back. And we'd also be at least 500 to as much as 1000 years more advanced if not for them holding us back as well. But just like you have to lie to flerf, you have to lie to be a religious literalist."
22,"Christianity started science?

I had no idea all those old Greek dudes were Christians. And before the birth of Christ, no less."
23,"> the earth looks fine tuned for life

This is rather as if you imagine a puddle waking up one morning and thinking, 'This is an interesting world I find myself in — an interesting hole I find myself in — fits me rather neatly, doesn't it? In fact it fits me staggeringly well, must have been made to have me in it!' This is such a powerful idea that as the sun rises in the sky and the air heats up and as, gradually, the puddle gets smaller and smaller, frantically hanging on to the notion that everything's going to be alright, because this world was meant to have him in it, was built to have him in it; so the moment he disappears catches him rather by surprise. I think this may be something we need to be on the watch out for. ~Douglas Adams"
24,Earth looks flat but it's not.
25,"None of that is sensical in any fashion.  I have no idea what is being asserted in any of those vague sentences.

""Tried to compose logical statements, but failed miserably."""
26,"""Christianity started science"" \*Ancient Greeks enter the chat\* ""a word"""
27,"![gif](giphy|GmVa6YLmEIef6)

A Christian explaining Intelligent design..."
28,I’ve never seen faith move mountains but I’ve seen what faith can do to two towers
29,"Disclaimer: The following response to this list contains quite a lot of my opinion and personal ideas. I don’t mean to come off as preachy as that’s something I really don’t like but if I do then I’m sorry in advance. You don’t have to read this if you don’t want to, I just wanted to rant for a bit.

1- Life actually is designed on a conceptual level. Not by some ancient sky daddy but by itself. Natural selection is the driving force of evolution which results in life changing to suit certain conditions.

2- DNA literally holds a ton of chemical information for every cell in every organism. Also it’s the basis of sexual and asexual reproduction so it’s also basically an assembly guide.

3- Morality is pretty clearly subjective. However, some things make a lot of sense. For example, not killing people seems like an objectively bad thing and it usually is but there are situations where it isn’t seen that way. For example, is the military morally bankrupt for killing other people. The answer (at least to me) is no as long as it is only used as a defensive tool rather than to steal oil for 3rd world countries.

4- Earth is literally the only planet where life can exist (that we know of and for now). That sounds very much like being fine tuned for life. Also, if humans were to survive on other planets they would need heavy support from technology until they adapt (which takes way too long to be viable in such drastically different conditions) or terraforming which is literally making a planet more like Earth.

5- The universe does have a cause. At least theoretically. It’s called the big bang. However we don’t know much about it but we are trying to figure that all out. What we do know though, is what came after. Gravity forces space gas together to form stars. These stars form stuff that isn’t hydrogen via nuclear fusion and then burn out. These new substances are then forced together by gravity to form bigger stars to make more new stuff by the same method. These ones then go supernova and send that newer stuff out. Then that part repeats again and makes everything else. Eventually, after a really long time, gravity pushes some of the gases around stars together and forms what we know as planets which become what we know them as after even more time. Except Earth. That’s even later and verges into natural history but basically some space rocks that had water in them hit Earth and made steam which cooled the planet and also started the water cycle. Then we had liquid water. The next important thing that happened was bacteria (which were a result of abiogenesis) came into existence and started using photosynthesis after the formation of the ozone layer. That realised a bunch of oxygen and the sky is now blue. Then the part of natural history that most people actually care about happened which is the rest of it.

6- In a way, humans do have an ultimate purpose. Specifically, the continuation of the species to be even better adapted for our current conditions. This can eventually lead to the formation of a new species and humans as we know them will become extinct. In summary, it is likely that humans (and by that I mean Homo sapiens) are just a stepping stone in the future of evolution. It may not exactly be hopeful but something better will come along and maybe fix the slowly dying planet.

7- We do have free will. Choices are a thing that people can make and most do matter. Some don’t but that’s because they are in a smaller scale. However, certain Christians (likely the kind that originally created this list) believe that if you don’t think the same way then you’re definitely going to suffer in an afterlife that may not even exist. That is not a way of thinking that is conducive to the idea of free will. But guess what, that’s their choice to think that way (unless they were born into or coerced into certain culty shit which makes this way more complicated). By the same token, it is the choice of atheists to think the way they do.

8- Christians weren’t the first to fuck about, find out and record their findings. That would be beings from species predating our own.

Conclusion- Atheism is pretty rational actually. I’m an atheist myself for a number of personal reasons and just because I can think about the world in a way different to others doesn’t make me any more or less of an atheist. That’s the cool part about atheism. Not many other atheists will bash you for sharing your own opinions and beliefs whereas religions are not only at each other’s throats but groups within religions share that behaviour to an extent. One notable example is between catholics (yes I know they have their own sects too but I’m far less versed in them) and the CoE Christians. Quite a lot of the time they’re perfectly civil but I have seen members of the two groups in literal fights over certain Bible passages. In contrast, atheism is far more diverse in beliefs as almost everyone has their own and that’s not only OK but encouraged. If you read all of this, I hope you get something out of it."
30,"I love the ""earth seems creared for human life"" argument

Over 70% of the world is ocean. 57% of that land left is either desert or too mountainous to be inhabitable.

But yeah, perfectly designed to support human life.

(http://www.zo.utexas.edu/courses/Thoc/land.html source for the 57% number here)

EDIT: Formatting"
31,"1 is an opinion.

2, 3, and 4 are not things I've ever heard an atheist say.

5-7 are opinions.

8 is easily verified as false.

Sorry, I'm not enough of a low-information idiot to be a Christian."
32,Christians do love their strawmen.
33,"I guess the Islamic Golden Age never happened. And that Catholicism never persecuted scientists, AT ALL!!"
34,"""Christianity started science""

Yeah... Christianity loves science so much that it slowed it down for 1500 years.

You choose your purpose in life, it's not an imaginary man in the sky that has to tell you that YOUR purpose is to WORSHIP him. That's stupid.

Also, why would Christianity be there? Why not Islam? Why not Buddhism? Why not Hinduism or any other religion?"
35,Every argument a straw man.
36,"Old arguments, refuted time and time again but, as the “rational” side, we’re going to ignore this and continue to repeat the same bad faith talking points in the hopes of indoctrinating more people into our cult."
37,"- Life doesn’t “look designed”. In fact, observation of species’ physiology and behavior in relation to one another tends to prove that they are related.

- DNA is indeed information. Atheists do not say it doesn’t

- Morality is a sort of instinctual thing for humans that was favored as a result of our social lifestyle.

- The universe could have had a cause but we don’t know it. The “big bang” also isn’t the beginning of the universe, by the way.

- You only think you have ultimate purpose because you’ve been conditioned to believe that your entire life by religion

- we *do* have free will… Who said we didn’t?

- No religion started science, and certainly not Christianity. Hell, Arab Muslims and the Chinese were doing more science before any Christian. Even then, none of them invented science."
38,They desperately want it to be a person who created everything.
39,"Life looks random and disorderly, but it's not.

DNA looks like random bits of molecular building blocks, but it's not.

The earth seems like it was made from various chemical, biological and explosive reactions, but it's not.

Everything that exists looks like it does so through a process of micro and a macro evolution and ecological variables, but it doesn't.

It seems like we have free will, but we don't. 

It's impossible to determine who ""started science"" but whoever they were had almost definitely never heard of God or Jesus, but Christians want to steal that label without any research.

**Sorry, I don't have enough faith to be a Christian.**"
40,"* It doesn't really ""look designed"" intrinsically, we just have thousands of years of cultural assumptions that cause most people to interpret complex objects as designed. Closer examination reveals all manner of things that are consistent with unguided evolution, & you don't even have to look that close to see glaring ""design flaws."" Why is my airhole & my foodhole the same hole?
* It is information, it's just not information in the sense that is being implied here. In information theory, ""information"" is just a nonrandom pattern. A crater contains ""information"" about the asteroid that landed in it. It's not like computer coding or writing a book. DNA is a variable molecule that does things according to the pattern in which it is arranged. Patterns that kill the organism don't stick around, ones that promote survival do. No magic involved.
* If objective morality exists at all, it's certainly not in the way that religious apologists imply. Again, we have strong emotional & cultural opinions about morals, but other cultures can have very different views of morality. So, it's not the case that ""God wrote it on our hearts."" In fact, the Biblical God doesn't even follow its own moral standards, let alone what modern Christians think is moral.
* I'm going to stop saying ""cultural assumptions."" Planets have a lot of variables, but there are probably billions of them in the universe. Earth happens to have those variables in the right sequence that allows for life. We don't even yet know how widespread of conditions that life can tolerate, we just know that Earth is the only location we've yet confirmed that life exists on.
* There are several things that ""begin to exist"" but don't appear to have a cause. Radioactive decay comes from preexisting material, but it doesn't seem to be caused by any particular event. Particle-antiparticle pairs emerge spontaneously from the vacuum. Space itself expands, creating more space. The basic logic that there must have been an ""uncaused cause"" is sound, but the idea that it's in any way recognizable as a god is not. The idea that god is the only exception to ""things that begin to exist"" is like 85 unwarranted assumptions.
* I don't even think cultural standards apply here, I don't see how it seems like we have an ultimate purpose at all.
* Atheism doesn't require that one doesn't believe in free will, but it's an age-old philosophical problem, how could our decisions ever be free from any prior cause?
* ""Christianity"" didn't ""start science,"" & even if it did, there's a reason Christian apologists cling so tightly to the likes of Newton. Christian ideas haven't been relevant to science for a long time. This list already has a bunch of science denialism in it.
* Nothing here needs to be taken on faith, it just requires not blindly accepting whatever nonsense you've been told. Like let's circle back to that god thing. Nobody's ever found an example of a mind or person that doesn't require some physical object to construct their thoughts. So, he idea that this thing not only exists, but it ALWAYS existed, & it in fact CREATED THE UNIVERSE is a MASSIVE leap of faith. It remains wild to me that apologists' biggest insult is ""you're like me."" If faith is such a bad thing, just don't be religious. It's that simple."
41,"you don't have to ""believe in atheism"". it's not religion."
42,"Let's fight strawmans, because why not:

1. C'mon, if I had designed stuff at work like life is ""designed"" I'd fired long time ago.

2. It's information tho. Are you even biology, bro?

3. All morality is subjective.

4. Life is perfectly tuned to survive on earth. At least part of it, the rest which failed to tune itself simply ceased to exist

5. Maybe Universe also have a cause, we can't figure it out with our current instruments.

6. Nope, it's not even seems.

7. We have, but very limited, almost nonexistent.

8. Ancient Greece, anyone. Also, Christianity is not dumb, some Christians are.

Signed, a Christian"
43,"Life looks like it all shares a common ancestor, but it doesn’t. 

Objective morality doesn’t appear to exist, but it does because god decided it did. 

The universe is hostile to all life in almost all known locations, but it’s finely tuned for life. 

Everything that begins to exist has a cause, except for god. 

It seems like life is an uncoordinated shitshow of tragedy and childhood cancer, but it’s actually all pre-determined by a loving god. 

I like this game let’s keep going"
44,Do any atheists believe we have no free will because there's no god? Like I know there's some weirdos out there who think we don't have any for some reason but that's not BECAUSE of atheism
45,All things aside where did they get the idea that christianity started science?
46,"This is like when as a kid someone would call you a name and you’d go “nuh uh, no I’m not. You are”"
47,Christianity started science my ass
48,Christianity started science my ass
49,"I always hate the ""Earth looks finely tuned for life"".

Bitch no, the earth was here **first**, humans *evolved* in the way that we did *because* of how the earth is."
50,"Morality can only come from a book that is chock full of genocide, incest, slavery, rape, and god commanding the mass murder of men, women, and children, to include instructions directly from god to dash infants on the rocks and to tear fetuses from the wombs of pregnant women. (Hosea 13:16).

It's a good thing pro-lifers don't read the Bible."
51,"Absolutely none of those things have anything to do with atheism. 

Also there is no such thing is as objective morality. All morality, by definition is subjective."
52,how are they gonna say everything that begins has a cause but say we don't have an ultimate purpose
53,"Christianity started science, but gunpowder was invented in China. Okay buddy"
