,Comments
54,"Life doesn't look designed. Every species except for really simple and old ones like cockroaches looks like it's in a transition, judging by its bone structure and organs, or even how it lives. Look at pandas: their digestive system is developed from a carnivorous one, but they developed in a way that allowed them to eat bamboo, because barely any other animals eat bamboo so they wouldn't have to compete with other herbivores. However, their digestive system is absolute shit at gaining any calories from bamboo, so they have to eat a fuckton of bamboo every day just to survive, and they're in a constant state of energy-saving. How does this look designed? Life couldn't get any more chaotic and random. Humans are partially even worse, with our bodies not being fast enough to adapt to how our societies develop, so we get sick and die from fucking cancer or diebetes. How does this look designed to people?

DNA does contain information, what're they talking about? Also, how does DNA ""look"" like it contains information? Do theists look at a picture of a helix and say ""man, that looks just like a book to me""?

Objective morality doesn't look like it exists. If it did, societies wouldn't fight over it, the objective morality would just be inside people. Even if the objective morality would just be the morality that a god uses, that morality would still be subjective. People can have ethical opinions that differ from a god, and neither of these ethical stances would be wrong, just potentially philosophically illogical. If that god is actually omnipotent and wanted humans to adhere to the god's morals, they should've worked that into their creation.

Earth doesn't look finely tuned. Eco systems collapse and change all the time. It looks like chance and randomness.

Nobody says the beginning of the universe doesn't have a cause. We just don't know it, because we can only deduce what has happened since the big bang from how the universe expands.

It seems like we have a purpose? I don't even see what they man honestly. Not even the Bible says anything about an ultimate purpose as far as I know. We exist because haven't wiped ourselves out yet. Many species have in fact been wiped out. Who fulfills their purpose now? Is the earth doomed because it can't fulfill its purpose anymore with dinosaurs, sabertooth tigers and mammoths extinct, among billions of other species?

It seems like we have free will, except that every individual is usually easy to predict once you start to understand the psychological levels of their mind. The more knowledge you have about them, the more precise the prediction. So everything we perceive and measure about humans actually points straight towards free will being an illusion we like to give ourselves so we feel superior to plants.

Christianity didn't start science. People have used scientific methods for millenia in every society. Christianity was just there and both supported and restricted scientific research, depending on how it served their goals. Christianity is responsible for funding brilliant minds, but it's also responsible for burning brilliant minds at the stake, along with their books. And yes, Christianity is generally dumb considering how it fought against scientific and social progress for the past three or so centuries, when science, philosophy etc slowly became secular because the churches lost some of their power over them."
55,LOL *NOT ENOUGH FAITH TO BE AN ATHEIST* I can’t..
56,I dont even know how i would start to unpack the “christianity started science” sentence if i were talking to OOP
57,"Yup, every single ""point"" is garbage."
58,"If you are part of the non superstitious minority, you know that everything has a perfectly natural explanation. The innately superstitious majority still believe that magic was somehow involved just as their primitive pagan ancestors have done for tens of thousands of generations."
59,TIL Christianity started science.
60,This looks like bullshit and is.
61,"I'm pretty sure most historic geniuses weren't even Christian, most of em were Islam, Roman, Indian or Greek actually. Some even gay, but name one revolutionary die-hard Christian that did something good. Can't, because die-hard Christians cling to the past, and evade progression"
62,Wow that’s a lot of stupid in one post. This person clearly has a fundamental misunderstanding of what it means to be an atheist. If Christians would stop listening to their Christians about what atheism is and actually talk to an atheist they might understand it. I’m not gonna hold my breath though
63,[removed]
64,"“It seems we have free will but we don’t”

My brother in Christ your the one saying everything is preordained"
65,"Honestly, the Universe created itself seems more believable. But otherwise it would be deism. So organised religions still lose lol."
66,When I pretend everything looks like it is explained by my magical sky fairy atheists look irrational when they point out these are all arguments from ignorance with no supporting evidence…
67,My question is: What other than the universe began to exist?
68,"Talking snakes, zombies, unicorns, and ghost sex.

Because science."
69,">life looks designed but it's not.

Thank you for refuting yourself by saying god is a ""designer"" (as opposed to creator)"
70,"Weren't... Ancient Arabs who began ""science"" as a whole?"
71,Christianity started science lol.
72,Christianity didn't start science dipshits.
73,Every single one of those is false.
74,"That’s the thing about science, you don’t need faith. It exists even if you don’t believe in it."
75,I sure do love when Christians try to argue for free well 😂
76,but they have enough faith to believe one specific god out of thousands ?
77,"Hard to argue when they use empirically scientific words like, ""seems"", and ""looks""."
78,"what does “DNA looks like it contains information, but it’s not information” mean?"
79,"Free-will has nothing to do with being an atheist. It's possible to believe that there is no free-will because a god is controlling everything and whatever happens to a person is a part of their destiny given by a god.


Also, the scientific method was invented by Arabs, not christians, however, scientific knowledge existed simce ancient times through the Babylonians and Greeks and so on."
80,"If no one has free will, doesn't that means god is making people be atheists? & god is making adults rape children? & god makes people be murderers & bullies & animal abusers?"
81,"The difference between your rationality and my rationality is you're literally betting it all on one horse, meanwhile I don't even go to the race track"
82,"I mean, there's logical and valid arguments against every one of these that DONT involve deliberately missing the point."
83,Ah yes rationality where everything is exactly as it first appears
84,"the DNA line doesn't even make any sense, not that much of this does."
85,"-correct, life is most likely not designed by anything other than what made our species survive 

-idk where they got this from, DNA obviously contains information even atheists think that 

-morality is subjective, it's a social norm made by humans. The appearance of objectivity in morality is only because other people say so. However, that doesn't mean you shouldn't try to be a good person. I don't need a god to tell me that

-the earth is in a perfect set of circumstances for life yes, because in the almost infinite universe it's not surprising it happened at least once

-the universe has a cause to exist we just don't know it

-the only purpose we have in life is the purpose we give it. The same applies to church, we as people gave those things meaning

-free will is a whole other debate, regardless of if God is real or not

-saying Christianity ""started science"" is the most ignorant take I've ever heard in my life. Anyone with a basic understanding of history knows that isn't true."
86,"I should snort some of that ""faith"" through the nose."
87,"Life designed itself 


Objective morality is a thing. It was set in stone by the first civilizations and those laws have been passed down to other civilizations 


DNA does contain information 


The earth is finely tuned for life, who says it isn’t?


The universe does have a cause for existence, but we don’t know what it is quite yet 


Maybe we do have a purpose, maybe we don’t 


We do have free will


Christians added to science yes, but overall scientific discovery was suppressed by the church. Even notable Christian scientists like Galileo and Copernicus were ridiculed and suppressed by the Christian monarchy for their discoveries"
88,Saying Christianity started science is like saying Elon Musk invented cars lmao
89,"Oh fun, let’s go down the list.

>-Life looks designed but, it’s not

Looks designed to who? You and your humancentric perspective? There’s a million examples of it being a shitty design. And wow things can “look” a way and not actually be that way. Just because something looks a certain way doesn’t mean anything.

>-DNA looks like it contains information, but it’s not information

Who is out here saying DNA does not have information, and again who gives a fuck what it “looks like”? That is not a rational argument. You look like a dumbass when you make this argument, and you are.

>-Objective morality looks like it exists, but it doesn’t 

No it doesn’t remotely look like objective morality exists. Not if you have any capacity to think rationally, but go ahead and solve the is/ought gap if you think you can, I won’t hold my breath.

>-The earth looks finely tuned for life, but it isn’t 

The fine tuned argument has been debunked and shown to be **irrational** by countless people countless times. The horse has been beaten to dust at this point. A pothole looks finely tuned for the rainwater that fills it, but that doesn’t mean it was. This argument is again just big stroke of the ego.

>Everything that begins to exist has a cause, except the universe 

Except the universe? Is it rational for you to simply go one step back and say “god did it”? Who creates your god again? All you’re arguing here for is a causal infinite regress or that your god is irrationally the special first cause. 

>-It seems we have ultimate purpose, but we don’t 

No it doesn’t seem like we have ultimate purpose whatever the fuck that means, and once again just another “it look like” argument, which is not rational.

>-It seems like have free will, but we really don’t 

Some atheists believe we do and some don’t, and it doesn’t require a god belief either way. In fact if you believe any the main popular versions of god it’s literally impossible for **you** to have free will. Your god if true completely removes free will.

>-Christianity started science, but Christianity is dumb

No it didn’t, and yes it is dumb. This is not even a rational argument whatsoever. Even if we grant it, X can start Y, and X can still be dumb. There’s no contradiction there. “Starting” something is irrelevant, and Christianity is clearly *not* science, but it *is* dumb as shit.

>-Sorry I don’t have enough faith to be an atheist 

Rationally thinking, you necessarily *must* have enough faith to be an atheist because it requires far less faith than your ancient mystical barbaric book of tales written by dumbfuck humans who didn’t understand anything about the world or morality."
90,That's a lot of strawmen and baseless assumptions
91,"Life is an endless game of equilibrium, there isn’t design that exists outside of that fact in the natural world. When life is designed, we get fruit trees that tear in half under the weight of their fruit and dogs that need to be cut open to reproduce.

Wh- who isn’t saying DNA contains information? I mean, you can argue it isn’t information so much as a template, but semantics.

If objective morality existed, it would be harder to stray from, no? It would also be counterintuitive to success in society. Unless child labor and literal (and figurative) slavery are inherently good in that objective morality, the successful could not benefit from it.

It’s back to my equilibrium point from earlier. Earth is chaotic, and life becomes equally chaotic to survive it. Earth throws a 100 foot wave at a mountain every few millennia? The trees grow higher in spite of the poorer soil. Parts of the Earth completely cover themselves in magma near constantly? Lichen learn how to live on it once it cools.

Humanity share the same purpose as every other living thing on Earth: to survive long enough to breed. We just found it easier to do that by becoming intelligent and forming societies.

I would argue that our coexistence with society removes far more of our free will than the impulse to seek equilibrium does.

Christians took credit for science done before by Mayans, Egyptians, Greeks, and the Chinese (because experimentation and curiosity, the roots of science, are inherent to all intelligent creatures, including humans), but Christianity didn’t grow with the science, it grew _against_ it, and that’s why it’s dumb."
92,"Life doesn't looks like it is designed. We create things by designing them and we are compelled to think as ""then everything should be designed."". If you want to see it like it is designed then you try to find proofs that it is designed, not scientific proofs to satisfy smartest among us or our ""rationality system"" or ""scientific method"" which we owe everything to, but just yourself. Therefore it is seeming like there is no disproof that life isn't designed.

DNA is like a recipe for a living being, how it works? Even i can't understand and people that understand it are dedicated their lives to it and like about 50-60 years old today so you can't blame me. But it is a recipe for a human being, therefore you exist, your cat exist, the beef you ate at todays dinner exists and so on.

Objective morality is a lie, everyone has their own take at morality. Someone grown up in a vastly different culture can have really different set of core values therefore core rules. But there are obvious bad things like peer pressuring underaged kids and threating them with a lake of fire and stuff. And beheading people and shooting people because of their beliefs or disbeliefs or raping people or murdering them.

Earth isn't finely tuned for life, exact opposite: Life on Earth is fine tuned to live on earth. Who knows maybe there is other organisms use liquid methane instead of water somewhere else. Or can survive a thousand degrees but not in here because here is water instead of liquid methane and -10 to 30 Degrees Celsius on average.

Universe has a cause, but we can't observe it because we are inside of it, like the bacteria in your guts can't see other parts of your body nor outside of your body.

We aren't supposed to have a ultimate purpose, but our ego makes us think like we really matter or we have to matter in some form, but sadly but truly we really don't. We are just ants crawling in a wet pile of rock that is orbiting around a small mediocre star. We only got our fellow human friends and our plans and legacy for our future grandkids.

We have free will, but it is affected by so many factors that ""How much this guy is free compared to this other guy"" question is really hard to answer. You are free to make a choice but in the end you are the only one responsible for that, so make your choices well my friend.

Christianity didn't started any kind of science. There was scientists which were widely astronomers trying to make calendars to predict seasonal changes and they have to invent a structured way of study. And i hate to say but Christianity until Martin Luther stood in way of scientific developments."
93,The only people who have ever hurt me were Christians or people groomed to hurt others by similar Christians.
94,"Science education and the development of strong, critical thinking skills are so very, very important. Proof is clear as day when these ""Only belief in a sky-daddy can give a person morals and values!"" snake-oil buying morons attempt logic."
95,"Basically everything here is just wrong.  None of the things they say it looks like are actually what it looks like.  If life looks designed, then fuck, the designer was having a bit of an off day.  Humans have vestigal organs and are actively hurt by their upright stance.  That's bad design."
96,"I cannot even begin to describe just how much I hate associating Christianity with science, and even some dumbass atheists do it. What?!

It didn't start science, nor did it ever truly support it. Two goddamn millennia of glorifying Aristotle and cherry picking what is *allowed* to study and by *which gender*, and then throwing scraps of funding at some of the picks is not support. It's maintaining political and ideological supremacy.

Forcing people to get exposed to your cult in order to receive censored education is not support. It's gatekeeping and indoctrination.

Continuously undermining scientific education wherever it touches your dogma and individual Christians calling their shitty intuition ""science"" to post nonsense like this post, deny climate change, evolution, the fucking shape of the fucking planet, or even basic human rights is. not. support. It's literally the opposite.

Scientific progress happened not thanks to, but *despite* religion, organized or not. No one gives a shit if a religious organization funded some research, when without it someone else would, and probably sooner. Especially when it suppressed the results it didn't like, oppressed people who reached them without its supervision, and eradicated entire cultures and their records."
97,"""Christianity started science.""  OK, that's a new one I haven't heard before! 

I always thought the Greeks started that....( long before Christanity existed.)"
98,"The last line is really important.
It takes more faith to be an atheist than a Christian. How do I know? Because I used to be a Christian and I prayed for God to strengthen and deepen my faith. I kept praying and praying, eventually he answered my prayers and showered his blessing upon me. I had so much faith… but it was too much. The weight of my new God-given faith collapsed the Christian foundation it was built upon. No Bronze Age manuscript would be able to contain my boundless faith. I was left with no choice but to become an atheist.


Be careful what you pray for."
99,"LMAO objective morality is pretty easy. Even without a god being a conscious being on this planet is a rare thing. So try not to make another's experience on the planet worse as you enrich your own?

Do they really need external factors to tell them this?"
100,"What is religion but an endless cycle of “people made stuff up, then agree with stuff they made up”"
