,Comments
0,"Thank you for posting. Please review the rules. Here are a couple of gentle reminders:

1. Posts should be about people taking religion to absurd, crazy, stupid, and terrible extremes.

2.  Please don't submit   incendiary  posts or comments that could incite harassment and brigading.

 

*I am a bot, and this action was performed automatically. Please [contact the moderators of this subreddit](/message/compose/?to=/r/religiousfruitcake) if you have any questions or concerns.*"
1,GuYs A mArVeL mOvIe Is TaKiNg aWaY oUr ChRiStAnItY!!!!!1111!!!!!!!
2,And it's a black captain America. We're fucked bros
3,It has to be so fucking exhausting living believing everything around you is a conspiracy targeting you
4,I am sure you can rearrange those letters in a way that says demon or gay or both
5,Yes the marvel US propaganda is definitely against you
6,"Yeah movie titles should never have anything that would be bad if it was real in them.

""Guys Hollywood is going to make a Sharknado, and a towering inferno, and also cause the Apocalypse Now!"""
7,"If that's real, it is a stupid name for a fucking marvel movie. It's a lame overused cliche, some '90's wrestling thing, and some ominous fascist sounding shit at  the same time. 'make caption America great again ', or something."
8,I hope it’s full of lesbian and queers making out
9,"“We are almost at the finish line! This is it guys, this is proof that we’ve reached the end times!” - Christians, for the past 2000 years"
10,"No need when they come out with 

Scarlett Which: Gay Demon Vaccine

And

Guardians of the Galaxy: Jewish space laser"
11,I also hope for this
12,Phew so it doesn't say abortion then!
