,Comments
0,"Thank you for posting. Please review the rules. Here are a couple of gentle reminders:

1. Posts should be about people taking religion to absurd, crazy, stupid, and terrible extremes.

2.  Please don't submit   incendiary  posts or comments that could incite harassment and brigading.

 

*I am a bot, and this action was performed automatically. Please [contact the moderators of this subreddit](/message/compose/?to=/r/religiousfruitcake) if you have any questions or concerns.*"
1,So basically thr Trumps?
2,"Dude, I've been Most High more than a couple of times."
3,It seems evangelicals are the guiltiest here.
4,"Predict the end of days with a bunch of bad qualities which are subjective and which some people always have, with no specific details on how many or how much, and you can always say it's the end times.

Really this is the oldest fortune teller trick, just generalize.

""I forsee that those in power will be dishonest!""

""Woah he might be for real""

""The rich will be greedy, always seeking more""

""He's a prophet!""

""There will be wars where people kill other people, and the wealthy and powerful will gain greatly from it, while misleading the people about the reasons they have commanded it!""

""Oh my God that is too spot on to possibly be a coincidence"""
5,well but days in the scope of the god who gave them this information seem to be very long. So at least the last few thousand years+x. Expect to be surprised by Reality TM
6,I would consider number 20 to be virtuous. I have also loved the pleasure of BEING most high.
7,"How did They stumble upon ""Prosperity Gospel Preaching 101""?"
8,"Almost all of those things can be applied to televangelists, megachurch preachers, and politicians who claim to be religious but are actually just greedy hypocrites."
9,"Yep, it’s a good time to be an atheist. Christians are fucked right now."
10,Timothy 3:1-7… lmao
11,Oh! Trump!
12,NOOOOO!!! PEOPLE WILL BE LIERS!!! WHY GOD WHYYYYY?!!?
13,Was just going to say it look like a recipe to create a Trump.
