,Comments
0,"Thank you for posting. Please review the rules. Here are a couple of gentle reminders:

1. Posts should be about people taking religion to absurd, crazy, stupid, and terrible extremes.

2.  Please don't submit   incendiary  posts or comments that could incite harassment and brigading.

 

*I am a bot, and this action was performed automatically. Please [contact the moderators of this subreddit](/message/compose/?to=/r/religiousfruitcake) if you have any questions or concerns.*"
1,"eh he keeps posting the same things, the analysis of the cults and the kaleb and sophia stuff is pretty interesting tho"
2,I’m a subscriber
3,Found this around the same time I found NonStampCollector way back when.  Good stuff.
4,Telltale is the best
5,He’s fantastic! I love him
6,I’m subscribed to him. I love his Caleb & Sophia videos.
7,One of my favorites
8,Remember finding him when I was sorta researching Jehovah's Witnesses around when I was fourteen and a half. Good stuff.
9,">	eh he keeps posting the same things

In fairness, so do creationists."
10,"True, but I can appreciate the focus he has.  He is good about staying on topic from my observation."
