,Comments
0,"Thank you for posting. Please review the rules. Here are a couple of gentle reminders:

1. Posts should be about people taking religion to absurd, crazy, stupid, and terrible extremes.

2.  Please don't submit   incendiary  posts or comments that could incite harassment and brigading.

 

*I am a bot, and this action was performed automatically. Please [contact the moderators of this subreddit](/message/compose/?to=/r/religiousfruitcake) if you have any questions or concerns.*"
1,"I've seen that many times. It only guarantees that if I ever needed to hire a big rig company for transport, they'd never, ever get my money."
2,Thanks for the post.  A reminder about leaving space for a semi's right turn is invaluable.
3,Owner operators make 90% gross on every load!? Sounds like a fairy tale to me.
4,"This has great meme potential, just replace ""Pray"" with Shit"" and it'll be an intimidating man that's asking you about your bowel movements."
5,"Looks like Robin, Batman's sidekick."
6,Bro why do you care so much💀💀💀
7,What company is it?
8,I think they're called Covenant. Something like that.
