,Comments
75,"The most common view of Leviticus 18:22 is that it condemns male homosexual relations; however, there are prominent scholars who argue against this view. Here's what the Hebrew of Leviticus 18:22 says:

And-with a male not you-will-lie ‘lyings-of’ a-woman.
Now, in Hebrew, the phrase ""lyings of"" can refer to somebody's bed. So the passage basically reads ""you shall not lie with a man on the bed of a woman."" Bruce Wells (University of Texas at Austin) interprets this as meaning that “Sex with married men, therefore, would be forbidden as well as sex with any males who are under the guardianship of a woman within the community.” Jan Joosten (formerly of Oxford University, removed following criminal conviction) concurs, arguing that the Biblical laws “prohibit homosexual intercourse involving a married man.”

A scholarly report from the Wijngaards Institute, the authors of which includes some of the most prominent OT scholars working today (such as Mark Smith), argues that “[the] traditional interpretation as condemning all male same-sex sexual activity is based on a mistranslation which is no longer tenable. Rather, the prohibition is limited to a specific type of male same-sex relationship.” The authors then note that “the fact that the prohibition addressed a specific type of male same-sex relationship suggests that same-sex intercourse with males outside the forbidden category was viewed as permissible.”

In addition, the report states that the homophobic interpretation “can only be reached by changing that original text considerably: it does so by adding the comparative particle ‘as’, and ‘with’, both words which are absent from the Hebrew, as well as by choosing to ignore the key expression ‘lyings-of.’”"
76,"If a later editor of Leviticus opposed homosexual intercourse, you might wonder, wouldn’t it have made more sense for him (and it was probably a him) to leave the original bans on homosexual incest intact?
No. The key to understanding this editorial decision is the concept of “the exception proves the rule.” According to this principle, the presence of an exception indicates the existence of a broader rule. For example, a sign declaring an office to be closed on Sundays suggests that the office is open on all other days of the week.
Now, apply this principle to Leviticus 18: A law declaring that homosexual incest is prohibited could reasonably be taken to indicate that non-incestuous homosexual intercourse is permitted.
Anyway following the argument advanced by Dershowitz 2017 (the academic paper you linked not his NYT opinion piece), the interpretation he's taken is this:

That the prohibitions against certain couplings in Lev 18 are mostly related to family members. His focus is on Lev 18:7-17.
They take the form ""the nakedness of X you shall not uncover"".
That the meaning of ""uncover nakedness"" is obscure, and no one definition is sufficient to explain its usage in Lev 18. He goes over the proposed solutions and finds none of them can account for every instance. This is an important point because it means it's a semantic term understood by the author and his readers, who's exact meaning has been lost. Consequently we don't understand completely what the author was intending to mean.
A redactor appears to have modified Lev 18:7 and 18:14, as highlighted below:
6 None of you shall approach anyone near of kin to uncover nakedness: I am the Lord.
7 You shall not uncover the nakedness of your father, which is the nakedness of your mother; she is your mother, you shall not uncover her nakedness.
8 You shall not uncover the nakedness of your father’s wife; it is the nakedness of your father.
9 You shall not uncover the nakedness of your sister, your father’s daughter or your mother’s daughter, whether born at home or born abroad.
10 You shall not uncover the nakedness of your son’s daughter or of your daughter’s daughter, for their nakedness is your own nakedness.
11 You shall not uncover the nakedness of your father’s wife’s daughter, begotten by your father, since she is your sister.
12 You shall not uncover the nakedness of your father’s sister; she is your father’s flesh.
13 You shall not uncover the nakedness of your mother’s sister, for she is your mother’s flesh.
14 You shall not uncover the nakedness of your father’s brother, that is, you shall not approach his wife; she is your aunt.
15 You shall not uncover the nakedness of your daughter-in-law: she is your son’s wife; you shall not uncover her nakedness.
16 You shall not uncover the nakedness of your brother’s wife; it is your brother’s nakedness.
17 You shall not uncover the nakedness of a woman and her daughter, and you shall not take her son’s daughter or her daughter’s daughter to uncover her nakedness; they are your flesh; it is depravity.
18 And you shall not take a woman as a rival to her sister, uncovering her nakedness while her sister is still alive.
In order to insert the blanket prohibition against male same-sex coupling in Lev 18:22:

22 You shall not lie with a male as with a woman; it is an abomination.
The fact that this is patchwork is obvious to anyone, when I've read this part of Leviticus before it's obvious that 18:7-17 comes from one source and 18:19-23 comes from another source. If it was all the one source 18:22 would read something along the lines of:

""You shall not uncover the nakedness of a man, for he is your X."" Where X could say something as simple as ""fellow Israelite"".

Or

""You shall not uncover the nakedness of a man, for his nakedness is your own nakedness""

So you actually don't need to read this paper and go to this depth to understand that Lev 18:7-17 is a separate set of instructions to 18:19-23 that clearly comes from a different source. It's plainly obvious as it is. However in light of 18:7, and 18:14 it would appear the original author of Lev 18:7-17 did not have in mind a blanket prohibition against male same-sex coupling, which implies that it was permissible. The redactor therefore had a choice, he could have simply removed 18:22 from the later code, or to keep it and instead remove the male family member prohibitions.

The fact that the biblical laws evolved and changed over time isn't particularly novel, Marc Zvi Brettler points it out in his book ""How to read the Bible"". He doesn't use this example, but he uses the example of the Decalogue as well as slavery laws that show later scribes that disagreed with existing laws had no problem re-interpreting them and writing down what they preferred. In Bretttler's theology, he treats the biblical texts as a ""sourcebook"" and argues that so too did many of the authors of the biblical texts as well."
77,"The word “argument” can be used to designate a dispute or a fight, or it can be used more technically. The focus of this article is on understanding an argument as a collection of truth-bearers (that is, the things that bear truth and falsity, or are true and false) some of which are offered as reasons for one of them, the conclusion. This article takes propositions rather than sentences or statements or utterances to be the primary truth bearers. The reasons offered within the argument are called “premises”, and the proposition that the premises are offered for is called the “conclusion”. This sense of “argument” diverges not only from the above sense of a dispute or fight but also from the formal logician’s sense according to which an argument is merely a list of statements, one of which is designated as the conclusion and the rest of which are designated as premises regardless of whether the premises are offered as reasons for believing the conclusion. Arguments, as understood in this article, are the subject of study in critical thinking and informal logic courses in which students usually learn, among other things, how to identify, reconstruct, and evaluate arguments given outside the classroom.

Arguments, in this sense, are typically distinguished from both implications and inferences. In asserting that a proposition P implies proposition Q, one does not thereby offer P as a reason for Q. The proposition frogs are mammals implies that frogs are not reptiles, but it is problematic to offer the former as a reason for believing the latter. If an arguer offers an argument in order to persuade an audience that the conclusion is true, then it is plausible to think that the arguer is inviting the audience to make an inference from the argument’s premises to its conclusion. However, an inference is a form of reasoning, and as such it is distinct from an argument in the sense of a collection of propositions (some of which are offered as reasons for the conclusion). One might plausibly think that a person S infers Q from P just in case S comes to believe Q because S believes that P is true and because S believes that the truth of P justifies belief that Q. But this movement of mind from P to Q is something different from the argument composed of just P and Q.

The characterization of argument in the first paragraph requires development since there are forms of reasoning such as explanations which are not typically regarded as arguments even though (explanatory) reasons are offered for a proposition. Two principal approaches to fine-tuning this first-step characterization of arguments are what may be called the structural and pragmatic approaches. The pragmatic approach is motivated by the view that the nature of an argument cannot be completely captured in terms of its structure. In what follows, each approach is described, and criticism is briefly entertained.  Along the way, distinctive features of arguments are highlighted that seemingly must be accounted for by any plausible characterization. The classification of arguments as deductive, inductive, and conductive is discussed in section 3."
78,"1.	The Structural Approach to Characterizing Arguments

Not any group of propositions qualifies as an argument. The starting point for structural approaches is the thesis that the premises of an argument are reasons offered in support of its conclusion (for example, Govier 2010, p.1, Bassham, G., W. Irwin, H. Nardone, J. Wallace 2005, p.30, Copi and Cohen 2005, p.7; for discussion, see Johnson 2000, p.146ff ). Accordingly, a collection of propositions lacks the structure of an argument unless there is a reasoner who puts forward some as reasons in support of one of them. Letting P1, P2, P3, …, and C range over propositions and R over reasoners, a structural characterization of argument takes the following form.

 A collection of propositions, P1, …, Pn, C, is an argument if and only if there is a reasoner R who puts forward the Pi as reasons in support of C.

The structure of an argument is not a function of the syntactic and semantic features of the propositions that compose it. Rather, it is imposed on these propositions by the intentions of a reasoner to use some as support for one of them. Typically in presenting an argument, a reasoner will use expressions to flag the intended structural components of her argument. Typical premise indicators include: “because”, “since”, “for”, and “as”; typical conclusion indicators include “therefore”, “thus”, “hence”, and “so”. Note well: these expressions do not always function in these ways, and so their mere use does not necessitate the presence of an argument.

Different accounts of the nature of the intended support offered by the premises for the conclusion in an argument generate different structural characterizations of arguments (for discussion see Hitchcock 2007). Plausibly, if a reasoner R puts forward premises in support of a conclusion C, then (i)-(iii) obtain. (i) The premises represent R’s reasons for believing that the conclusion is true and R thinks that her belief in the truth of the premises is justified. (ii) R believes that the premises make C more probable than not. (iii) (a) R believes that the premises are independent of C ( that is, R thinks that her reasons for the premises do not include belief that C is true), and (b) R believes that the premises are relevant to establishing that C is true. If we judge that a reasoner R presents an argument as defined above, then by the lights of (i)-(iii) we believe that R believes that the premises justify belief in the truth of the conclusion.  In what immediately follows, examples are given to explicate (i)-(iii).

A: John is an only child.

B: John is not an only child; he said that Mary is his sister.

If B presents an argument, then the following obtain. (i) B believes that the premise ( that is, Mary is John’s sister) is true, B thinks this belief is justified, and the premise is B’s reason for maintaining the conclusion. (ii) B believes that John said that Mary is his sister makes it more likely than not that John is not an only child, and (iii) B thinks that that John said that Mary is his sister is both independent of the proposition that Mary is John’s sister and relevant to confirming it.

A: The Democrats and Republicans don’t seem willing to compromise.

B: If the Democrats and Republicans are not willing to compromise, then the U.S. will go over the fiscal cliff.

B’s assertion of a conditional does not require that B believe either the antecedent or consequent. Therefore, it is unlikely that B puts forward the Democrats and Republicans are not willing to compromise as a reason in support of the U.S. will go over the fiscal cliff, because it is unlikely that B believes either proposition. Hence, it is unlikely that B’s response to A has the structure of an argument, because (i) is not satisfied.

A: Doctor B, what is the reason for my uncle’s muscular weakness?

B: The results of the test are in. Even though few syphilis patients get paresis, we suspect that the reason for your uncle’s paresis is the syphilis he suffered from 10 years ago.

Dr. B offers reasons that explain why A’s uncle has paresis. It is unreasonable to think that B believes that the uncle’s being a syphilis victim makes it more likely than not that he has paresis, since B admits that having syphilis does not make it more likely than not that someone has (or will have) paresis. So, B’s response does not contain an argument, because (ii) is not satisfied.

A: I don’t think that Bill will be at the party tonight.

B: Bill will be at the party, because Bill will be at the party.

Suppose that B believes that Bill will be at the party. Trivially, the truth of this proposition makes it more likely than not that he will be at the party. Nevertheless, B is not presenting an argument.  B’s response does not have the structure of an argument, because (iiia) is not satisfied. Clearly, B does not offer a reason for Bill will be at the party that is independent of this. Perhaps, B’s response is intended to communicate her confidence that Bill will be at the party. By (iiia), a reasoner R puts forward [1] Sasha Obama has a sibling in support of [2] Sasha is not an only child only if R’s reasons for believing [1] do not include R’s belief that [2] is true. If R puts forward [1] in support of [2] and, say, erroneously believes that the former is independent of the latter, then R’s argument would be defective by virtue of being circular. Regarding (iiib), that Obama is U.S. President entails that the earth is the third planet from the sun or it isn’t, but it is plausible to suppose that the former does not support the latter because it is irrelevant to showing that the earth is the third planet from the sun or it isn’t is true.

Premises offered in support of a conclusion are either linked or convergent. This difference marks a structural distinction between arguments.

[1] Tom is happy only if he is playing guitar.
[2] Tom is not playing guitar.
———————————————————————
∴ [3] Tom is not happy.

Suppose that a reasoner R offers [1] and [2] as reasons in support of [3]. The argument is presented in what is called standard form; the premises are listed first and a solid line separates them from the conclusion, which is prefaced by “∴”. This symbol means “therefore”. Premises [1] and [2] are linked because they do not support the conclusion independently of one another,  that is, they support the conclusion jointly. It is unreasonable to think that R offers [1] and [2] individually, as opposed to collectively, as reasons for [3]. The following representation of the argument depicts the linkage of the premises.

convergent
 
Combining [1] and [2] with the plus sign and underscoring them indicates that they are linked. The arrow indicates that they are offered in support of [3]. To see a display of convergent premises, consider the following.

[1] Tom said that he didn’t go to Samantha’s party.
[2] No one at Samantha’s party saw Tom there.
——————————————————————————
∴ [3] Tom did not attend Samantha’s party.

These premises are convergent, because each is a reason that supports [3] independently of the other. The below diagram represents this.

divergent
 
An extended argument is an argument with at least one premise that a reasoner attempts to support explicitly. Extended arguments are more structurally complex than ones that are not extended. Consider the following.

The keys are either in the kitchen or the bedroom. The keys are not in the kitchen. I did not find the keys in the kitchen. So, the keys must be in the bedroom. Let’s look there!

The argument in standard form may be portrayed as follows:

[1] I just searched the kitchen and I did not find the keys.
—————————————————————————————
∴ [2] The keys are not in the kitchen.
[3] The keys are either in the kitchen or the bedroom.
————————————————————————————
∴ [4] The keys are in the bedroom.

multiple

Note that although the keys being in the bedroom is a reason for the imperative, “Let’s look there!” (given the desirability of finding the keys), this proposition is not “truth apt” and so is not a component of the argument.
An enthymeme is an argument which is presented with at least one component that is suppressed.

A: I don’t know what to believe regarding the morality of abortion.

B: You should believe that abortion is immoral. You’re a Catholic.

That B puts forward [1] A is a Catholic in support of [2] A should believe that abortion is immoral suggests that B implicitly puts forward [3] all Catholics should believe that abortion is immoral in support of [2]. Proposition [3] may plausibly be regarded as a suppressed premise of B’s argument. Note that [2] and [3] are linked. A premise that is suppressed is never a reason for a conclusion independent of another explicitly offered for that conclusion.

There are two main criticisms of structural characterizations of arguments. One criticism is that they are too weak because they turn non-arguments such as explanations into arguments.

A: Why did this metal expand?

B: It was heated and all metals expand when heated.

B offers explanatory reasons for the explanandum (what is explained): this metal expanded. It is plausible to see B offering these explanatory reasons in support of the explanandum. The reasons B offers jointly support the truth of the explanandum, and thereby show that the expansion of the metal was to be expected. It is in this way that B’s reasons enable A to understand why the metal expanded.

The second criticism is that structural characterizations are too strong. They rule out as arguments what intuitively seem to be arguments.

A: Kelly maintains that no explanation is an argument. I don’t know what to believe.

B: Neither do I. One reason for her view may be that the primary function of arguments, unlike explanations, is persuasion. But I am not sure that this is the primary function of arguments. We should investigate this further."
79,"B offers a reason, [1] the primary function of arguments, unlike explanations, is persuasion, for the thesis [2] no explanation is an argument. Since B asserts neither [1] nor [2], B does not put forward [1] in support of [2]. Hence, by the above account, B’s reasoning does not qualify as an argument. A contrary view is that arguments can be used in ways other than showing that their conclusions are true. For example, arguments can be constructed for purposes of inquiry and as such can be used to investigate a hypothesis by seeing what reasons might be given to support a given proposition (see Meiland 1989 and Johnson and Blair 2006, p.10). Such arguments are sometimes referred to as exploratory arguments.  On this approach, it is plausible to think that B constructs an exploratory argument [exercise for the reader: identify B’s suppressed premise].

Briefly, in defense of the structuralist account of arguments one response to the first criticism is to bite the bullet and follow those who think that at least some explanations qualify as arguments (see Thomas 1986 who argues that all explanations are arguments). Given that there are exploratory arguments, the second criticism motivates either liberalizing the concept of support that premises may provide for a conclusion (so that, for example, B may be understood as offering [1] in support of [2]) or dropping the notion of support all together in the structural characterization of arguments (for example, a collection of propositions is an argument if and only if a reasoner offers some as reasons for one of them. See Sinnott-Armstrong and Fogelin 2010, p.3)."
