,Comments
0,"Thank you for posting. Please review the rules. Here are a couple of gentle reminders:

1. Posts should be about people taking religion to absurd, crazy, stupid, and terrible extremes.

2.  Please don't submit   incendiary  posts or comments that could incite harassment and brigading.

 

*I am a bot, and this action was performed automatically. Please [contact the moderators of this subreddit](/message/compose/?to=/r/religiousfruitcake) if you have any questions or concerns.*"
1,"Here’s what he said: 

Adam and Eve were not immortal as they didn’t eat from the tree of everlasting life yet.

I’m not an antitheist as I’m technically a theist. My ideas of god are just different and it’s easier for me to say I’m an atheist rather than explaining my whole thing.

“Catch the hammer?” I’ve been here for a long time. I’ve been banned twice because people thought I was trolling but then they went through my history and found out I wasn’t. Trolling is just being stupid for fun and reactions. I’m here to share ideas, hear ideas, and have conversations. Because I’m respectful and honest with my interactions. You’re upset and that’s okay. I understand that you have your guard up whenever you see the word “atheist”. I want to get rid of stigma and hatred on both sides. ❤️

I don’t understand why you’re being so hostile. I’m just explaining my thinking and how I was taught in order to help you understand where I was coming from so we could have an open conversation. I’m sorry that you’re so angry.

God is supposed to be just. Justice means the punishment is equal to the crime, no more and no less. Sin is a finite crime against an infinite being that knows we will sin. It’s unjust to be sent to hell for not believing, for example, when God knows what would convince someone but refused to give them that evidence. It’s unjust to go to hell for anything as an infinite punishment for a finite crime. It’s unjust. I’m using the morals that He gave me. I’m using the mind He gave me. He wouldn’tve given us logic if he didn’t want us to use it.

Romans 1:26 is Paul cautioning against a large scale cultic practice of homosexual acts. Such an explanation fits well with the broader context of disavowing and disallowing idolatrous practices, where homosexuality was a prime component of other cultic practices including temple prostitution. This explanation ties in with the Pauline argument based on perception and “common sense”, where an appeal for the natural fitting together of male and female is made. cautions against a large scale cultic practice of homosexual acts.

Paul is criticising heterosexual people who engages in homosexual activities which are “against their nature”, and his criticism is not directed against people who are homosexual by nature, and for whom homosexual relations and activities would be “natural”. Furthermore, Paul is in any case criticising “reckless, shameless, profligate, promiscuous behaviour”, not the contemporary “committed, loving homosexual relationships.”

The statements against homoeroticism are presented as part of a wider discourse on God’s reaction against human idolatry which manifests also in human lack of control over their bodies. Female homoeroticism impinges upon the honour of the husbands of these women, leaving the men emasculated. “Because they do not worship God, this is the shameful state to which God has reduced them. The message in Romans is not about morality but about faith, about the difference between life in Christ and life without, in Israel redeemed and outside Israel”. Moreover, and although a typical Jewish concern with a generalised sense of the Gentile life, contemporary philosophers and the Stoics in particular emphasised the need for self-mastery and deplored the lack of self-mastery as foolishness – a similar stance as found in Romans 1:21-28.

I’m bi. I’m happy. I’ve found happy and healthy relationships. The reason they’ve ended was due to pressure from the outside who thought we were disgusting, harmful, and don’t deserve to live.

Not talking about prostitution? Hm. Well, in the surrounding cultures, the major socially acceptable form of same-sex activity was with male shrine prostitutes as part of temple worship to pagan gods and goddesses. And there is repeated rhetoric against these shrine prostitutes at different parts of the Hebrew Bible [see Deut. 23:17; 1 Kings 14:24 (linked with abomination), 15:12, 22:46, 23:7].

Looking wider afield, there were cultures like Ancient Greece, where the dominant form of male-male intercourse was (usually married) men with boys – pederasty. And did you notice that the verses said a man lying with a male, not a man lying with a man?

Now, occasionally I’ve seen some commentators claim that this is trying to link it back to Genesis (male and female he created them), but if so it is rather strange that ‘female isn’t used’; it’s ‘as with a woman’ and not ‘female’.

I think it more likely that ‘male’ is used here precisely because it can include lying with boys as well as men.

So two main contexts for the Israelite people to be different from – male-male intercourse linked with pagan temple goddess worship, and pederasty.

Note how different these are from what we are looking at today; with faithful, loving, committed relationships."
2,"the bible’s viewpoint has never changed!!!

alright, then christians still support slavery? good to know 👍"
3,So is it the Church or the Bible that is ultimately the arbiter of god's word? You'd think that would be less confusing
4,"No that is not remotely what I said. You claimed they posted a long argument for why the Bible isn’t homophobic, and it is."
5,"Oh, hey, I recognize that profile picture! I got in a pretty nasty argument with him myself a few months ago…"
6,Two brick walls rarely move one another.
7,"So funny. When Constantine decided that he wanted to use Chriatians as a power source, he decided, with the semi advice of the council of Nicea, which he sort of rejected what sacred Christian texts were holy. So then he and the Bishop of Alexandria essentially created the Bible as we know it. He threw so many sacred texts out that he required all priests and above  to send all their holy texts to Rome, and he would send you your new beliefs.

The Donats decided they would not. The Northwrn African clerics were.deemed heretics by Constantines new sect.  For the crime of  keeping the faith as passed down from the actual time ofJesus and.Donatism was oppressed. Look up Christian apocrypha, Gospel of Mary, etc.

So, anybody who thinks Christianity is what is in the Bible, and has always been, needs to talk to the Donats, and maybe the Ethiopian Christians"
8," A few things. It bothers me how he says Biblical answer then says “Holy Tradition and Doctrine” these arnt Biblical and directly contradict Biblical things. It directly contradicts Jesus.


His Church was not the first person to canonize the Bible. Marcion was the first one to do that

Sodomy could be used for a few things. Such as anal sex and blowjobs.

The Catholic Church as it is today has not existed for 2000 years.

Homosexuality is a very  interesting thing in scripture. What people need to understand is that laws in the Bible were created to combat something that is happening around them. The reasons the OT talks about homosexuality is because the Jews who wrote that were in an Area where people would have sex with younger men or friends for fun. These laws come from a time where people were somewhat ignorant to homosexuality as 2 people being in love with each other. Those laws arnt coming about because they see 2 men with each other. They are created because they see soldiers  and Greeks? Having sex for fun. What’s interesting here is that the men having sex are not homosexual but heterosexual.  I don’t think you’ll find a single heterosexual man that wouldn’t have sex with another man if they were pretty or something and there were no woman around.

Paul has this same way of thinking when you read his writings. He doesn’t seem to care or know about to men loving each other. I personally think Paul was a closeted gay man but that’s another conversation. Paul focuses a lot on men kind of like Jesse Lee Peterson. We know he’s gay even though he launches attacks on gay men. 

Paul may say some things about homosexuality but he is referring more to male prostitution then 2 men in love with each other. AT the same time Paul also says not to have sex in general because he thought the end of the world was soon and with in his lifetime. Paul actually had to say it a letter that “Well……. If your going to have sex you might as well get married” BUT Paul at first thought people shouldn’t have sex at all but had to change his stance because people pushed back.


The fact that this guy says the church never change shows he’s never taken the time to learn his churches history."
9,"Well, Leviticus is pretty cut and dry as homophobic as it gets, it’s one of the many reasons the Bible is trash and I can’t condone the revisionist gymnastics to try and cover that up even if their heart is in the right place."
10,"I understand this argument but I never find it convincing, even when I was an Evangelical. This line of thinking, as seen in the post, would fare even worse with conservative Christians with stronger emphasis on Apostolic tradition, like Roman Catholics and Eastern Orthodox. 

If you look at the punishment prescribed for this act of ""lying with a male as with a woman"", it is death for both parties.

So if this verse is indeed talking about pederasty, which necessarily involves a power imbalance, the punishment is very unjust with regards to the minor in the relationship. If pederasty was indeed baked into the culture of the time, and which Leviticus was trying to condemn, these younger boys/males likely didn't have much to say regarding the practice itself. They were more likely to be a victim, in our current understanding of morality. On the other hand, if the verse is understood as two men consenting to commit homosexual acts with each other, the punishment would have made more sense, and just, in that context.

Early church fathers, both Latin and Greek, have always condemned homosexual acts. John Chrysostom, the foremost authority in the Orthodox church, condemned homosexuality. So it would be next to impossible to convince a practising Orthodox Christian that being gay is okay. One Latin father - his name eludes me now - used the example of Jupiter's relationship with the boy Ganymede as proof of him being a false god (or demon in disguise). A true God would have never approved, let alone engaged, in the practice of sodomy. And his argument places a heavy emphasis on the gender of Ganymede, not his age. So, this is a general condemnation against homosexuality, not merely pederasty.

It all comes down to one's understanding of the continuity vs discontinuity in church teachings. Which part can change vs which part can't change. Or put differently, what the nature of ""progressive revelation"" is. 

What some view as ""brick wall"", some others view as ""protective wall"".
What some view as ""progress"", some others view as ""degeneracy"".

For the record, I'm gay and grew up an Evangelical. However, I'm still conflicted whether I can stay Christian or not whilst accepting my gayness since I'm more convinced by the so-called argument via tradition than by the Evangelical attempts at proof-texting."
11,And that's why religions desperately need to swallow their pride and *update themselves*.
12,"Different Christians answer this differently.

For an Orthodox Christian (and Roman Catholics), it is the bible, as interpreted through the teachings of the apostles and church fathers, which came to them via tradition.

Only the Evangelicals and modern Protestants believe in the individual interpretation of the bible. Even John Calvin quoted the opinions of church fathers in trying to support his arguments.

So, the person in the OP is actually acting consistently with his tradition."
13,Two nuts in the same slice of fruitcake.
14,The Council of Nicaea was about Jesus’s divinity. Had nothing to do with scripture. The council had nothing to do with the creation of the Bible.
15,"Why do you think that the existence of tradition contradicts Jesus? These Christians would refer to the Great Commission where Jesus said that the apostles are to teach the ones they baptise to do whatever Jesus taught them to do. They are also asked to commemorate his death ""until he comes again."" The Orthodox interpets this as their Divine Liturgy, the Catholics as their Eucharist, and the Protestants as their communion. Wasn't Jesus laying down a form of tradition in both of these cases?

The guy is Eastern Orthodox though, not Catholic. He would likely think that Catholics are heretics. His chuch, like the RCC, would likely condemn anal and oral sex too. If I'm not wrong, one Orthodox saint opined that the reason a boy would show homosexual tendencies is because his mother engages in anal sex while she is pregnant.

And with regards to Eastern Orthodoxy never changing, we have this: https://en.m.wikipedia.org/wiki/Old_Believers.
I have no knowledge whatsoever about Eastern Orthodoxy though. 
I also noticed that since Reddit is heavily US-based, the arguments people field against Christianity focus on Evangelicalism, and to a lesser extent Roman Catholicism. These sorts of arguments would never win the Eastern Orthodox. Unless one attacks the veracity of the Bible itself."
16,"Leviticus are laws only for the Jewish people.

If a Christian uses it, they are taking scripture out of context"
17,So you admit you didn’t read anything?
18,"It forbids men to ""lie with a man as thou would with a woman"". Like, what, in the missionary position? How would two men even *do* that without crushing each other's nuts?"
19,Funny.
20,"I was Orthodox, but every Sunday we read the Nicean Creed, something definitely not original in Christianity."
21,"Which verse was it that god said “ignore everything I said in the Old Testament it was just a meme”? Is it when Jesus said 

>	“**Do not think that I have come to abolish the Law or the Prophets**; I have not come to abolish them but to fulfill them. For truly I tell you, until heaven and earth disappear, not the smallest letter, not the least stroke of a pen, will by any means disappear from the Law until everything is accomplished” (Matthew 5:17–18).

You really think Christian’s are supposed to just ignore the part where the perfect god they worship tells them that two men having sex is an abomination and they need to be executed?"
22,"I mean I feel like it’s not that far fetched that guys could have sex in a way similar to missionary but without going into graphic detail lol, the way the Bible typically uses the word “lie” is a general term for sex. I mean it’s essentially just saying man should not simulate the kinds of acts they do with a woman, with another man."
23,The more you know
24,"Some Christians would say that this is part of ""progressive revelation"" - I don't know if the Orthodox has an equivalent concept.
Basically God revealing his truth in step-wise manner without contradicting his previous revelation. They would use this to counter the objection to certain new concepts appearing as doctrines.

Some Protestant theologians would claim that OT figures obtained redemption before Jesus by trusting in the advent of the future promise (a concept found in the letter to the Hebrews).
One of my Calvinist pastors believed that the OT God was ""as-yet-unclear Trinity"". 

Of course, whether these are all valid arguments is another can of worms. Jewish rabbis would definitely disagree with the Christians' conclusions, of course.

As an aside, my home church (Protestant) would make the congregants recite the Nicene creed on important days, like Christmas and Easter, instead of the abridged form (called the Apostles' creed) they routinely use in ordinary services. 
But of course, their version has the ""filioque"" clause in it."
25,"Jesus was a Jew talking to other Jews not Christians. A lot of people think Jesus was a Christian preaching to Christians when he wasn’t. You also have in scripture Jesus saying and showing that he only came for the Jewish people.

That doesn’t change that the OT was meant for only the Jewish people. That’s when Paul comes along and changes thing. 

Leviticus and Deuteronomy were for a certain sect of Judaism and not every Jew followed them.

There are different kinds of Judaism and you shouldn’t look at the OT as if every Jew followed it.  Leviticus was made for a certain sect of Jews in a certain area. Jews in other areas didn’t follow it and the same goes for Deuteronomy. It wasnt till much later things were combined and even then many Jews went their own ways.

For example. Jesus’s Judaism is different the Philo of Alexandria’s Judaism and they existed during the same time period

I will also add when Jesus says he hasn’t come to abolish the law he saying he hasn’t come to abolish the Torah. He came to fulfill the Torah. 

There are 2 Jesus’s here. The historical one that clearly only cares for the Jewish people and the theological one that Christians have created."
26,One of us does.
27,"Ok cool so Christians should just ignore everything in the Bible then because Jesus wasn’t talking to them, I’ll be the first to let them know. 

You’re gonna have to find me the verse where Jesus says “only Jews should believe what I’m
Saying” because I can’t remember one. The problem is that, even if you can find that verse, none of these arguments are relevant. It doesn’t actually matter *who* Jesus was talking to, because Christians follow his words regardless and believe in his teachings, and because that’s **not even the topic.** It’s complete non sequitur.

Most importantly, It doesn’t matter who anyone was talking to because the claim I’m disputing is whether or not the Bible is homophobic, not who Jesus is talking to. This is a very simple logical syllogism.

P1: If a book condones homophobic actions then that book is homophobic   
P2: The Bible condones homophobic actions  
Conclusion: The Bible is homophobic"
28,And that would be me.
29,"I don’t know how else to tell you Jesus was a Jew preaching Jewish things to only the Jewish people.

The Torah is only meant for the Jews and no one else. The commandments are meant for the Jews and no one else.  The Jewish people did not expect outsiders to follow the Torah the way Christians think everyone should be following the Bible.

I can’t stress this enough. You need to separate the historical Jesus, the Jesus in scripture and the Jesus Christian’s have created.

Christians do not follow Jesus’s words.

The Bible is criticizing heterosexual men that sleep with other men. Not homosexual love because the authors did not know how the brain worked and it was heterosexual men that were going around sleeping with each other. 

Do you want the verse where Yahweh was given to the Israelites? Do you want the verse where the gentile woman had to beg Jesus to help her?"
30,Believers are not knowers.
31,"I can’t stress enough it doesn’t make a single difference who Jesus was talking to. I don’t even have to disagree with that point for the Bible to still be homophobic. As I already said this is a complete non sequitur. 

If I write a book speaking only to Irish people, and it tells them they need to go kill all Asian people because they’re an abomination, does that mean it’s not a racist book just because I’m only talking to the Irish? Of course not, such an argument is completely nonsensical.

Additionally, I  gave a logical syllogism of exactly my argument proving the Bible is homophobic and you left that totally unchallenged.


Edit: I forgot to address this one 

>	The Bible is criticizing heterosexual men that sleep with other men. Not homosexual love 

Really? How many Olympic Gold medals do you have?"
32,"I’m an atheist that studies Judaism and Christianity.

The council of Nicaea was not about scripture but about Jesus’s divinity. There was a person going around gaining a following and it had to be addressed. The dudes name was Arius. 

This is when the doctrine of the Trinity came about as well even though it was coined and called heretical 200 years before.

What your doing is saying something and showing your ignorance. Be happy you learned something you were wrong about. Knowledge is great"
33,"It does matter who Jesus was talking to and the context of what is being said.

I never said the Bible wasn’t homophobic. I just said that they look at homosexuality in a different way because they arnt talking about homosexuals. But straight men sleeping with other straight men for fun. 

Get it?"
34,"Well, I'll take my good college grades in the BIble and fathers 50 years as a Biblical scholar and writer and say the 1st Council of Nicea removed many many sacred texts from study because it didn't fit Constantines needs, and rhat is how the Bible was formed. By making heretic the believers in these long held natures of Jesus and.god. you almost have it, but miss the consequences.

You completely ignore  the fallout between deciding that ""nature of Jesus and trinity and the end of much sacred texts. 
And then Constantines church required the priests and others return their holy books to th, so they could recieve the revised Christian belief books.which set up the church of Carthage issues with Donatism. 

Read the apocryphal, that which was made heretical. And how about Constantine and the Bishop of Constantinople? How do you explain that away??"
35,">	It does matter who Jesus was talking to and the context of what is being said.

No it doesn’t matter who Jesus is talking to because again, the Bible is homophobic regardless of who he’s talking to. See my book to the Irish example above once again.

>	I never said the Bible wasn’t homophobic.

Read the title of the post above. The post that we’re having this discussion in right now is about a long post trying to argue the Bible is not homophobic. That’s the entire topic and precisely what I’m arguing against.


>	they look at homosexuality in a different way because they arnt talking about homosexuals. But straight men sleeping with other straight men for fun.

This is the only argument you’ve presented thus far that actually would work *if it were true* but I have no idea why you would believe this is true. The Bible doesn’t make a distinction between heterosexual and homosexual precisely because of what you said earlier, they didn’t understand how the brain works. They didn’t have a concept of homosexuality because they just thought of it as a wicked act, an abomination. They weren’t secretly progressive and gay friendly. The reason why there are no verses talking about how God is cool with “true” homosexuals is because he wasn’t. You need to have Reed Richard’s arms to make this kind of reach."
36,"You are literally repeating a Myth saying Constantine had anything to do with what’s in the Bible.

https://www.reddit.com/r/AcademicBiblical/comments/p2olnv/how_did_the_council_of_nicea_decide_which_books/


You are literally talking to someone who hangs out on an Academic subreddit for Christianity and Judaism"
37,"I’m not making arguments.

I’m just telling you what scholars say about Judaism and Jesus lol"
38,Wow. So shit. Reddit.
39,Ok so you just chose a random comment (mine apparently) to say a bunch of non sequitur that you don’t even agree with? You just post random things that scholars believe when it has no bearing on the topic? You didn’t literally just make the claim that the Bible is actually talking about heterosexual men and not homosexual men?
40,"Wow.

You are an extremely toxic and smug person that lacks the ability to admit when they’re wrong"
41,"Your saying ridiculous shit bro lol.


Your all over the place with what your saying lol"
42,I am not wrong.
43,"Ok so you can’t answer any of the questions you were just asked. 

I responded to a post, by making the case that the Bible **is** homophobic, you responded saying you don’t disagree but then posted paragraphs of (not?) arguments about how the Bible actually isn’t homophobic.

So you agree but you don’t agree, and you don’t even believe what you posted but you’re just posting it because “scholars” said it, but somehow I’m all over the place? You can’t even follow the topic of the discussion, or even explain what the point of anything you’ve said here is, and *I’m* all over the place. Sure ok."
44,"I literally showed you a link that also has sources

You are wrong and what you think is a literal myth and no serious scholar agrees with it"
45,"Your entire thing is the Bible is homophobic when it’s not even talking about homosexual activity lol. It’s talking about heterosexuals and how they sleep with their friends for fun.

You cant separate Jesus and you can’t separate how people viewed sexually 2000+ years ago lol"
