,Comments
46,"Indeed serious scholars understand the outcome of negating the bulk of religious texts where there is no trinity.

I have studied this for 55 years a.  I have an extensive, real book library, and inherited my father's ancient bibles, original Greek  etc I have a minor in the Bible.

I read many texts, I see who I believe have a catholic prejudice from their views. And that the Council of Nicea "" just dealing with the Trinity and heretics"" is a whitewash of what the goal and outcome was.

My father's writing were very popular in Great Britain and when though he wrote them 40 years ago.and have been out of print, I still found some to order and replace some worn out books."
47,">	Your entire thing is the Bible is homophobic

That’s exactly right, my whole thing is the Bible actually is homophobic. Not who was Jesus talking to.

>	it’s not even talking about homosexual activity lol. 

Yes it is.

>	It’s talking about heterosexuals and how they sleep with their friends for fun.

You have absolutely no logical reason to believe this and I have no idea why you even *would* believe this. This is a fantastical construction you’ve just made up. There is no biblical support for this revision."
48,"The council of Nicaea had nothing to do with texts but doctrine and discourse because there was infighting with other Christians.

I’m sorry you’ve wasted all this time studying this from non reputable scholars like your father.


https://www.newadvent.org/fathers/3801.htm

https://en.m.wikipedia.org/wiki/First_Council_of_Nicaea#Biblical_canon

https://ps.edu/council-nicaea-biblical-canon/

The Text of the New Testament: Its Transmission, Corruption, and Restoration (4th Edition) Bruce Metzger.




I don’t think you can give me 1 source to back up what you say other then, well my dad…"
49,No logical reason? It’s history lol
50,It’s fake history that you just created for no logical reason. It doesn’t say “if a straight man lie with a man as he does with a woman” it just says “man”. There is nothing there that suggests it’s talking about straight men whatsoever.
51,You have clearly never read a single thing of Judaism or things that were happening around then when they were writing their scripture lol
52,Show me the thing that proves Leviticus is talking about straight men fucking other guys. I’d love to read that.
53,"Answer me this.

What culture was around the Jewish people when Leviticus was wittten?

And is Leviticus for all the Jews or just the Priests?"
54,"It doesn’t matter, answer with literally anything you want. I want to see the proof that Leviticus is about straight guys fucking dudes, that’s what I want to see. Show me that evidence please oh please. I simply would love to read that."
55,"Answer my questions.

They are important to understand what I’m saying.

Have you never read any commentaries on Leviticus by top scholars? 

Do that"
56,"Oh so now we’re demanding answers after you skipped like every single one I asked you? 

You can go right ahead and just answer yourself since you’re already waiting for some specific answer to make a case. 

None of the answers to your questions make any difference because it’s logically still not going to get you to “therefore Leviticus is about straight dudes”. You can fill in the blanks with literally anything and your claim still fails. 

And what’s a “top scholar”, one that peddles the nonsense you want to hear? Interesting that you have absolutely **nothing** in the Bible to support your claim. **Not a single** verse that’s remotely gay friendly or even acknowledges gay people as legitimate, but you want to pretend like it is."
57,"Wenham, Gordon J, the Book of Leviticus

Hartley John E, Leviticus


You act like a Christian the way you look at scripture."
58,"Yeah sure, I usually just try to act like someone with basic critical thinking skills. The literal topic is the Bible and what’s inside of it, and you can’t even explain a single thing. You’re trying to say it actually says something that it doesn’t, and the reason why you think that still is not revealed.

Ok so your position is:

>	Leviticus [20:13](https://biblehub.com/leviticus/20-13.htm) is actually talking about straight men because Wenham, Gordon J, the Book of Leviticus   
>	Hartley John E, Leviticus

?

Is this about right? Are you picking up on how when you read it, it doesn’t make any sense or prove anything? You ever hear of an appeal to authority fallacy?"
59,Stop reading scripture like a Christian.
60,That sentence doesn’t mean anything
61,That fact that you don’t understand what I just said says everything lol.
62,And the fact that you can’t explain it because it doesn’t make any kind logical sense whatsoever? What does that say?
63,"Alright cool. Let me explain it. Since your to lazy to listen to 100 + years of scholarship.


The Law where men shouldn’t lay down with other men is applied only to the priestly class. This is scholarship and it’s what we know of this sect of Judaism who wrote Leviticus. 

When you read that verse you shouldn’t be reading it as a law for everyone but a law for the priestly class and people more focus on spiritual things.

This law comes because the Jewish people were around Persians and Greeks. Greeks were known to sleep with younger men and their friends for fun. They did not care for purity and did not care for anything spiritual. Homosexuality existed but during that time they did not view it the way we view it today. The Jewish people saw Homosexuality as pagan worship and not love. 

So sure you can say the Bible is homophobic but your missing something extremely important when you read the Bible literally like you do. 

They are not looking at this as 2 men in love but pagan worship or pagan practices. They arnt aware of what homosexuality is because they are a  primitive people who view homosexuality as pagan. They see a bunch of pagan people doing things and they are associating it with paganism


Now, if your looking for Bible verses you arnt going to find it. 

If you want to verify what I’m saying I literally have you Academics who talk about it and scholars who study Judaism will tell you this"
64,"Yeah cool so you just did a massive gish Gallup, what a shocker. You brought out the same old tired irrelevant argument that I already debunked about “who” they’re talking to. It can not be made more clear that it doesn’t matter who they’re talking to. This is completely invalid logic and proves literally nothing regardless who they’re talking to. “Who” the law is for is not, and never has at any point been the question. 

Then you just went on to make more claims with **zero** supporting evidence. So your claim that it’s talking about straight people once again goes completely unproven. Once again, you just did an appeal to authority fallacy. I can go find some scholars that say climate change is a hoax, does that mean they’re right? **No**. 

Is there anything in the actual **Book** we’re talking about that supports your claim? Of course not. And somehow that isn’t a huge obvious flashing sign to you, that you’re completely fabricating nonsense.

>	So sure you can say the Bible is homophobic

And I would be and have been right, because you have **ZERO** supporting evidence and **ZERO** logical argument to suggest anything else.

Let me just leave you with one final question to dodge like all the others, what’s the fucking point of reading those books you cited earlier if you can’t point to a single thing in them to prove anything?"
65,"I’m ending my conversation with you because you don’t care about what scholars on ancient Judaism say and I’m done trying to explain it to you.

Have fun acting like a Christian."
66,Says the person who believes absolutely insane shit without a shred of evidence or logic.
67,"Says the person thats refusing to listen to academics on the subject. The evidence is there.

You won’t even read a book about it. 


Have fun being a Christian"
68,"I already pointed your appeal to authority fallacy. I can go find you some crazy Islamic scholars that say all kinds of insane shit, you gonna listen to them too? Christians don’t think logically so you’re by far the one who is acting more “like a Christian” which isn’t even an argument, once again. It’s a meaningless statement like everything else you said. That’s why you can’t be more specific than just dropping a fucking book. You can’t even narrow it down to single fucking thing **in the book**, so the book is completely fucking useless.


So basically everything you said is dumb, which is proven by [this book](https://iep.utm.edu).  Guess you better go read all of it."
69,"It’s not an appeal to authority when you have hundreds of different people talking about it.

Christians say that same thing lol.

I’m not gonna waste my time teaching you what fallacies are either lol"
70,"And Yahweh said to Moses, 'Say to the priests, the sons of Aaron. . .'"" In other words, this specific chapter was meant exclusively for the Aaronid priesthood, and besides, the only man that could offer bread to Yahweh was the Aaronid priest (Ex 25:30). Chapters 21-22 might have existed, like Lev 1-7, as a once independent text for the Aaronid priesthood exclusively.

More generally (excerpted from my forthcoming book on Genesis 1 and the Priestly writer):

Throughout the book of Leviticus, and especially in those chapters devoted to its laws and commandments (Lev 11-22), the role of the Aaronid priests is repeatedly defined by the phrase ""to distinguish between the holy and the profane, between the pure and the impure."" In fact, the whole priestly law code is presented as the very instruction (torah) for doing this. Its torahs are ""to distinguish between the holy and the profane, the pure and the impure"" in matters of: diet (Lev 11); women, i.e., menstruation and childbirth (Lev 12); skin diseases and afflictions (Lev 13-14); bodily emissions (Lev 15); sex and nudity (Lev 18, 20); miscellaneous matters (Lev 19); and issues concerning the Aaronid priesthood (Lev 21-22).
Thus according to the priests who composed this text, certain foods are unclean or impure; a woman's menstruation is impure; any bodily discharge or emission is impure; leprosy and other skin infections are impure; in fact diseases by their very nature are impure; any clothes or a house that comes into contact with the infectious is also unclean and impure. Anything that touches, for example, pork, a corpse, the blood of a menstruating woman---whether a bottle, a piece of clothing, a bed, the walls of your house, etc.---also becomes contaminated and impure and must be purified through washing or simply discarded. Likewise, any individual coming into physical contact with a corpse or the blood of a menstruating woman also becomes impure. Exposing the nudity of one's relative is impure; homosexuality is impure; having intercourse with a menstruating woman is unclean; mix-breeding animals and different kinds of seeds are impure; eating a torn animal is impure, and so on. Moreover, any individual who has contracted an impurity (i.e., committed a sin) and does not expiate his impurity/sin through a ritualized washing and sacrifice officiated over by the Aaronid priest was irrevocably cut off and banished from the community.
There are numerous other examples of pro-Aaronid legislation and a pro-Aaronid Yahweh that are only found in the Priestly source---all of which stand in sharp contrast to the pan-Levite legislation and pan-Levite Yahweh of Deuteronomy. Thus, in this Aaronid-written text, and only in this text, do we find ""Yahweh"" endorsing:
the sole selection of the Aaronids as his priests and the demotion of all other non-Aaronid Levites as their servants [Exod 28:1-4, 41-43; 29:1-9; 40:13-15; Lev 7:35-36; Num 3:5-10; 8:18-19 (contra Deut 18:1-5; 17:9, 18; 24:8; 27:9; 33:8-10)];
the sole right of the Aaronids to officiate sacrifices; and therefore the sole right of the Aaronids alone to expiate and atone for sin [Lev 1-7, and the book of Leviticus in general. See also Num 15 (contra Deut 18:1-5)];
the sole right of the Aaronids to enter the Tabernacle [Num 1:51; 3:10, 38; 18:5-7, 22];
the sole right of the Aaronids alone to touch Yahweh's holy objects [Num 4:1-19 (contra Deut 18:1-8; cf. 1 Sam 6:13-19)];
the sole selection of Aaronid priests as judges [Exod 28:30; Lev 13; Num 5:16-28 (contra Deut 17:8-13; 33:8-10)];
the sole right of the Aaronids to be able to eat Yahweh's sacrifices [Lev 6:9-11, 19-22; 10:12-15 (contra Deut 18:1-2)];
the sole right of the Aaronids as the beneficiaries of the people's firstfruit offerings and donations [Num 18:8-14; Lev 6-7];
and the sole right and privilege of the Aaronids to burn incense [Exod 30:7; Num 17:5 (contra Deut 33:10)].
All of these Yahweh-decreed pro-Aaronid privileges are only found, not surprisingly, in this text written by priests who traced their lineage back to Aaron.
Additionally, all the privileges enjoyed by the Aaronid priests and their function as Yahweh's sole ministers were also legitimated through divine decree by presenting them as ""Yahweh's eternal laws."" In other words, the Aaronid priestly guild responsible for the composition of this scroll has Yahweh decree all of the following as ""eternal law"": the anointing of the Aaronids as Yahweh's sole priests (Exod 28:1-4, 41-43; 29:9; 40:12-15; Lev 6:15; Num 10:8); the daily lamp that must be kept lit by the Aaronid priests (Exod 27:20-27; Lev 24:3, 9); Yahweh's show bread which must be displayed daily by the Aaronids (Exod 25:30); the Aaronid priesthood's portion of the sacrifices (Exod 29:28; Lev 6:11; 7:34; 10:15; 24:9); the daily sacrifice and continual fire on the altar (Exod 29:30; Lev 6:6); the washing of the Aaronid priests before they enter the Tabernacle (Exod 30:21); the prohibition of beer and wine for Aaronids before entering Yahweh's presence (Lev 10:9); and all donations, firstfruits, and sacrificial offerings belong eternally to Aaron and his sons (Num 18:8, 11, 19). In other words, the whole care and legitimation of the Aaronid priesthood and the sacrificial cult as envisioned and officiated over by the Aaronid priests themselves are repeatedly highlighted as ""Yahweh's eternal laws"" throughout the very text that they themselves wrote! Moreover, these eternal decrees occur nowhere else in the Bible but in this text, the Priestly scroll. [fn. One may find sympathetic decrees in the fourth century books of Chronicles, which also display the concerns of an Aaronid author, and the book of Ezekiel, which was apparently written by an Aaronid Zadokite priest.]
Again for readers unfamiliar with ancient Near Eastern literature---and that is most ""readers"" of the Bible---this is precisely what ancient literature did and was composed to do. Properly we would label this as propaganda---that is literature written to endorse and in this case divinely authenticate the sole authority, ideology, and beliefs of its authors."
71,"You literally don’t have the ability to teach anyone what fallacies are. You just used *another* fallacy to try to get out of your appeal to authority fallacy.  What you literally just did was use an appeal to popularity fallacy to try and excuse your appeal to authority fallacy. You also demonstrated earlier that you don’t even understand what logical arguments are, so again you’re talking like you know shit, but you’re totally out of your depth. That’s not even to mentioned your constant obsessive ad hominem projecting about Christians."
72,"And Yahweh said to Moses, 'Say to the priests, the sons of Aaron. . .'"" In other words, this specific chapter was meant exclusively for the Aaronid priesthood, and besides, the only man that could offer bread to Yahweh was the Aaronid priest (Ex 25:30). Chapters 21-22 might have existed, like Lev 1-7, as a once independent text for the Aaronid priesthood exclusively.

More generally (excerpted from my forthcoming book on Genesis 1 and the Priestly writer):

Throughout the book of Leviticus, and especially in those chapters devoted to its laws and commandments (Lev 11-22), the role of the Aaronid priests is repeatedly defined by the phrase ""to distinguish between the holy and the profane, between the pure and the impure."" In fact, the whole priestly law code is presented as the very instruction (torah) for doing this. Its torahs are ""to distinguish between the holy and the profane, the pure and the impure"" in matters of: diet (Lev 11); women, i.e., menstruation and childbirth (Lev 12); skin diseases and afflictions (Lev 13-14); bodily emissions (Lev 15); sex and nudity (Lev 18, 20); miscellaneous matters (Lev 19); and issues concerning the Aaronid priesthood (Lev 21-22).
Thus according to the priests who composed this text, certain foods are unclean or impure; a woman's menstruation is impure; any bodily discharge or emission is impure; leprosy and other skin infections are impure; in fact diseases by their very nature are impure; any clothes or a house that comes into contact with the infectious is also unclean and impure. Anything that touches, for example, pork, a corpse, the blood of a menstruating woman---whether a bottle, a piece of clothing, a bed, the walls of your house, etc.---also becomes contaminated and impure and must be purified through washing or simply discarded. Likewise, any individual coming into physical contact with a corpse or the blood of a menstruating woman also becomes impure. Exposing the nudity of one's relative is impure; homosexuality is impure; having intercourse with a menstruating woman is unclean; mix-breeding animals and different kinds of seeds are impure; eating a torn animal is impure, and so on. Moreover, any individual who has contracted an impurity (i.e., committed a sin) and does not expiate his impurity/sin through a ritualized washing and sacrifice officiated over by the Aaronid priest was irrevocably cut off and banished from the community.
There are numerous other examples of pro-Aaronid legislation and a pro-Aaronid Yahweh that are only found in the Priestly source---all of which stand in sharp contrast to the pan-Levite legislation and pan-Levite Yahweh of Deuteronomy. Thus, in this Aaronid-written text, and only in this text, do we find ""Yahweh"" endorsing:
the sole selection of the Aaronids as his priests and the demotion of all other non-Aaronid Levites as their servants [Exod 28:1-4, 41-43; 29:1-9; 40:13-15; Lev 7:35-36; Num 3:5-10; 8:18-19 (contra Deut 18:1-5; 17:9, 18; 24:8; 27:9; 33:8-10)];
the sole right of the Aaronids to officiate sacrifices; and therefore the sole right of the Aaronids alone to expiate and atone for sin [Lev 1-7, and the book of Leviticus in general. See also Num 15 (contra Deut 18:1-5)];
the sole right of the Aaronids to enter the Tabernacle [Num 1:51; 3:10, 38; 18:5-7, 22];
the sole right of the Aaronids alone to touch Yahweh's holy objects [Num 4:1-19 (contra Deut 18:1-8; cf. 1 Sam 6:13-19)];
the sole selection of Aaronid priests as judges [Exod 28:30; Lev 13; Num 5:16-28 (contra Deut 17:8-13; 33:8-10)];
the sole right of the Aaronids to be able to eat Yahweh's sacrifices [Lev 6:9-11, 19-22; 10:12-15 (contra Deut 18:1-2)];
the sole right of the Aaronids as the beneficiaries of the people's firstfruit offerings and donations [Num 18:8-14; Lev 6-7];
and the sole right and privilege of the Aaronids to burn incense [Exod 30:7; Num 17:5 (contra Deut 33:10)].
All of these Yahweh-decreed pro-Aaronid privileges are only found, not surprisingly, in this text written by priests who traced their lineage back to Aaron.
Additionally, all the privileges enjoyed by the Aaronid priests and their function as Yahweh's sole ministers were also legitimated through divine decree by presenting them as ""Yahweh's eternal laws."" In other words, the Aaronid priestly guild responsible for the composition of this scroll has Yahweh decree all of the following as ""eternal law"": the anointing of the Aaronids as Yahweh's sole priests (Exod 28:1-4, 41-43; 29:9; 40:12-15; Lev 6:15; Num 10:8); the daily lamp that must be kept lit by the Aaronid priests (Exod 27:20-27; Lev 24:3, 9); Yahweh's show bread which must be displayed daily by the Aaronids (Exod 25:30); the Aaronid priesthood's portion of the sacrifices (Exod 29:28; Lev 6:11; 7:34; 10:15; 24:9); the daily sacrifice and continual fire on the altar (Exod 29:30; Lev 6:6); the washing of the Aaronid priests before they enter the Tabernacle (Exod 30:21); the prohibition of beer and wine for Aaronids before entering Yahweh's presence (Lev 10:9); and all donations, firstfruits, and sacrificial offerings belong eternally to Aaron and his sons (Num 18:8, 11, 19). In other words, the whole care and legitimation of the Aaronid priesthood and the sacrificial cult as envisioned and officiated over by the Aaronid priests themselves are repeatedly highlighted as ""Yahweh's eternal laws"" throughout the very text that they themselves wrote! Moreover, these eternal decrees occur nowhere else in the Bible but in this text, the Priestly scroll. [fn. One may find sympathetic decrees in the fourth century books of Chronicles, which also display the concerns of an Aaronid author, and the book of Ezekiel, which was apparently written by an Aaronid Zadokite priest.]
Again for readers unfamiliar with ancient Near Eastern literature---and that is most ""readers"" of the Bible---this is precisely what ancient literature did and was composed to do. Properly we would label this as propaganda---that is literature written to endorse and in this case divinely authenticate the sole authority, ideology, and beliefs of its authors."
73,"And here we go with the fucking gish Gallup (go look that up for the sake of anyone else that has to engage in a disagreement with you) once again, because you don’t understand basic logic or how to make an argument or prove anything. Just hide behind a wall of text that literally doesn’t prove what you’re trying to prove."
74,"Typical English translations on the issue are irrelevant, since most translations are interpretive rather than literal. Berlinerblau says that a literal, secular, translation of Leviticus 18:22 might read something like this:

And with a male you will not lie lying downs of a woman, It is an abomination.
In Leviticus, the specific target of the texts is sexual relations between men that occur “on the beds of a woman” (מִשְׁכְּבֵ֣י אִשָּׁ֔ה), as Wells translates it (and this is the more accurate translation imo). The big question has to be: what does that expression – “on the beds of a woman” or ""lying downs of a woman"" – mean? In 18:22, the adverbial use to describe how the lying down occurs (which results in the English translations ""as one lies with a woman"") is not supported for מִשְׁכְּבֵ֣י. Such an adverbial use would first need to be demonstrated. Additionally, while the preposition ‘as’ is present in all English versions, there is no equivalent in the Hebrew text. Between the words tishkav and mishkevey, one would expect the Hebrew prepositional particle ke, which means ‘like’ or ‘as’. However, ke is not there. The English translations are unjustified (cf. Lings, K. Renato. “The ‘Lyings’ of a Woman: Male-Male Incest in Leviticus 18.22?” Theology & Sexuality, 2015). Going back to the word ""מִשְׁכְּבֵ֣י,"" I think that one has to assume a locative connotation, because מִשְׁכְּבֵ֣י nearly always (I would say always) indicates a place or location. So for 18:22, the grammatical/syntactic function of מִשְׁכְּבֵ֣י is telling the reader “where” you can’t lie with a man (see below). In Lev 20:13, the use of מִשְׁכְּבֵ֣י is appositional. The conclusion is almost inevitable, in both cases, the end result is that it is qualifying the sleeping partner in question, which limits the scope of the prohibition of the male-with-male relationship. Instead of condemning same-gender sex universally, they condemn a specific form of same-gender sex between men. Possible suggestions of interpretation are that the texts condemn male on male incest (since the main aim behind Leviticus 18-20 is to ban incestuous practices). Another potential interpretation is that the texts are basically saying, 'don’t have sex with a man who is the sexual partner of a woman.' Many different directions could be had because of the ambiguous phrase. At least four other experts of Leviticus all agree (not counting Wells and Stewart): Milgrom, Leviticus 17-22: A New Translation with Introduction and Commentary, pp. 1569; Lings, K. Renato. “The ‘Lyings’ of a Woman,” Theology & Sexuality, 2015; Joosten, Jan. “A New Interpretation of Leviticus 18:22 (Par. 20:13) and Its Ethical Implications,” The Journal of Theological Studies, 2020, pp. 1-10; Johanna Stiebert, First-Degree Incest and the Hebrew Bible: Sex in the Family, Library of Hebrew Bible/Old Testament Studies 596 [London: Bloomsbury Publishing, 2016], 91, 98–101).

Daniel Boyarin translates Leviticus 18:22 as:

“Do not lie with a man a woman’s lyings"" (miškĕbē ʾiššā)
(Daniel Boyarin, The Talmud - A Personal Take, Mohr Siebeck, 2018, pp. 124).

Once again, the first phrase would seem to be a clear condemnation of same sex relations between men universally, but the author adds the very ambiguous phrase discussed above, adding another element to the prohibition, perhaps unknown to us modern readers. Bruce Wells is a legal specialist (vis-a-vis the OT) and thinks that Leviticus is not condemning sex between men universally"
