,Comments
80,"2.	The Pragmatic Approach to Characterizing Arguments

The pragmatic approach is motivated by the view that the nature of an argument cannot be completely captured in terms of its structure. In contrast to structural definitions of arguments, pragmatic definitions appeal to the function of arguments. Different accounts of the purposes arguments serve generate different pragmatic definitions of arguments. The following pragmatic definition appeals to the use of arguments as tools of rational persuasion (for definitions of argument that make such an appeal, see Johnson 2000, p. 168; Walton 1996, p. 18ff; Hitchcock 2007, p.105ff)

A collection of propositions is an argument if and only if there is a reasoner R who puts forward some of them (the premises) as reasons in support of one of them (the conclusion) in order to rationally persuade an audience of the truth of the conclusion.

One advantage of this definition over the previously given structural one is that it offers an explanation why arguments have the structure they do. In order to rationally persuade an audience of the truth of a proposition, one must offer reasons in support of that proposition. The appeal to rational persuasion is necessary to distinguish arguments from other forms of persuasion such as threats. One question that arises is: What obligations does a reasoner incur by virtue of offering supporting reasons for a conclusion in order to rationally persuade an audience of the conclusion? One might think that such a reasoner should be open to criticisms and obligated to respond to them persuasively (See Johnson 2000 p.144 et al, for development of this idea). By appealing to the aims that arguments serve, pragmatic definitions highlight the acts of presenting an argument in addition to the arguments themselves. The field of argumentation, an interdisciplinary field that includes rhetoric, informal logic, psychology, and cognitive science, highlights acts of presenting arguments and their contexts as topics for investigation that inform our understanding of arguments (see Houtlosser 2001 for discussion of the different perspectives of argument offered by different fields).

For example, the acts of explaining and arguing—in sense highlighted here—have different aims.  Whereas the act of explaining is designed to increase the audience’s comprehension, the act of arguing is aimed at enhancing the acceptability of a standpoint. This difference in aim makes sense of the fact that in presenting an argument the reasoner believes that her standpoint is not yet acceptable to her audience, but in presenting an explanation the reasoner knows or believes that the explanandum is already accepted by her audience (See van Eemeren and Grootendorst 1992, p.29, and Snoeck Henkemans 2001, p.232). These observations about the acts of explaining and arguing motivate the above pragmatic definition of an argument and suggest that arguments and explanations are distinct things. It is generally accepted that the same line of reasoning can function as an explanation in one dialogical context and as an argument in another (see Groarke and Tindale 2004, p. 23ff for an example and discussion). Eemeren van, Grootendorst, and Snoeck Henkemans 2002 delivers a substantive account of how the evaluation of various types of arguments turns on considerations pertaining to the dialogical contexts within which they are presented and discussed.

Note that, since the pragmatic definition appeals to the structure of propositions in characterizing arguments, it inherits the criticisms of structural definitions. In addition, the question arises whether it captures the variety of purposes arguments may serve. It has been urged that arguments can aim at engendering any one of a full range of attitudes towards their conclusions (for example, Pinto 1991). For example, a reasoner can offer premises for a conclusion C in order to get her audience to withhold assent from C, suspect that C is true, believe that is merely possible that C is true, or to be afraid that C is true.

The thought here is that these are alternatives to convincing an audience of the truth of C. A proponent of a pragmatic definition of argument may grant that there are uses of arguments not accounted for by her definition, and propose that the definition is stipulative. But then a case needs to be made why theorizing about arguments from a pragmatic approach should be anchored to such a definition when it does not reflect all legitimate uses of arguments. Another line of criticism of the pragmatic approach is its rejecting that arguments themselves have a function (Goodwin 2007) and arguing that the function of persuasion should be assigned to the dialogical contexts in which arguments take place (Doury 2011)."
81,"3.	Deductive, Inductive, and Conductive Arguments

Arguments are commonly classified as deductive or inductive (for example, Copi, I. and C. Cohen 2005, Sinnott-Armstrong and Fogelin 2010). A deductive argument is an argument that an arguer puts forward as valid. For a valid argument, it is not possible for the premises to be true with the conclusion false. That is, necessarily if the premises are true, then the conclusion is true. Thus we may say that the truth of the premises in a valid argument guarantees that the conclusion is also true. The following is an example of a valid argument: Tom is happy only if the Tigers win, the Tigers lost; therefore, Tom is definitely not happy.

A step-by-step derivation of the conclusion of a valid argument from its premises is called a proof. In the context of a proof, the given premises of an argument may be viewed as initial premises. The propositions produced at the steps leading to the conclusion are called derived premises. Each step in the derivation is justified by a principle of inference. Whether the derived premises are components of a valid argument is a difficult question that is beyond the scope of this article.   

An inductive argument is an argument that an arguer puts forward as inductively strong. In an inductive argument, the premises are intended only to be so strong that, if they were true, then it would be unlikely, although possible, that the conclusion is false. If the truth of the premises makes it unlikely (but not impossible) that the conclusion is false, then we may say that the argument is inductively strong. The following is an example of an inductively strong argument: 97% of the Republicans in town Z voted for McX, Jones is a Republican in town Z; therefore, Jones voted for McX.

In an argument like this, an arguer often will conclude “Jones probably voted for McX” instead of “Jones voted for McX,” because they are signaling with the word “probably” that they intend to present an argument that is inductively strong but not valid.

In order to evaluate an argument it is important to determine whether or not it is deductive or inductive. It is inappropriate to criticize an inductively strong argument for being invalid. Based on the above characterizations, whether an argument is deductive or inductive turns on whether the arguer intends the argument to be valid or merely inductively strong, respectively. Sometimes the presence of certain expressions such as ‘definitely’ and ‘probably’ in the above two arguments indicate the relevant intensions of the arguer. Charity dictates that an invalid argument which is inductively strong be evaluated as an inductive argument unless there is clear evidence to the contrary.

Conductive arguments have been put forward as a third category of arguments (for example, Govier 2010). A conductive argument is an argument whose premises are convergent; the premises count separately in support of the conclusion. If one or more premises were removed from the argument, the degree of support offered by the remaining premises would stay the same. The previously given example of an argument with convergent premises is a conductive argument. The following is another example of a conductive argument. It most likely won’t rain tomorrow. The sky is red tonight. Also, the weather channel reported a 30% chance of rain for tomorrow.

The primary rationale for distinguishing conductive arguments from deductive and inductive ones is as follows. First, the premises of conductive arguments are always convergent, but the premises of deductive and inductive arguments are never convergent. Second, the evaluation of arguments with convergent premises requires not only that each premise be evaluated individually as support for the conclusion, but also the degree to which the premises support the conclusion collectively must be determined. This second consideration mitigates against treating conductive arguments merely as a collection of subarguments, each of which is deductive or inductive. The basic idea is that the support that the convergent premises taken together provide the conclusion must be considered in the evaluation of a conductive argument. With respect to the above conductive argument, the sky is red tonight and the weather channel reported a 30% chance of rain for tomorrow are offered together as (convergent) reasons for It most likely won’t rain tomorrow. Perhaps, collectively, but not individually, these reasons would persuade an addressee that it most likely won’t rain tomorrow.

4.	Conclusion

A group of propositions constitutes an argument only if some are offered as reasons for one of them. Two approaches to identifying the definitive characteristics of arguments are the structural and pragmatic approaches. On both approaches, whether an act of offering reasons for a proposition P yields an argument depends on what the reasoner believes regarding both the truth of the reasons and the relationship between the reasons and P. A typical use of an argument is to rationally persuade its audience of the truth of the conclusion. To be effective in realizing this aim, the reasoner must think that there is real potential in the relevant context for her audience to be rationally persuaded of the conclusion by means of the offered premises. What, exactly, this presupposes about the audience depends on what the argument is and the context in which it is given. An argument may be classified as deductive, inductive, or conductive. Its classification into one of these categories is a prerequisite for its proper evaluation."
82,"I’m not going to read a single thing you typed.

Anyways dude. I’m down replying to you now.

You are utterly pathetic and I’m 100% sure you autistic."
83,"Lmao you’re not? Why won’t you just read my massive irrelevant wall of text that proves nothing? What so you’re the only one who’s allowed to post ridiculous fucking gish gallups because your entire foundation is based on cherry picking scholars with totally illogical arguments you don’t have the ability to even begin to know how to critique? 

Also on your way out, something to consider. I sure hope none of those scholars are Christian’s because that would mean \*gasp\* they’re thinking like Christians?!"
