,Comments
0,"Thank you for posting. Please review the rules. Here are a couple of gentle reminders:

1. Posts should be about people taking religion to absurd, crazy, stupid, and terrible extremes.

2.  Please don't submit   incendiary  posts or comments that could incite harassment and brigading.

 

*I am a bot, and this action was performed automatically. Please [contact the moderators of this subreddit](/message/compose/?to=/r/religiousfruitcake) if you have any questions or concerns.*"
1,"So not ""gawd, mah car!""?"
2,It stands for (good-er made chevy) thank you
3,Low key love that tbh 🤣
4,Godawful Mess Co.
5,I thought it was generally malfunctions completely. We were both wrong.
6,Funny thing is I would sooner put gooder made chevy on my own 2020 gmc than that abomination of a sticker. While I'm at it I'll slap d.i.l.l.i.g.a.f. on the back window for good measure
