,Comments
0,"Thank you for posting. Please review the rules. Here are a couple of gentle reminders:

1. Posts should be about people taking religion to absurd, crazy, stupid, and terrible extremes.

2.  Please don't submit   incendiary  posts or comments that could incite harassment and brigading.

 

*I am a bot, and this action was performed automatically. Please [contact the moderators of this subreddit](/message/compose/?to=/r/religiousfruitcake) if you have any questions or concerns.*"
1,And who decided he should be born to a teen mom?
2,"A teen mom that was raped into pregnancy, force married to a middle aged man, and forced to give birth as a child. Great loving beginnings"
3,So... Jesus should have been aborted?
4,I see they’re just sailing over the whole ‘immaculate conception’ aspect there
5,I got an advert from the same organisation - right before a Darkmatter2525 cartoon...
6,So she fucked someone and used the excuse of God did it... God damn talk about ahit getting out of hand
7,She was also a minor
8,"You know if Jesus was born in the Patrician class in Rome, it would had been faster and more efficient way of starting Christianity."
9,So...was it Yahweh or Joseph who committed statutory rape?
10,"god snapped his fingers. Virgin got pregnant.

I dint why he didn't just choose a healthy normal age woman to snap his kid into her."
11,And supposedly born with the plan to murder him later.
12,"No, I think they're using that fact to justify teen pregnancies"
13,"Suicide by cop. At least in their book. 
Im sure the real capture was more forceful"
