,Comments
0,"Thank you for posting. Please review the rules. Here are a couple of gentle reminders:

1. Posts should be about people taking religion to absurd, crazy, stupid, and terrible extremes.

2.  Please don't submit   incendiary  posts or comments that could incite harassment and brigading.

 

*I am a bot, and this action was performed automatically. Please [contact the moderators of this subreddit](/message/compose/?to=/r/religiousfruitcake) if you have any questions or concerns.*"
1,"Funny, Christianity would have you killed for not being the right color or orientation. I wish people would go Old Testament on this guy."
2,Other people create a culture of death…. Says person with a gun loaded profile pic.
3,The chillest religious people I've ever seen are pagans.
4,"Pagans... do you know any pagans? I dont know any pagans. What year is this again?

Not saying they dont exist, just jabbing at the 14th century talking point."
5,"I've met quite a few. My best friend is a pagan and I followed them to a few pagan groups to observe and learn out of curiosity. I wouldn't really mind a pagan run government if I absolutely HAD to have some kind of religion in my government. Pagans tend to care about the environment, tend to be pro-LGBT+, tend to refrain from forcing their beliefs on others, tend to be pro-human rights, etc. Almost polar opposites from how the Abrahamic religions tend to behave."
6,[They probably are referring to Neopagans.](https://www.britannica.com/topic/Neo-Paganism)
