,Comments
0,"Thank you for posting. Please review the rules. Here are a couple of gentle reminders:

1. Posts should be about people taking religion to absurd, crazy, stupid, and terrible extremes.

2.  Please don't submit   incendiary  posts or comments that could incite harassment and brigading.

 

*I am a bot, and this action was performed automatically. Please [contact the moderators of this subreddit](/message/compose/?to=/r/religiousfruitcake) if you have any questions or concerns.*"
1,*looks around* Hey all the real christians are gone! It did happen.
2,"Oh, two people who really REALLY want something to be true had dreams about the thing they obsess over? Well, it must be true.

Also, I'm dating Scarlett Johansson. Because same reasoning."
3,At what point does a daydream become a vision? Asking for a friend who's worried it might actually start raining cats and dogs.
4,I had a dream about Mighty Mouse coming to visit me.  Mighty Mouse is 100% real!
5,"When I was 9 I had a dream about the rapture too. God was my parent's landlord and we all sat around him and he told us we didn't make it this time but to try out next time. Then we had to get in line in order to be killed for Jesus and a large octopus like demon spanked me on the way into the building. 

Definitely got to be real lol."
6,"sounds like they're hallucinating, they should check for a carbon monoxide leak in their house"
7,"#GET ON WITH IT AND GET THE FUCK OUT OF HERE THEN, JESUS FUCKING CHRIST"
8,"If it hasn't happened yet, how is it real?

Someone tell them what real means"
9,Buh Bye
10,I always respond telling them about the vision I had where they gave me X amount of money. They go crazy
11,Thats cool I just hope that they give us a date and that they put their property up for sale (free). They won't need them anyways but I'm gonna need that land. Might as well toss in their cars and shit.
12,"I dreamed I could suck my own dick. Tried. 

&#x200B;

Nope."
13,"I had a dream about the Flying Spaghetti Monster taking me to Pastafarian Heaven with a beer volcano and a stripper factory. The FSM is real!!!

rAmen!"
14,Lol
15,"In my vision my dog was playing GTA, totally real."
16,Lol I had a dream I won the lottery! Fuck this job bitchesssssss!!!!
17,"What if already happened, but the amount of people that disappear was really small compared to 8.000.000.000 🤔"
18,"If I could telepathically speak to every christian on earth, I would tell them all that I was god and that they needed to commit suicide to enter heaven. It's called natural selection."
19,I had a dream of an alternative ending to Avengers: Endgame. That must mean that the Avengers are real people!
20,"I'd like to think the dream wasn't even about the rapture, she just had a dream about like, talking marbles or something"
21,"I dreamed I got married to Belldandy, and...yeah."
22,"If that ain't solid proof, I don't know what is! /s"
23,"OMG, you had a dream!  It is 100% real then."
24,"No gods or kings, only mab"
25,i had a dream elon musk dyed his hair blond and joined BTS so it must be real
26,I have a dream where I was hanging out with Frodo at Bag End. The Lord of the Rings is real.
27,"Funny. I had dreams about pagan deities some time ago. Therefore, they are real."
28,My daughter had a realistic dream that a human-sized red M & M went on a murdering spree in our neighborhood. I guess I'll have to be careful.
29,"Yea, I had a dream last night about saving my school from terrorists, that doesn’t mean it’s going to happen"
30,This is giving the same energy as the girls who have a dream their partner cheated and they get legitimately mad at them
31,We love fearmongers doing this type of shit 😩🤌
32,I wonder if the ladder will be actually gold and not a cheap harbour freight ladder.
33,I read about the rapture in some book once. It Must be real!
34,Apparently the difference between a having a delusion and no longer having a delusion is how many other people the deluded person can convince to believe in the delusion.
35,There is nothing more I wish was true than the rapture. Because then these people will be just fucking gone already. And I've got dibs on their kitties and chickens.
36,"TIL:

# ALL DREAMS ARE 100% REAL!"
37,"I had a dream about a mountain sized squid attacking my city, i guess that’s happening then"
38,"I had a dream once that I had wings and could fly, does that mean I’m going to be an angel?"
39,I had two dreams and two visions that the poster up there is full of equine excrement.  Thus: It is So.
40,Good on them for having the restraint to not say it’s happening soon.
41,"I used to have nightmares about the rapture as a child. Like. A lot. It terrified me because I was always scared I wasn’t good enough and would get left behind (some wordplay there for anyone else who grew up with that bullshit series). And to make matters worse, anytime
I woke up or came home and was alone in my house I would get this crippling feeling that it had happened and I had missed it. I would have these internal panic attacks as I would try to calmly find someone around me."
42,"This is what a ancient historians did. Except when they did it, it was based af"
43,Too much drugs in that marriage
44,Yay now we have a more Christlike earth without them.
45,"No, since two people have to have the dream to make it real, *we're* dating Scarlet Johansson"
46,The reason that there is no way I can believe this dream nonsense is because it happens to me all the time. Something would be on my mind for the last day or three and surprise! I get a dream about it.
47,It really depends on who you ask. Joseph Smith got his dream/vision while looking in a hat and started the Mormon church.
48,"Nope, only if your wife dreamed about Mighty Mouse, also. Sorry bro, it’s science."
49,"Just think of all the private jets and mansions this frees up!  Also, the Ark Encounter should make a pretty sweet indoor minigolf course..."
50,I’ll have my own heaven with blackjack and hookers.
51,"Make sure they use the tidiest method possoble, otherwise the cleanup will take years..."
52,"Bill... I had a dream, a horrible, demonic dream. Oh Bill, Bill... It was so awful, I- th-th-the marbles, Bill, Oh God, the marbles, they were *talking*!"
53,"What if you and I disappear and they're left with our kitties and chickens?! My kitties and chickens, Jacks_Flaps! Your kitties and chickens!"
54,"No, you possess an ancient genetic abnormality that mutates your DNA and enhances your fighting skills while giving you supernatural powers that cannot be understood by those who are living at the moment. You possess what is known as The Devil Gene."
55,Ooh. I take it you've not read revelations and the dystopian shit how a christlike earth is. Noooo. I'd rather tap out.
56,Must be true.
57,"Um, I was planning on moving in to the Ark. You're welcome to set up the putt putt golf course on any of the lawns, as I don't do lawns. I'll even give you all the fake animals inside the ark so you can use them as obstacles."
58,"My God, Margaret, do you know what this means! The rapture will be coming any day now!"
59,Oh no. Hell would freeze over before I'm raptured. I go out of my way to guarantee that.
60,Na but I've read Harry Potter and in the Deathly Hallows it sounds like a bitch but even still I think I'd rather be here if the standard printed Christian is gone for good.
