,Comments
0,"Thank you for posting. Please review the rules. Here are a couple of gentle reminders:

1. Posts should be about people taking religion to absurd, crazy, stupid, and terrible extremes.

2.  Please don't submit   incendiary  posts or comments that could incite harassment and brigading.

 

*I am a bot, and this action was performed automatically. Please [contact the moderators of this subreddit](/message/compose/?to=/r/religiousfruitcake) if you have any questions or concerns.*"
1,hinduism has solution of every problem 😏 /s
2,Wtf am I supposed to be reading
3,Just Hindus being Hindus
4,"For some reason ""Dirty Deeds"" from ACDC is playing on my  head."
5,"My friend lost his eye sight and became blind , give it back

![gif](giphy|3oz8xArnNn1AAEh9IY)"
6,"Basically saying I will solve all your problems through prayers and worship, in a nutshell."
7,"![gif](giphy|3o7aCVYdxJUQmWI0z6)

Lol"
