,Comments
0,"Thank you for posting. Please review the rules. Here are a couple of gentle reminders:

1. Posts should be about people taking religion to absurd, crazy, stupid, and terrible extremes.

2.  Please don't submit   incendiary  posts or comments that could incite harassment and brigading.

 

*I am a bot, and this action was performed automatically. Please [contact the moderators of this subreddit](/message/compose/?to=/r/religiousfruitcake) if you have any questions or concerns.*"
1,"To be fair, it was that or getting stoned to death or something."
2,prank gone wrong \*gone sexual\*
3,"Cheating is not a prank, Mary! For Gods sake!"
4,Cameraman the most powerful beings
5,"There's a hidden camera there
There's a hidden camera there
There's a hidden camera there
There's a hidden camera there"
6,[This skit](https://www.reddit.com/r/religiousfruitcake/comments/v638ge/freshly_baked_fruit_cake_pie/?utm_source=share&utm_medium=ios_app&utm_name=iossmf) is what i think about whenever the immaculate conception is mentioned these days.
7,Man I miss the YouTube dislike button
8,"Lucky for her there were no DNA test, God be flying away smiling as the host says ""YOU'RE NOT THE FATHER!"""
9,"What about the *God-sponsored magical abortion potions* that automatically kill the fetus if it’s not the husband’s? (Numbers 5:11-31)

> “The priest is then to take a handful of the grain offering as a memorial[c] offering(T) and burn it on the altar; after that, he is to have the woman drink the water. 27 If she has made herself impure and been unfaithful to her husband, this will be the result: When she is made to drink the water that brings a curse and causes bitter suffering, it will enter her, her abdomen will swell and her womb will miscarry, and she will become a curse.(U) 28 If, however, the woman has not made herself impure, but is clean, she will be cleared of guilt and will be able to have children.”"
