,Comments
0,"Thank you for posting. Please review the rules. Here are a couple of gentle reminders:

1. Posts should be about people taking religion to absurd, crazy, stupid, and terrible extremes.

2.  Please don't submit   incendiary  posts or comments that could incite harassment and brigading.

 

*I am a bot, and this action was performed automatically. Please [contact the moderators of this subreddit](/message/compose/?to=/r/religiousfruitcake) if you have any questions or concerns.*"
1,Let me guess: Source is their own bias.
2,"Well, ""christian liberty"" is boring as fuck."
3,"It actually falls under ""mind your fucking business""..."
4,How about Christians mind their own f***ing business.
5,"Yes, it's gross.  That's an extreme example. People don't need to bury themselves in cloth though."
6,"Ah yes, who can forget that famous bible quote ""thou shalt not wear g-strings."""
7,It falls under “liberty”
8,Who cares about your christianess
9,Christian liberty is an oxymoron. Christianity even opposes free speech.
10,Sorry i cant help it if im hot and cool and i want to wear a thong :/
11,What if you wear it on your head?
12,"Visit churches and temples in Hawaii, and go to the beach. The nuns have a beach house in Lanikai."
13,"my indecent exposure up yours, you sleepy theo-conservatives."
14,"I mean, we're all free to not look at the g-string wearer, too..."
15,Source: me and my own beliefs
