,Comments
0,its almost as if the racist had white power tattoos all over his torso in a shirtless sport
1,Didn’t want to give nikolov a platform whereas Tate already has one
2,"Dazn dropped him, not JJ."
3,Found the Tate fanboy
4,It's over man. Let the fucking shit die.
5,"Cant knock the racism out of a racist. However, you can knock the “top G” out of an Andrew Tate. 

If tate loses, he loses all credibility. If nikilov loses, he stays a racist."
6,Because nazis are different?
7,"I mean one of them doesn't respect women, the other wants to murder everyone who he doesn't find pure enough..."
8,Tell me you're brain-dead without telling me you're brain-dead
9,even if he beats the shit out of the racist guy but in the end the racist guy will end up with a bag way bigger than his racist  ass will ever see so in a way you are helping him. massive L take from you brother
10,There’s a pretty wide difference when it comes to possible outcomes. If Tate wins his fanboys arent going to change but if he loses? His entire image is macho man who could beat anyone. He refers to himself as a “Top G”. He would lose followers. With the Nazi he doesn’t have a following and if he wins it feeds his ideology if he loses it probably also feeds his ideology. Tate is a shit person and as a woman he absolutely disgusts me. I’d rather JJ fight someone else but it is very different.
11,Aww shut up man no one gives a fuck
12,These feminists man😂 do you even know what toxic masculinity stands for😭
13,"1) People know who Tate is and he has a platform he has a following which means he can sell fights 
2) Nobody knew who tf was Nikolov we just knew he was a journeyman and when he got selected they did a bit more digging on him and found out he was a racist neo nazi so that’s why the fight got cancelled being a racist neo nazi is worse than being Tate imo they are both so bad but Tate is a bit less bad"
14,that was dazn not jj
15,cause ivan would have brought a whip
16,"MFer don't know that DAZN dropped him of done legal troubles, not JJ"
17,Jj riders being afraid that TATE would absolutely whoop ksi’s ass.
18,People were complaining
19,"JJ cancelled the fight cause he didn't wanna give a platform to the guy, even in his reddit video he skipped multiple posts of the guy just so he doesn't gain publicity. 

What there is no Bad Publicity"
20,Isn't it meant to be the other way around?
21,I think you're forgetting ivan will get paid if jj fights him
22,Go cry to your mama
23,"The original line was that she draws the line at animal cruelty, she's a vegan"
24,How is JJ meant to know that pineda was shit and Ivan would ve gotten money and attention so why would you provide him that??
25,JJ is fighting Tate because he was talking shit not because he's sexist.
26,He doesn't want to give him a platform I guess
27,Also there's probably a safety aspect involved in that as well. I could be wrong and I know its boxing. Where being physical and getting hurt is part of the sport. But the Ivan guy would have probably tried to do everything he could get away with to severely injure JJ.
28,i mean he had no choice dazn would not allow it to happen
29,"People are soft, Tate is expressing his own views and opinions, and if you cant handle it, stay off the internet, it's full of pricks"
30,When you don’t do your research before posting. Lmao 😂. Jj didn’t choose to not fight him. Nice post
31,"by giving the white supremacist a platform, fame and a shitload of money. That isn't a good idea."
32,It'd all be fun and games until Ivan walked out to the ring with a weapon
33,"Ivan gonna end up like Swarmz and Pineda anyways, there’s levels to boxing. They thought these journey men are a risk to KSI, so they didn’t risk it to giving him a platform for beating KSI"
34,"do i hear NELSON MANDELA successor

sorry i have fucked his name"
35,Well said
36,Not anymore lol
37,true fr
38,"U say that as if jj would have fought him otherwise, hell no, he wouldn’t want to give that racist shit the platform or the money to spread his ideology, who cares about the fight, at least he wasn’t giving a white supremacist the biggest pay day of his life."
39,"I'm not a Tate fanboy, I'm a casual JJ youtube viewer.plus who in their sane mind thinks JJ's 2 fights in one night was not pathetic. His opponents were pathetic, and the Pineda kid's acting throwing the game was just bad.  


plus if you had any bit of comprehension, you would have understood that i was implying that JJ picking Tate as his next opponent is pathetic, even Logan knows JJ shouldn't give Tate any more platform"
40,"He'll just make up a shitty excuse on why he should've won or whatever. His fans are all young impressionably teen boys who take his word for gospel, they're not gonna have their mind changed. You shouldn't give freaks like him attention."
41,It's Crazy how that Tate fans say Tate destroys ksi but don't mention how Tate has still a week later not responded to JJs multiple call outs to fight him let's talk about that 🤔
42,This coming from a tate dick rider.
43,"You’re literally white yourself though, stop being a hypocrite"
44,"He still has a platform from the people who repost his clips

He never had a YouTube channel to begin with"
45,You’re literally white yourself. Stop being a hypocrite
46,🤡
47,🤓
48,Well Logan is stupid too so idk what your point is
49,🤣 type ‘andrew tate ksi’ on youtube. You’ll get everything you’re asking for.
50,"Ksi dick eating is craazy my bratha. If he ever steps in the ring with either Tommy, Tate, Fury , I’ll respect him. Until then, he’s just a delusional brainwasher imo."
51,"Tf u on about? Just cuz im white it doesnt make me a white supremacist nor do I agree with anything that idiot stands for. I don't care about what race he is, if he's racist, he's racist. Fuck him."
52,?..???
53,There’s nothing there bruh the only video coming up is the one from before KSI called him out
54,Why are you even here lol you don’t like JJ and love Tate so why do you join or go out of your way to click his reddit must love JJ lol.
55,"I think some ppl cant even type complete sentences on the internet. Here you go son, watch this : https://youtu.be/u6rFIVus98E"
56,"Ahhh…here come the ‘why are you here’ comments.

I m just a normal man trying to save some of you guys from this brainwash ksi has got you ppl in."
57,yeah dumbass this was before KSI called him out
58,And you believe Tate shit that says more about you than me lol
59,And he also called him out on his recent emergency podcasts.
60,Still called him out u cunt.
