,Comments
0,"Thank you for posting. Please review the rules. Here are a couple of gentle reminders:

1. Posts should be about people taking religion to absurd, crazy, stupid, and terrible extremes.

2.  Please don't submit   incendiary  posts or comments that could incite harassment and brigading.

 

*I am a bot, and this action was performed automatically. Please [contact the moderators of this subreddit](/message/compose/?to=/r/religiousfruitcake) if you have any questions or concerns.*"
1,"""Ministry of Culture and Islamic Guidance"" is like saying ""I am smart and I like running barefooted on broken glass"""
2,TIL it's indecent for women to eat ice cream in public.
3,[Wouldn't it be ok if the woman fell through the floor due to an Earthquake and the ice cream bar accidentally landed in her mouth? Surely that is halal.](https://www.reddit.com/r/exmuslim/comments/wg3rui/islamic_scholars_spend_all_their_time_thinking/)
4,"They’re so repressed that the simple act of watching a woman bite ice cream makes them
horny, hence indecent and haram"
5,"Transalation:

The insecurity of us muslim men is so chronic that the only thing which eases our personailty flaws is subjugating women... so we did this.

&#x200B;

They really are pathetic people."
6,Get your mind out of the gutter creep
7,I guess it was a good thing it wasn't a banana.
8,"Is it just ice cream or eating anything? It must be horrible to have been born as a woman into this patriarchal theocracy. Of all the possible tangents for human culture, these guys ended up in an iron age intellectual dead end."
9,Fuck is she supposed to do ... snort it?
10,"But she looked REALLY PRETTY while eating that ice cream. And confident. And independent.

We can't have any of that."
11,how dare they eat food that tastes good. How do they sleep at night knowing they could eat delicious food any time if they didnt live in a reliofacist state
12,"Translation:   ""My willy perked up when I saw this very beautiful woman eating ice cream so I'm gonna make it everyone's problem"""
13,"The word you're looking for is ""haram""."
14,"Oh, please, women have no value in Iran or they wouldn’t treat them like cattle."
15,Sick people
16,It happened months go. They banned it due to lack of 'proper hijab' not the eating ice cream part. Iran has a very strict Hijab rules for media.
17,"I’d ban them too, who in the fuck bites ice cream?"
18,I dont even know how they havent killed each others off the planet yet.
19,"I mean it is disgusting though. The idea of women...eating...with their...*mouths*


Will somebody please think of the children????"
20,"I knew it! Eating icecream is against public decency. Women, I tell you."
21,"Ladies, is it slutty to eat?"
22,"Guess what I'm eating! Ice cream!

Guess what I'm eating! Accciidd!

(I'm going to hell)"
23,"I suppose if you squint hard enough, she appears to be chomping down on a big brown dick…"
24,My values involve eating ice cream
25,"New flash 

“Woman have just been banned altogether from Iranian life and are required to stay in a closet and are only allowed to come out to cook, clean or have sex with their 40 years older husbands”"
26,"Woman: *MONCH*

These absolute clowns: BAN IT"
27,They were right for the wrong reasons. Biting ice cream should be illegal.
28,"Iranian officials ruled that the advertisement went ""against public decency"" and was an ""insult"" to ""women's values.""

Lol, yeah...they ""care"" about ""women's values."" My ass.

Iranian women at risk as execution numbers rise:  
[https://www.france24.com/en/live-news/20211215-iranian-women-at-risk-as-execution-numbers-rise](https://www.france24.com/en/live-news/20211215-iranian-women-at-risk-as-execution-numbers-rise)

Iran: Ex-child bride among three women executed in one day - report:  
[https://www.bbc.com/news/world-middle-east-62342689](https://www.bbc.com/news/world-middle-east-62342689)"
29,Kinda deserves it for BITING ICE CREAM/J
30,Oh it would be a shame if a Roman legion popped in to Persia ( it will always be that for me ) to remind them of what happens to uncivilised people when civilization comes a knocking.
31,What's halal ice cream does it taste good?
32,"TIL it's indecent for women to ~~eat ice cream~~ exist in ~~public~~ Iran.

FTFY"
33,"Ok so now we now where the ""embarassing fall of character A on another character B"" in anime comes from"
34,"“A religious decree by Khomeini ordered that girl prisoners who are virgins must be raped before execution, to prevent them from entering heaven.”

Imagine believing that god is powerful enough to create life and the universe, but somehow you’re so arrogant that you believe you can stop someone going to heaven by simply committing some act the person doesn’t even consent to. 

I can’t comprehend how someone can believe in an immortal being who is all knowing and somehow believe that they’re smart enough to find a loophole. That level of arrogance just bewilders me."
35,These people seemed to be able to come up with a more creative plot for porn than what's available out there. I would know because I have done...... research.
36,The moral of the story: sexual repression is bad.
37,Religion does that
38,"It's a damn ice cream bar, kinda need to penetrate that chocolate, you some weirdo who licked a chocolate covered ice cream bar? lol"
39,"Well, when you're in a hot day, and want a quick cold fixer asap? I don't know. 🤷🏽"
40,They're working on it.  Have been for most of my life.
41,"Acid? Like… oh God, those stories about jealous husbands in Pakistan drenching their wives in acid… something is very, *very* wrong with that country."
42,"And people then act offended when you are not comfortable with their ""beliefs"""
43,"Great, now I'm afraid of what kind of rule 34 ex-Muslims might come up with."
44,Insecurity and narcissism do that.
45,"Yeah exactly, different country but I thought of the meme and then I thought of crimes."
