,Comments
0,"Thank you for posting. Please review the rules. Here are a couple of gentle reminders:

1. Posts should be about people taking religion to absurd, crazy, stupid, and terrible extremes.

2.  Please don't submit   incendiary  posts or comments that could incite harassment and brigading.

 

*I am a bot, and this action was performed automatically. Please [contact the moderators of this subreddit](/message/compose/?to=/r/religiousfruitcake) if you have any questions or concerns.*"
1,O dark lord Satan shall defeat your God = 351
2,Cocaine is a helluva drug = 351
3,"That is the Latin alphabet, those are indo-arabic numerals."
4,Could people that have no experience with Jewish mysticism stay the hell away from Gematria?!
5,"Soooooo

Hebrew is gods language 



Soooo yeaaaaa"
6,Wow! What else can you spell with 351?
7,PENIS PENIS PENIS PENIS PENIS t (Assuming this is based on Unicode) = 351.
8,[See for yourself](https://www.gematrix.org/)
