,Comments
0,"Thank you for posting. Please review the rules. Here are a couple of gentle reminders:

1. Posts should be about people taking religion to absurd, crazy, stupid, and terrible extremes.

2.  Please don't submit   incendiary  posts or comments that could incite harassment and brigading.

 

*I am a bot, and this action was performed automatically. Please [contact the moderators of this subreddit](/message/compose/?to=/r/religiousfruitcake) if you have any questions or concerns.*"
1,"Stupid, horrible scum."
2,"Supporting terrorism, another one on the watchlist"
3,iSlAm Is ThE rElIgIoN oF pEaCe
4,Psycho
5,People like that deserve to go through rehab to get rid of Islam addiction.
6,"Remember when Sam Harris was accused of ""Islamophobia"" when he pointed out how many peaceful, nonviolent Muslims nevertheless hold atrocious views about humanity?

Pepperidge Farm remembers."
7,"Sir Salman Rushdi seems to be doing better, he was taken off the ventilator, is stable, and is talking."
8,"Islam is a religion of peace. And if you don't agree with me, I'm going to cut your throat. /s"
9,"They tried to silence him, but he fought it through."
