,Comments
0,"Thank you for posting. Please review the rules. Here are a couple of gentle reminders:

1. Posts should be about people taking religion to absurd, crazy, stupid, and terrible extremes.

2.  Please don't submit   incendiary  posts or comments that could incite harassment and brigading.

 

*I am a bot, and this action was performed automatically. Please [contact the moderators of this subreddit](/message/compose/?to=/r/religiousfruitcake) if you have any questions or concerns.*"
1,Time to reconstruct the SCOTUS
2,Does this mean that she has to do as the male Justices tell her? She's not allowed to dissent from a Gorsuch ruling?
3,"Ooh, not a good look"
4,it doesnt sound so uncommon.  Just 50 years outdated
5,I now realize there's no point in thinking whether this ghoulish person is a Stepford Wife is sexist or not because she's somehow even worse
