,Comments
0,"Thank you for posting. Please review the rules. Here are a couple of gentle reminders:

1. Posts should be about people taking religion to absurd, crazy, stupid, and terrible extremes.

2.  Please don't submit   incendiary  posts or comments that could incite harassment and brigading.

 

*I am a bot, and this action was performed automatically. Please [contact the moderators of this subreddit](/message/compose/?to=/r/religiousfruitcake) if you have any questions or concerns.*"
1,What a completely unconvincing argument.
2,All religions are trash.
3,"![gif](giphy|l36kU80xPf0ojG0Erg|downsized)

Christianity is just 1/3 slice of the abrahamic fruitcake"
4,These people talking shit about Islam when they're literally worshipping the same God.
5,"What in the fuck is he talking about lol…God obeying us if we obey Him? How exactly does that work out? “You Jesus I obeyed you and didn’t have the sex until marriage now give me all the nice things,” and then Jesus gave that man his Lambo just as he was instructed."
6,"Not only is this baseless, I'm fairly sure counts as heresy to most Christian doctrine."
7,"> The more you support God, the more He will support you.

In that case, I have two dead relatives and a third ailing one - all devout for decades, one beyond the point where it made sense - that would like to lodge formal conplaints, please."
8,Well if god chooses to obey me I might consider obeying it.
9,"""Do the things I tell you or I'll burn you forever"" is not anyone obeying anyone"
10,Ahh so close
11,Exactly all of them are BS
