,Comments
0,"Thank you for posting. Please review the rules. Here are a couple of gentle reminders:

1. Posts should be about people taking religion to absurd, crazy, stupid, and terrible extremes.

2.  Please don't submit   incendiary  posts or comments that could incite harassment and brigading.

 

*I am a bot, and this action was performed automatically. Please [contact the moderators of this subreddit](/message/compose/?to=/r/religiousfruitcake) if you have any questions or concerns.*"
1,"They're not wrong, though. Slavery is, in fact, endorsed by god."
2,"Can you imagine a species as evolved as ours can come up with bullshit as dumb as this? 

Like we are literally on top of the animal kingdom, but we still wanna enslave ourselves to some apparently higher power. 

Can you imagine a fucking mouse setting up a trap for itself, and THEN willingly getting trapped?

These people are fucking dumber than mice?"
3,The worst part is the emojis.
4,Ridiculous
5,🙂
6,"When the Bible literally tells you what type of slaves you can take for your own, how you can treat them, where you can buy them from, what you can do to punish them, and how you can psychologically manipulate them into remaining a slave, you have a book not only endorsing slavery, but a book that sets up the idea that nothing in it is remotely moral."
7,🤮🤮🤮
8,"Actually it’s it depends what you mean by slavery.  It does endorse involuntary servitude, but not what I would call slavery.  I would call it indentured servitude."
9,"Also, not just to God. It lays out the way jews are supposed to aquire and keep slaves. Then in the new testament it pretty much tells slaves to suck it up because rebellion... is bad."
10,"Well, at least they acknowledge it"
11,"Correct, and thanks for the lower case g."
12,I’ve always heard that. Can you tell me more?
13,Depends what you mean by slavery.  It’s very different from chattel slavery.
14,">Slavery is, in fact, endorsed by god.

Also by George Washington"
15,I think Orcas have become the top of the animal kingdom. Idiocracy has rendered them far more intelligent than the average human.
16,"How dumb we humans are is arguably proof that a God didn’t create us humans to be the perfect species. We’re way too dumb to be an omnipotent, omniscient God’s ideal creation."
17,"Yes, it makes the comment feel like the person actually has slaves"
18,"I mean, fictional characters get capital letters."
19,"God gives his prophets laws on hpw to ""properly"" practice slavery. It was also never condemned or punished by god."
20,"There were rules for both in Leviticus, but I'd have to go look for specific verses."
21,"They don't have.

yet

**TRUMP 2024**

&#x200B;

&#x200B;

( /s .... Hopefully)"
22,Thank you!
23,Where it could be inherited?
24,"Do you mean the slave being inherited? Yeah, that occurred, and there were laws for it should happen"
25,TIL
