,Comments
0,"Thank you for posting. Please review the rules. Here are a couple of gentle reminders:

1. Posts should be about people taking religion to absurd, crazy, stupid, and terrible extremes.

2.  Please don't submit   incendiary  posts or comments that could incite harassment and brigading.

 

*I am a bot, and this action was performed automatically. Please [contact the moderators of this subreddit](/message/compose/?to=/r/religiousfruitcake) if you have any questions or concerns.*"
1,"If their god has rejected me, I can finally say: ONE MORE GOD REJECTED!"
2,Is there another deity that can adopt me since I'm up for grabs?
3,That is Olympic Gold Level mental gymnastics.
4,How can god reject me when the dude created me.
5,For a second I thought I could click on the three dots and report the ad but then I realized I was on Reddit and tis’ nothing but a picture.
6,This couple makes the best ads
7,Does this mean I can finally follow Khorne and/or Slaanesh?
8,Welp it looks like there mother ship is about to leave. I hope they all board soon.
9,"Ok then, time to move on."
10,"> God has departed

Hope the door hit you on the way out, ya mook.

> Starbase LIVE

Now this on the other hand I love."
11,"Damn, wish some of the big religions actually pulled this. Actually, no, that would cause the end of the world because too many religious people have nukes."
12,Ugh finally lol
13,Neptune is your god now.
14,Pretty sure Cthulhu and FSM would be more than happy to take you in.
15,Parental disownment.
16,Bro nurgle is the way to go
17,Glad to see another tank watcher!
18,I'll run a contest for bid like the Amazon HQ hahah
19,but that means I'd get every conceivable disease ;-;
