,Comments
0,"
##If this submission makes you go ""Hol'Up"", **UPVOTE** this comment!

##If this submission does not make you go ""Hol'Up"", **DOWNVOTE** this comment!

---

Whilst you're here, /u/GreenLeaf69-, why not join our [public discord server](https://discord.gg/holup) or play on our [public Minecraft server](https://discord.gg/DTqSDS8C3T)?"
1,Lmfao the friction would just thaw the spot you’re grinding. People are scarily creative but luckily this is how killers get caught so... go for it?
2,"If you have that big of a freezer, you have better ways to dispose of a body...."
3,freeze drying removes all the water weight
4,Why not just throw it in a volcano?
5,A strong acid or lye will do the same trick without the need for an enormous amount of manual labor.
6,People in this thread some unsually specific opinions on this topic lol
7,"Behold, that one sandpaper treadmill a guy in youtube made and then used to vaporize half a guitar"
8,The best solution for most problems.
9,Thanks Jeff
