,Comments
0,"
##If this submission makes you go ""Hol'Up"", **UPVOTE** this comment!

##If this submission does not make you go ""Hol'Up"", **DOWNVOTE** this comment!

---

Whilst you're here, /u/NewWolfer13579, why not join our [public discord server](https://discord.gg/holup) or play on our [public Minecraft server](https://discord.gg/DTqSDS8C3T)?"
1,You want to know? *sexy stare
2,don’t give hornpub any ideas
3,Ayo this ain’t sweet home Alabama mabel
4,When just twincest isn't enough.
5,"My first thought when I saw that was: ""bruh that's his own sister, they're from California not Alabama!"""
6,Guys it confirmed! Gravity falls is in Alabama!
7,wtf is that an episode
8,"Don't tell me twincest actually exists

please tell me it doesn't..."
9,"Alabama is where the heart is, it's a home not a place
Japan knows a thing or two about that"
10,"Of course it doesn’t 😉

Just like /r/wincest isn’t a thing. And even I’m not going down that rabbit hole"
