,Comments
0,"
##If this submission makes you go ""Hol'Up"", **UPVOTE** this comment!

##If this submission does not make you go ""Hol'Up"", **DOWNVOTE** this comment!

---

Whilst you're here, /u/NourEldin21P, why not join our [public discord server](https://discord.gg/holup) or play on our [public Minecraft server](https://discord.gg/DTqSDS8C3T)?"
1,"I see nothing wrong with this, I have an Associates degree in gunsmithing and firearm technology so this was part of my school shopping lol"
2,"Not a bad selection, anyone know which LGS this is?"
3,Bit late for school shooting
4,I see nothing wrong here.
5,Bullshit. That's the school section.
6,Back to school shopping
