,Comments
0,"
##If this submission makes you go ""Hol'Up"", **UPVOTE** this comment!

##If this submission does not make you go ""Hol'Up"", **DOWNVOTE** this comment!

---

Whilst you're here, /u/Epstiendidntkillself, why not join our [public discord server](https://discord.gg/holup) or play on our [public Minecraft server](https://discord.gg/DTqSDS8C3T)?"
1,You fill them with Jell-O shots
2,"Well... Once I saw some of these filled with fruit jelly or colorful juice. Without the needles, of course. I think it was in some menhera/yami kawaii context, which are ""morbidly cute""."
3,Poor kids super soaker.
4,"Saw them yesterday in Dollarama here in Canada. Did a double take, as well."
5,Diabetes
6,"Yes, they are real."
7,What a scam. How am I supposed to get high off of opiates drinking jello?
8,"I'm Wilfred Brimley, and I have diabeetiss."
9,Party drugs are cheaper than insulin (in the US)
