,Comments
0,"Dank[.](https://i.imgur.com/3bQtuMO.png)

---

[we have a minecraft server](https://discord.gg/fNyb7G5)"
1,"watched 2 girls 1 cup with my gf.


She's not my gf anymore."
2,"\>let her choose the movie

\>she chooses her favourite

\>it's BBC gangbang"
3,Ben10 porn hentai furry porn transformers anal pov
4,Maybe her parent's sex tape wasn't a good choice
5,"fine i’ll let her choose, she’s not ready for my Overwatch D.VA cumshot compilation video"
6,Taxi driver vibes
7,"Let her chooses the movie:
She chooses gay porn."
8,Me and my sister.
9,"
Actual first step: Get someone"
10,Backdoor Sluts #9
11,Try playing some cbat to spice things up
12,Op hopes she picks pegging
13,Until you find out her favorite was woman wearing fake dicks and fucking a man in his anus
14,Lmao. It’s always the other way around for me. Girls are into some sick shit.
15,Maybe try to spice up this subreddit by SHARING YOUR OWN FUCKING MEMES
16,"Then she picks ""Slut gets gangbanged by 12 BBCs"". Yeesh"
17,What's next? Fucking some wet dude that controls cops?
18,What ? You don’t watch vaccumed prolapse gangbang ??
19,*she plays porn of a guy similar to you getting his brains fucked out*
20,My girls freakier than me. I say we watch our porn separately and meet up later when we're ready.
21,The pro tip it’s Pro in deed
22,When she finds out you watch furry porn
23,There are these movies like “pleasure planet” or something once we watched and honestly it was pretty hot for us both
24,Sending this to my gf wish me luck
25,Me and my date when she realizes I'm into sissy furry porn
26,Please do not mention anything porn related with that animated bunny involved. I’ve already seen some horrifying shit
27,She chooses zootopia yiff
28,"Idk man. I dont think i shouldve showed  this stuff to my rabbit.

[ Btw the video she chose.... I can never see carrots in the same way again]"
29,[Survivor did it better](https://imgur.com/uO1e2By.gif)
30,"“Babe, does this femboy sissygasm compilation not turn you on?”"
31,"My brother in christ, I am single as shit and watching porn makes me feel even worse ( so I don’t watch it, lol; I may like hurting myself, but that is too much )

Good meme tho, just wanted to vent"
32,I mostly just read Zootopia porn so....
33,he showing her the zootopia pages on rule 34
34,Wow the rabbit is so fuckable
35,This post brought back a great memory: gf blowing me while I watched 2 vampire lesbians pleasuring each other on screen!
36,You tellin me she's not into lesbians milking and spitting each other?
37,Taxi driver moment
38,I only watch porn with the boys
39,"100% let her pick it. Make sure to keep her comfortable with it and that she knows you won't judge her. You'd be surprised at the types of things you find your significant other is into just doing this. It's brought me and anyone I date to a whole new level sexually, most of the time. Sometimes you'll date someone that just isn't into porn at all and that's just as okay. I've noticed that my girlfriend will want to try something and she's nervous to tell me. She will pick a video containing exactly that and I'll notice her looking at my reaction. So I act like everything she puts on is the greatest thing ever. I'm down for just about anything anyways."
40,"Yeah tried that, she didn’t speak the whole rest of the night"
41,"Judy's face was me when a classmate showed me badly animated, badly 3d modeled cartoon characters being vored or fucking each other's peeholes.. And they were futas because all the weird 3d porn is always futas😐

And then said classmate proceeded showing me some dude hanging his whole body from a rope tied to his balls with the spiderman theme in the background😶

Went to the principal and the school inforced new rules on digital devices.."
42,Efukt . com is hilarious to watch drunk with partner or friends
43,"He probably shouldn't have showed her all the 3D animated porn about her own character, though. Not the wisest move."
44,Twist of fate she watches lesbian porn and leaves you to explore her sexuality with her girlfriend and I couldn't blame her. I'm so straight if I was a woman I would be lesbian.
45,"""WHAT THE FUCK IS THAT SHADOW'S DICK!?"""
46,The fact you chose Zootopia as your porn meme tells me something about your browsing history.
47,Zootopia porn 👌🏼
48,Why is this meme
49,Judy’s reaction is my face when she pulls up the “5 BBC BRUTALLY GANGR*PE SNOWBUNNY AND FORCE HER TO RIMJOB PISSING IN MOUTH + SCAT” unlisted video on RedTube that she has bookmarked.
50,Fun time with the family
51,"I did, next thing I knew her feet was in my face"
52,Its futanari furry porn 💀
53,What to do if she genuinely doesn't know what to pick because she doesn't watch porn?
54,"\>let her choose, she’s the pedofile"
55,"In the world of Anthropomorphic Animals. Are cross animal relationships considered interracial? Or interspecies? Surely it's Interspecies right? Like a humam and a dog for example. Because wouldn't a Fennec Fox and an Arctic Fox be more akin to interracial? Like a white human and asian human, for example?"
56,"Ah yes, what a terrible day to be able to read"
57,Disgusting
58,That's good advice.
59,Watership Down
60,her?
61,"Here is a tip.  Don’t do this unless she suggest it.  Then worry that your not doing enough or doing it right. 

Just saying"
62,“I swear it’s not actually her stepbrother”
63,The facial expressions In this movie were just 👌
64,Maybe she got surprised that she was in it?
65,"“Babe, and the plot twist is these 2 girls aren’t *actually* eating chocolate ice cream”"
66,"she will choose a romantic one, sex will be the same as before"
67,Lets just say she got really turned off when they spread her butthole and pointed the camera at it :(
68,i hit up koikatsu
69,Tried that with an ex girlfriend once. She just wanted to watch sounding videos. I'm glad she is an ex.
70,BACKDOOR SLUTS 9?
71,Turned out quite well actually
72,And the guy chose the tamest video he liked
73,was it this? [NSFW](https://d.furaffinity.net/art/laser/1627228708/1627228683.laser_laser_icecream_fa.jpg)
74,How would y'all feel if you let her choose and she chooses pegging porn
75,Mfw when she chooses cuckold gangbang porn
76,"My wife will occasionally watch porn with me, but she has told me it really doesn’t do much for her, however, my ex girlfriend use to go out and rent porn on VHS. . .good times!"
77,"I don't think I will.
 
my gf is way more kinky than me."
78,It’s all fun and games until you find out gang bang is more popular with women than men
79,Degeneracy.
80,let her choose for real th
81,Cof cof breaking the quiet cof cof
82,"I got a reall nasty kink, i like to cuddle."
83,Watching porn together doesn't really spice things up.  It usually results in a few laughs and doesn't do much more than serve as a distraction.  Usually gets turned off within 10 minutes.  Making porn together on the other hand can be very erotic.  Pictures are more fun than videos by the way.  You can do a lot with them as far as posing and all that goes.  You can also use them as a reference for a drawing or painting or something.  Have fun out there reddit.
84,Yeah i guess watching BBW busty amputee midget BBC anal gangbang was not best place to start with
85,or she's bisexual and you both love lesbian porn or  women who do it them selfes. so you both are happy and h0rny
86,“I don’t look like any of these girls”
87,man fuck big tit woman
88,It’s the same result either way. Women watch weird shit too. They aren’t saints lmao
89,"been there, done that....   


Update: she left me and she is in relationship with her bestfriend"
90,Lol at the porn rotted bastards in the comments. It’s laughably pathetic.
91,my girlfriend in college was cool with girls gone wild videos while she had her red week
92,I always let her pick when we watch porn. Its way safer
93,"I tried watching ""The wolf of Wall Street""  with a girl I was dating, but she seemed very unimpressed and would not let me get close to her during and after the movie.

Her ex told me that she was a freak in the sheets, but watching ""The wolf of Wall Street"" with me was apparently too much for her."
94,I would rather be waterboarded than share my favorite porn playlist with someone I actually know. (And I've been waterboarded for about one minute before. Would not recommend)
95,My gf watch the same shit as me which is funny
96,"lol, most of porn is just made for cis men anyway. So when you see something hot, she sees something focusing on male pleasure instead of equal/her pleasure.

That's the beauty of being bi though. I enjoy it regardless of who it was targeted to"
97,"Let her choose a movie : 
She chooses uncensored Hentai 😋"
98,Taxi Driver moment
99,Bruh
100,"A scene from ""Taxi Driver"""
