,Comments
0,"downvote this comment if the meme sucks. upvote it and I'll go away.

---

[Join us on discord for Saturday Movie Nights!](https://discord.gg/jsd6Ja9pvJ)"
1,You can find porn at Wikipedia???
2,My favourite feature of Wikipedia is that the list of serial killers is incomplete and I can help by expanding it
3,ah yes. those sweet sweet renaissance art titties.
4,No joke the wikipedia article for ejaculation was my first introduction to online porn material. There was a high quality gif of a guy ejaculating hands free and it's the first thing I jerked to at age 12 as far as I'm aware. I think that was the start of a lot of repressed shit lmao
5,The Wikipedia for masturbation taught me how to jerk off.
6,finding porn in childrens science books
7,Scrolling through the entire 3DS eShop and jerking off to all the hentai games before it shuts down.
8,"1. Normal
2. Legend
3. Ultra Legend"
9,Finding porn on YouTube is also a great mid tier
10,Wikimedia commons
11,Watching 3D porn with a 3DS
12,[Wiki has the best content](https://en.wikipedia.org/wiki/Teabagging )
13,sauce?
14,That's disgusting! Where?
15,The illustration of bukakke on Wikipedia always makes me laugh.
16,Cock and Ball Torture (CBT)
17,Cock and ball torture: The full experience
18,You guys don't find porn in the mirror?
19,What about not watching porn at all?
20,"""all of the above"""
21,I had a god kind at age 10
22,I need some Wikipedia sauce to watch at school
23,Sauce?
24,"Yeah, like the enumclaw case"
25,I did t and now I can't come closer to anything remotely related to WW2 wihout getting a erection
26,At en dot …
27,Not sure who the hell uses pornh8b anymore ever since the purge but..
28,Wait wiki have porn?? Omg Where??
29,But how? It's for science purposes.
30,Using porn on Pinterest
31,I was shocked by this actually!! I was curious about the history of anal sex (when it was popularized/demonized and whatnot) and the picture on the Wikipedia page for anal was just straight up drawn porn. Quite a surprise
32,"Look up Seedfeeder, you won't be disappointed"
33,What's that's absolutely disgusting. Where?
34,"Cock and ball torture from wikipedia

Cock and ball torture (CBT), occasionally known as penis torture, dick torture, or male genitorture/male genital torture, is a sexual activity involving the application of pain or constriction to the penis or testicles. This may involve directly painful activities, such as genital piercing, wax play, genital spanking, squeezing, ball-busting, genital flogging, urethral play, tickle torture, erotic electrostimulation, kneeing or kicking.[1] The recipient of such activities may receive direct physical pleasure via masochism, or emotional pleasure through erotic humiliation, or knowledge that the play is pleasing to a sadistic dominant. Many of these practices carry significant health risks.[2]"
35,Writing 80085 on my casio calculator
36,The illustration for cum shot on Wikipedia is actually hilarious
37,"A few months ago, we did Wikipedia races instead of doing school work.

And almost every time I'd win, I would end up passing child pornography in that race."
38,Part of me know all this shit was because I read Greek mythology on Wiki
39,Finding porn on wikipedia on your kindle
40,How's there porn on wikipedia?
41,fr wikipedia was my gateway drug
42,the article for hentai did it for me
43,💡
44,"I create porn using imagination 

Especially when the internet is down"
45,Them golden oldies suck dick like a lollipop
46,"Finding porn in Bible 



When I was young  I got a boner while reading Song of Solomon. True story"
47,At en.wikipedia.org
48,Twitter porn is much higher quality than PornHub porn; change my mind.
49,"Ah, Anne Frank. Always gives me to best nut"
50,"Hell I would look up ""sex position"" and that was a goldmine for 12y/o me"
51,where can i find porn on wikipedia!?
52,You can also help by expanding the list of porn
53,Wikipedia futanari page 🤤
54,"Well, technically it's educational stuff. But on the other hand"
55,https://en.wikipedia.org/wiki/Pornography
56,[deleted]
57,It's so sad that people kill cereals. Leave my frosted flakes alone!
58,"Omg me too,we have so much in comon,should probably go on a hunt together,also easier to get rid of the bodies"
59,">This is a dynamic list and may never be able to satisfy particular standards for completeness. You can help by **adding missing items** with reliable sources.

did they change it or am i in the wrong [link](https://en.wikipedia.org/wiki/List_of_serial_killers_by_number_of_victims)"
60,Bro same
61,Well that's me browsing Encarta when i was 12
62,Nice cock bro
63,You jerked it to another guy jerking it…?
64,"Same here, except mine was on anything nudity-related, cause I think my parents banned porn"
65,Alas I think the gif is gone now
66,"Mine was rumors from a friend

Then first time I saw that stuff was as a dare from some other friends. We just went outside and searched stuff like ”sex”, ”penis” and ”pussy” on my phone 

We were like ”Eewwewwww” after 2 seconds of looking at it"
67,Gey🫵🤣
68,What are u? A texas suburb mom?
69,"HELLO, FBI? Yes....  this one over here!"
70,Wikipedia article to 69
71,no guys don't make this mistake i once entered there i left with chronical brain trauma
72,Wikipedia
73,wikipedia
74,"DO NOT GO ON THERE AND LOOK AT THE PICTURES

YOU WILL LEAVE WITH SEVERE MENTAL TRAUMA

THIS IS NOT A DRILL"
75,explain to me how these wikipedia races work
76,search up anal on wikipedia
77,*in the other hand
78,"Okay, who’s fapping to the pottery? Personably I prefer to use the pottery for clean up, not material."
79,It seems like you know about the theme
80,Average reddit nft owner
81,"If that's true, then you're just stating a fact. Why are people downvoting you?"
82,Save the cereal
83,#seriallivesmatter
84,Destroy all cereals they are too overrated
85,Yes fbi this comment right here.
86,Those Fuckers changed it
87,"Turns out I'm bi as fuck, boiiiii"
88,"""Wait, gay people exist?"""
89,"He did not, guy was hands free"
90,"Wasn't that bad, i'm seriously not moved by that kinda stuff"
91,Really? Lemme check
92,"Start from one thing, like a tree, and end up on another thing, like a furry.

No references or searching allowed. Only links that are in the article."
93,There's nothing
94,Any port in a storm
95,its a fact
96,"It is true. It's on the wikipedia commons, one of my classmates was suspended when a link was sent to him, and it's wikipedia, so hey, what the fuck could go wrong?"
97,And because people like to hide from the truth.
98,Except for Frosted Flakes. That tiger fucker deserves to die
99,U'll never find me
100,Bro u gay !!
