,Comments
0,"downvote this comment if the meme sucks. upvote it and I'll go away.

---

[Join us on discord for Saturday Movie Nights!](https://discord.gg/jsd6Ja9pvJ)"
1,I'm never gonna wipe again
2,"2/10. This is what happened to my girl, it was such mess, would never do anal again"
3,Bidet from now on
4,U ok?
5,"Ayo I'm takin a shit rn, fuck"
6,"""Dank"" memes!!! Not Dark memes!!!"
7,Shitty meme
8,Remember boys. This is why we do no shit September
9,Cross my fingers and hope I'm next.
10,Guilty butt have got no rhythm
11,🤨📸
12,That's why you don't fuck the person you're murdering
13,Though it's easy to shit again
