,Comments
0,"downvote this comment if the meme sucks. upvote it and I'll go away.

---

[Join us on discord for Saturday Movie Nights!](https://discord.gg/jsd6Ja9pvJ)"
1,What is on the left side ?
2,"Request for an TV license.
Apparently if you live in England you have to manually buy a TV license so you can watch and stream BBC stuff.
You click on “i have a TV license” and that’s it.
Apparently they reinforce it in England with officers coming to your house and checking on you, but well…"
3,What if I’m not into BBC stuff but still into interracial stuff do I still need it ?
4,Naw only for BBC stuff. Other stuff is ok.
