,Comments
0,"Bitch you just insulted an entire platform of people, but yes."
1,I feel like political reddit user and normal reddit user are two opposite.
2,Oh God I need to start working.
3,"WOW 500 UPVOTE 
thanks to everyone for everything guys, I have recently been helping and for me this is a great achievement. thanks again everyone for the support <3"
4,"One of us, one of us, one of us."
5,I dont really get it explain ples :)
6,"I'm part of this platform too, that's us, we can't do anything about it hahah"
7,I agree
8,Reddit users are lazy and do nothing all day
