,Comments
0,"downvote this comment if the meme sucks. upvote it and I'll go away.

---

[Join us on discord for Saturday Movie Nights!](https://discord.gg/jsd6Ja9pvJ)"
1,When the asian kids HIV report is HIV negative.
2,Indian parents when their child gets A not A+
3,"You are a disgrace to the family, come back when Doctor."
4,"Son, we are Asian, not Bsian"
5,Stoobid
6,...in the blood test
7,"It's funny that in my country, you could go to a Masters and finish it with a B+ GPA, even at the top schools. You don't need to be perfect to be a success.

I only got As every now and then in my Bachelors, and I was able to climb the academic ladder just fine. Seriously my whole Bachelors transcript is littered with Cs and Bs. Trying to be perfect is a pointless headache."
8,No room for the Bsians
